,author_id,author_id_new,conv_id_new,conversation_id,created_at,entities.mentions,id,id_new,in_reply_to_user_id,lang,public_metrics.like_count,public_metrics.quote_count,public_metrics.reply_count,public_metrics.retweet_count,referenced_tweets,reply_settings,source,text,users.created_at,users.description,users.id,users.name,users.public_metrics.followers_count,users.public_metrics.following_count,users.public_metrics.listed_count,users.public_metrics.tweet_count,users.username,users.verified
0,54853035,author_id: 54853035,coversation_id: 955787200980975617,955787200980975617,2018-02-16T09:45:54.000Z,"[{'start': 0, 'end': 11, 'username': 'cbicarolyn', 'id': '4178442737'}]",964435662542966784,id: 964435662542966784,4178442737,und,0,0,0,0,"[{'type': 'replied_to', 'id': '955787200980975617'}]",everyone,Twitter Web Client,@cbicarolyn https://t.co/Jv6DJ3UWs8,2009-07-08T09:58:27.000Z,"politically homeless..anti mass immigration and open borders,, anti lying  career politicians.., boris is a immigration enabler,proud right winger",54853035,englands glory,3796,2427,29,150535,bestofbritish2,False
1,786905782268944384,author_id: 786905782268944384,coversation_id: 955787200980975617,955787200980975617,2018-01-25T22:45:03.000Z,"[{'start': 17, 'end': 28, 'username': 'cbicarolyn', 'id': '4178442737'}]",956659206714740737,id: 956659206714740737,1731305665,und,0,0,0,0,"[{'type': 'quoted', 'id': '956485643353325569'}, {'type': 'replied_to', 'id': '955801609971339264'}]",everyone,Twitter Web Client,@HounslowChamCEO @cbicarolyn https://t.co/RvDEtMTm9I,2016-10-14T12:25:33.000Z,"BeeKeeper, Dog lover. A believer in training UK School leavers before importing skills, Brexit supporter. UK needs to take back control of its future.",786905782268944384,as,518,439,17,62271,sksanglia,False
2,544595876,author_id: 544595876,coversation_id: 955787200980975617,955787200980975617,2018-01-23T20:20:51.000Z,"[{'start': 0, 'end': 11, 'username': 'cbicarolyn', 'id': '4178442737'}]",955898143928999938,id: 955898143928999938,4178442737,en,0,0,0,0,"[{'type': 'replied_to', 'id': '955787200980975617'}]",everyone,Twitter for iPhone,"@cbicarolyn Why did the CBI want to appease the Nazis in 1939?
That’s a terrible track record.
Why did you back joining the disastrous euro and ERM?
Why did you lie about food prices when EU tariffs make them more expensive?
Are you stooges for the EU?",2012-04-03T21:13:07.000Z,"The Institute for Studies, a leader in the field of studies since 1920.",544595876,The Institute for Studies,675,2067,7,3813,InstForStudies,False
3,1731305665,author_id: 1731305665,coversation_id: 955787200980975617,955787200980975617,2018-01-23T13:57:16.000Z,"[{'start': 0, 'end': 11, 'username': 'cbicarolyn', 'id': '4178442737'}, {'start': 12, 'end': 23, 'username': 'cbicarolyn', 'id': '4178442737'}]",955801609971339264,id: 955801609971339264,4178442737,en,1,0,1,1,"[{'type': 'replied_to', 'id': '955787200980975617'}]",everyone,Twitter for Android,@cbicarolyn @cbicarolyn I do not see the evidence. The negotiations are a joke. The politics are a farce and the real story is that SMEs are not being helped pre BREXIT into new markets. Action now in readiness for whatever we get. No value in waiting.,2013-09-05T08:30:46.000Z,Executive Director @WestmontHub_UWL -Incubation - Ideas Factory - @UniWestLondon - fostering #entrepreneur #innovation #startup - RT is not an endorsement.,1731305665,Stephen FRY,2602,2003,196,29587,ExecDirWestmont,False
