,author_id,author_id_new,conv_id_new,conversation_id,created_at,entities.mentions,id,id_new,in_reply_to_user_id,lang,public_metrics.like_count,public_metrics.quote_count,public_metrics.reply_count,public_metrics.retweet_count,referenced_tweets,reply_settings,source,text,users.created_at,users.description,users.id,users.name,users.public_metrics.followers_count,users.public_metrics.following_count,users.public_metrics.listed_count,users.public_metrics.tweet_count,users.username,users.verified
0,2919866169,author_id: 2919866169,coversation_id: 753149432955342849,753149432955342849,2016-07-19T13:14:16.000Z,"[{'start': 0, 'end': 10, 'username': 'JunckerEU', 'id': '169426475'}, {'start': 11, 'end': 20, 'username': 'vestager', 'id': '19232649'}]",755390299535446016,id: 755390299535446016,169426475,en,0,0,0,0,"[{'type': 'replied_to', 'id': '753149432955342849'}]",everyone,Twitter Web Client,"@JunckerEU @vestager 
bail in is unconstitutional . Europeans arm yourself against these bureaucrats",2014-12-13T16:42:10.000Z,,2919866169,Carol%Philip,10,86,0,3910,MarcoRossignan,False
1,3030868045,author_id: 3030868045,coversation_id: 753149432955342849,753149432955342849,2016-07-14T07:20:54.000Z,"[{'start': 0, 'end': 10, 'username': 'JunckerEU', 'id': '169426475'}]",753489431877869568,id: 753489431877869568,169426475,en,0,0,0,0,"[{'type': 'replied_to', 'id': '753149432955342849'}]",everyone,Twitter for iPad,@JunckerEU You sank our steel industry in the UK. One of the many reasons we are leaving the EU. Poor decisions at a snails pace.,2015-02-19T17:19:24.000Z,Too many people on Twitter that take themselves too seriously.  let’s shake ‘em up a little.,3030868045,Inda Cage,81,169,2,6771,valleyofpain,False
2,752985433383067652,author_id: 752985433383067652,coversation_id: 753149432955342849,753149432955342849,2016-07-14T07:08:19.000Z,"[{'start': 0, 'end': 10, 'username': 'JunckerEU', 'id': '169426475'}]",753486266189115392,id: 753486266189115392,169426475,en,0,0,0,0,"[{'type': 'replied_to', 'id': '753149432955342849'}]",everyone,Twitter Web Client,@JunckerEU #EUChina ? I think you must mean #Eurasia !,2016-07-12T21:58:12.000Z,,752985433383067652,Spartan Economy,0,17,0,15,SpartanEconomy,False
3,4925431415,author_id: 4925431415,coversation_id: 753149432955342849,753149432955342849,2016-07-13T22:12:42.000Z,"[{'start': 0, 'end': 10, 'username': 'JunckerEU', 'id': '169426475'}]",753351475435364352,id: 753351475435364352,169426475,en,1,0,0,0,"[{'type': 'replied_to', 'id': '753149432955342849'}]",everyone,Twitter for iPhone,@JunckerEU do you think it is ok to be drunk during working hours? https://t.co/dvBGYNSfM7,2016-02-17T21:49:40.000Z,burger.vader.mol.biol.virologie.cancer.genomics,4925431415,Moos Jakobson,683,1266,5,13198,moos_tbe,False
4,2978060121,author_id: 2978060121,coversation_id: 753149432955342849,753149432955342849,2016-07-13T21:20:44.000Z,"[{'start': 0, 'end': 10, 'username': 'JunckerEU', 'id': '169426475'}]",753338395099791362,id: 753338395099791362,169426475,en,0,0,0,0,"[{'type': 'replied_to', 'id': '753149432955342849'}]",everyone,Twitter Web Client,@JunckerEU No one will trade with you on EU terms.,2015-01-14T14:00:02.000Z,Trainspotter. Amateur political pundit. Remainer scum. A follow is not an endorsement.,2978060121,Simon,91,454,2,5835,atthe404,False
5,29559070,author_id: 29559070,coversation_id: 753149432955342849,753149432955342849,2016-07-13T16:18:45.000Z,"[{'start': 0, 'end': 10, 'username': 'JunckerEU', 'id': '169426475'}, {'start': 11, 'end': 23, 'username': 'MalmstromEU', 'id': '460966881'}]",753262398027497472,id: 753262398027497472,169426475,fr,0,0,0,0,"[{'type': 'replied_to', 'id': '753149432955342849'}]",everyone,Twitter for iPhone,@JunckerEU @MalmstromEU et sanctions à la clé ? Sinon ça ne sert juste à rien en fait ?,2009-04-07T22:06:28.000Z,"Enterprise Architect / Fondateur du cabinet Manae / Passionné de conquête spatiale, de sciences et d’Europe / Je lis ce que je partage !",29559070,Gabriel Chatrousse 🚀🛰🪐,490,555,45,27085,CommanderHam,False
6,187132088,author_id: 187132088,coversation_id: 753149432955342849,753149432955342849,2016-07-13T16:13:39.000Z,"[{'start': 0, 'end': 10, 'username': 'JunckerEU', 'id': '169426475'}]",753261116332056576,id: 753261116332056576,169426475,en,1,0,0,0,"[{'type': 'replied_to', 'id': '753149432955342849'}]",everyone,Twitter for Android,@JunckerEU selling out Europe.,2010-09-05T10:32:07.000Z,Onderweg... |Spanje tweet op persoonlijke titel​ Keep calm and drink a Carajillo,187132088,#corona is de #NWO #nexit #pro #EEG #anti #eu,794,415,53,86124,kevbrijer,False
7,545054637,author_id: 545054637,coversation_id: 753149432955342849,753149432955342849,2016-07-13T12:22:21.000Z,"[{'start': 14, 'end': 24, 'username': 'JunckerEU', 'id': '169426475'}]",753202906304741376,id: 753202906304741376,362726479,en,0,0,0,0,"[{'type': 'replied_to', 'id': '753150652604350464'}]",everyone,Twitter for iPhone,"@aalenian2009 @JunckerEU they will Monitor AND Report , both are considered as action in EU business language, just like ""immigrants""",2012-04-04T09:00:07.000Z,Never take anything for granted. I am in love with my daughter and my wife.,545054637,Geor Kassiteropoulos,60,122,0,499,georgekassitero,False
8,43564459,author_id: 43564459,coversation_id: 753149432955342849,753149432955342849,2016-07-13T10:21:36.000Z,"[{'start': 0, 'end': 10, 'username': 'JunckerEU', 'id': '169426475'}]",753172519528632321,id: 753172519528632321,169426475,en,0,0,0,0,"[{'type': 'replied_to', 'id': '753149432955342849'}]",everyone,Twitter Web Client,@JunckerEU The best thing is to be in closer relation with China it is great partner really,2009-05-30T17:54:06.000Z,"Being an individual makes me who I am, Human right defender.",43564459,ZEI DAN,273,1028,3,8049,Zei_Dan2,False
9,1704102908,author_id: 1704102908,coversation_id: 753149432955342849,753149432955342849,2016-07-13T09:57:46.000Z,"[{'start': 0, 'end': 10, 'username': 'JunckerEU', 'id': '169426475'}]",753166522793791488,id: 753166522793791488,169426475,en,0,0,0,0,"[{'type': 'replied_to', 'id': '753149432955342849'}]",everyone,Twitter for Android,"@JunckerEU you missed the boat mate, thats old news where the damage has already been done, best if you focus on more immediate issues 😨",2013-08-27T08:25:50.000Z,"Carpenter/Joiner, Electronics repair enthusiast.
Conspiracy theories are the truth unrealised.",1704102908,Postcrete Malone,957,783,11,80566,ksw1monk,False
10,516736640,author_id: 516736640,coversation_id: 753149432955342849,753149432955342849,2016-07-13T09:50:02.000Z,"[{'start': 0, 'end': 12, 'username': 'EfffingTory', 'id': '141941027'}, {'start': 13, 'end': 23, 'username': 'JunckerEU', 'id': '169426475'}]",753164574359187456,id: 753164574359187456,141941027,en,0,0,2,0,"[{'type': 'replied_to', 'id': '753162319002087424'}]",everyone,Twitter for Android,@EfffingTory @JunckerEU He was the top candidate of the European People's Party and was confirmed as EC President by the Parliament.,2012-03-06T18:04:14.000Z,Too many RTs,516736640,hyperlynXXX,49,626,4,6909,hyperlynXXX,False
11,516736640,author_id: 516736640,coversation_id: 753149432955342849,753149432955342849,2016-07-13T09:34:44.000Z,"[{'start': 10, 'end': 20, 'username': 'JunckerEU', 'id': '169426475'}]",753160723669327872,id: 753160723669327872,313572947,en,0,0,0,0,"[{'type': 'replied_to', 'id': '753155013631967233'}]",everyone,Twitter for Android,@isowave1 @JunckerEU Don't shift the blame here. https://t.co/gaPmxpoQ7w,2012-03-06T18:04:14.000Z,Too many RTs,516736640,hyperlynXXX,49,626,4,6909,hyperlynXXX,False
12,516736640,author_id: 516736640,coversation_id: 753149432955342849,753149432955342849,2016-07-13T09:33:41.000Z,"[{'start': 0, 'end': 12, 'username': 'EfffingTory', 'id': '141941027'}, {'start': 13, 'end': 23, 'username': 'JunckerEU', 'id': '169426475'}]",753160459663048704,id: 753160459663048704,141941027,en,0,0,1,0,"[{'type': 'replied_to', 'id': '753159148523487233'}]",everyone,Twitter for Android,"@EfffingTory @JunckerEU He is elected, though.",2012-03-06T18:04:14.000Z,Too many RTs,516736640,hyperlynXXX,49,626,4,6909,hyperlynXXX,False
13,353075548,author_id: 353075548,coversation_id: 753149432955342849,753149432955342849,2016-07-13T09:46:27.000Z,"[{'start': 0, 'end': 10, 'username': 'JunckerEU', 'id': '169426475'}]",753163674173472768,id: 753163674173472768,169426475,en,0,0,0,0,"[{'type': 'replied_to', 'id': '753149432955342849'}]",everyone,Twitter Web Client,@JunckerEU look at Hinckley Point!! could've done with you doing something a long time ago,2011-08-11T14:25:29.000Z,,353075548,Ozzie,186,911,8,21503,UpTheLilywhites,False
14,44155907,author_id: 44155907,coversation_id: 753149432955342849,753149432955342849,2016-07-13T09:30:25.000Z,"[{'start': 0, 'end': 15, 'username': 'AmanSiddLondon', 'id': '2969797444'}, {'start': 16, 'end': 26, 'username': 'JunckerEU', 'id': '169426475'}]",753159639831810049,id: 753159639831810049,2969797444,en,0,0,0,0,"[{'type': 'replied_to', 'id': '753151578094395392'}]",everyone,Twitter for Windows Phone,@AmanSiddLondon @JunckerEU well good that UK it's leaving so it will stop vetoing all EU reforms,2009-06-02T16:57:00.000Z,XIX/XX century history and WWII (modern too ;) aviation fan with some gaming skills.,44155907,Bartek Jankowski,44,233,3,1920,The_Tau,False
15,44155907,author_id: 44155907,coversation_id: 753149432955342849,753149432955342849,2016-07-13T09:27:47.000Z,"[{'start': 10, 'end': 20, 'username': 'JunckerEU', 'id': '169426475'}]",753158975508647936,id: 753158975508647936,313572947,en,0,0,0,0,"[{'type': 'replied_to', 'id': '753155013631967233'}]",everyone,Twitter for Windows Phone,"@isowave1 @JunckerEU well plans were much earlier, bad it was voted by UK gov in the name of ""free trade"" and did relations with china",2009-06-02T16:57:00.000Z,XIX/XX century history and WWII (modern too ;) aviation fan with some gaming skills.,44155907,Bartek Jankowski,44,233,3,1920,The_Tau,False
16,44155907,author_id: 44155907,coversation_id: 753149432955342849,753149432955342849,2016-07-13T09:00:53.000Z,"[{'start': 0, 'end': 14, 'username': 'DressBagShoes', 'id': '44620154'}, {'start': 15, 'end': 25, 'username': 'JunckerEU', 'id': '169426475'}]",753152206979919872,id: 753152206979919872,44620154,en,0,0,0,0,"[{'type': 'replied_to', 'id': '753150296788983808'}]",everyone,Twitter for Windows Phone,"@DressBagShoes @JunckerEU there was a EU plan to block them much earlier,bad it was vetoed by UK gov and their golden era relation with PRCh",2009-06-02T16:57:00.000Z,XIX/XX century history and WWII (modern too ;) aviation fan with some gaming skills.,44155907,Bartek Jankowski,44,233,3,1920,The_Tau,False
17,3200012582,author_id: 3200012582,coversation_id: 753149432955342849,753149432955342849,2016-07-13T09:29:42.000Z,"[{'start': 0, 'end': 10, 'username': 'JunckerEU', 'id': '169426475'}, {'start': 11, 'end': 25, 'username': 'EU_Commission', 'id': '157981564'}]",753159457606172672,id: 753159457606172672,169426475,und,1,0,0,1,"[{'type': 'replied_to', 'id': '753149432955342849'}]",everyone,Twitter for iPhone,@JunckerEU @EU_Commission 🍷👍,2015-05-17T09:40:35.000Z,von zwei Brücken Lothringen und Bar,3200012582,Christoph S.,172,33,25,24675,navisinvest,False
18,2444007770,author_id: 2444007770,coversation_id: 753149432955342849,753149432955342849,2016-07-13T09:02:41.000Z,"[{'start': 0, 'end': 10, 'username': 'JunckerEU', 'id': '169426475'}, {'start': 111, 'end': 125, 'username': 'EU_Commission', 'id': '157981564'}]",753152660942024704,id: 753152660942024704,169426475,en,0,0,0,0,"[{'type': 'replied_to', 'id': '753149432955342849'}]",everyone,Twitter Web Client,@JunckerEU. Two main issues: overcapacity in the #steel sector and market #economy status for #China. #EUChina @EU_Commission,2014-04-14T14:42:09.000Z,Suivez toute l'info juridique en un clic sur #ActuDroitBelge #justice #begov #belgique #loi #avocat #huissier #immobilier #architecte #notaire #bruxelles,2444007770,Actualitésdroitbelge,1694,3182,78,5288,ActuDroitBelge,False
19,972036398,author_id: 972036398,coversation_id: 753149432955342849,753149432955342849,2016-07-13T08:59:51.000Z,"[{'start': 0, 'end': 10, 'username': 'JunckerEU', 'id': '169426475'}]",753151944357732352,id: 753151944357732352,169426475,en,0,0,0,0,"[{'type': 'replied_to', 'id': '753149432955342849'}]",everyone,Twitter for iPad,@JunckerEU countries can do that for themselves,2012-11-26T14:11:14.000Z,I don’t believe we can leave #EU peacefully or in politicians a word synonym for Maffia. I do believe that people should stand-up 4 freedom again,972036398,🎗️Westerse waarden 🚜🚜🐖🐖☠️🇪🇺🇧🇪☠️,73,345,2,119390,WesterseWaarden,False
20,20857682,author_id: 20857682,coversation_id: 753149432955342849,753149432955342849,2016-07-13T08:59:06.000Z,"[{'start': 0, 'end': 10, 'username': 'JunckerEU', 'id': '169426475'}]",753151758025814016,id: 753151758025814016,169426475,en,0,0,0,0,"[{'type': 'replied_to', 'id': '753149432955342849'}]",everyone,Twitter for Android,@JunckerEU The end of the EU is nigh!!!!,2009-02-14T17:00:25.000Z,,20857682,Jason Simms,53,23,1,873,Jason_Simms,False
21,44620154,author_id: 44620154,coversation_id: 753149432955342849,753149432955342849,2016-07-13T08:53:18.000Z,"[{'start': 0, 'end': 10, 'username': 'JunckerEU', 'id': '169426475'}]",753150296788983808,id: 753150296788983808,169426475,en,3,0,1,0,"[{'type': 'replied_to', 'id': '753149432955342849'}]",everyone,Twitter Web Client,"@JunckerEU Too little and too late for the British Steel industry, Mr Juncker.",2009-06-04T13:54:51.000Z,All views are my own. #democracyisprecious,44620154,Mandy 🇺🇦,2388,1479,46,9342,DressBagShoes,False
22,132272583,author_id: 132272583,coversation_id: 753149432955342849,753149432955342849,2016-07-13T08:50:49.000Z,"[{'start': 0, 'end': 10, 'username': 'JunckerEU', 'id': '169426475'}]",753149674010411008,id: 753149674010411008,169426475,en,0,0,0,0,"[{'type': 'replied_to', 'id': '753149432955342849'}]",everyone,Twitter for iPhone,@JunckerEU you ensured #brexit with your toxic rhetoric you sour little narcissist,2010-04-12T19:44:58.000Z,"2 toddlers’ social secretary | Reminiscent Blairite | ‘Fat’ - my wife | Ex-RAF, unbelievably | Infer what you like from my RTs",132272583,"Russian Warship, go fuck yourself",795,2845,7,38332,jonny5068,False
