,author_id,author_id_new,conv_id_new,conversation_id,created_at,entities.mentions,id,id_new,in_reply_to_user_id,lang,public_metrics.like_count,public_metrics.quote_count,public_metrics.reply_count,public_metrics.retweet_count,referenced_tweets,reply_settings,source,text,users.created_at,users.description,users.id,users.name,users.public_metrics.followers_count,users.public_metrics.following_count,users.public_metrics.listed_count,users.public_metrics.tweet_count,users.username,users.verified
0,102423251,author_id: 102423251,coversation_id: 902525404686233600,902525404686233600,2017-10-25T16:53:02.000Z,"[{'start': 0, 'end': 14, 'username': 'WilliamJHague', 'id': '122994639'}, {'start': 15, 'end': 25, 'username': 'Telegraph', 'id': '16343974'}]",923230936472477696,id: 923230936472477696,122994639,en,0,0,0,0,"[{'type': 'replied_to', 'id': '902525404686233600'}]",everyone,Twitter Web Client,"@WilliamJHague @Telegraph at last second they will present us with a fait accompli trade agreement in their favour and say no time to negotiate, take it or leave it",2010-01-06T17:07:00.000Z,,102423251,dave james,54,142,2,10778,davejames11,False
1,242071368,author_id: 242071368,coversation_id: 902525404686233600,902525404686233600,2017-09-03T17:01:52.000Z,"[{'start': 0, 'end': 14, 'username': 'WilliamJHague', 'id': '122994639'}, {'start': 15, 'end': 25, 'username': 'Telegraph', 'id': '16343974'}]",904388987674140672,id: 904388987674140672,122994639,en,0,0,0,0,"[{'type': 'replied_to', 'id': '902525404686233600'}]",everyone,Twitter Web Client,"@WilliamJHague @Telegraph Not their fault we got into this mess which neither of the  big UK  parties can resolve.EU will also suffer,if much less than will the UK",2011-01-23T21:42:48.000Z,ex Prof de Management,242071368,andy  kay,12,12,1,6630,gtaak,False
2,898150994814566400,author_id: 898150994814566400,coversation_id: 902525404686233600,902525404686233600,2017-09-03T15:14:22.000Z,"[{'start': 0, 'end': 14, 'username': 'WilliamJHague', 'id': '122994639'}, {'start': 15, 'end': 25, 'username': 'Telegraph', 'id': '16343974'}]",904361937374502912,id: 904361937374502912,122994639,ar,0,0,0,0,"[{'type': 'replied_to', 'id': '902525404686233600'}]",everyone,Twitter for Android,"@WilliamJHague @Telegraph من فضلكم  الاتحاد إلا

من فضلكم الاتحاد ال اوروبي",2017-08-17T11:54:18.000Z,,898150994814566400,Nasr Elsharkawy,7,116,0,811,NasrElsharkawy6,False
3,725932392318267392,author_id: 725932392318267392,coversation_id: 902525404686233600,902525404686233600,2017-08-31T19:54:37.000Z,"[{'start': 0, 'end': 14, 'username': 'WilliamJHague', 'id': '122994639'}, {'start': 15, 'end': 25, 'username': 'Telegraph', 'id': '16343974'}]",903345300861054978,id: 903345300861054978,122994639,en,0,0,0,0,"[{'type': 'replied_to', 'id': '902525404686233600'}]",everyone,Twitter for Android,@WilliamJHague @Telegraph Is that the fault of the voters too? Is there anything the Tory is responsible for?,2016-04-29T06:19:04.000Z,,725932392318267392,Craig ROBB,9,12,0,83,craigawrobb,False
4,138835699,author_id: 138835699,coversation_id: 902525404686233600,902525404686233600,2017-08-31T17:04:51.000Z,"[{'start': 0, 'end': 14, 'username': 'WilliamJHague', 'id': '122994639'}, {'start': 15, 'end': 25, 'username': 'Telegraph', 'id': '16343974'}, {'start': 44, 'end': 58, 'username': 'WilliamJHague', 'id': '122994639'}]",903302576770342912,id: 903302576770342912,122994639,en,0,0,0,0,"[{'type': 'replied_to', 'id': '902525404686233600'}]",everyone,Twitter Web Client,@WilliamJHague @Telegraph Excellent article @WilliamJHague.  I saw it on Gulf News - check out the ratings!,2010-04-30T19:00:54.000Z,Once Conservative. Councillor in Barrow. No fun at parties.,138835699,Sol 🇬🇧❤️🇺🇦,691,608,16,23817,SolWpolski,False
5,59155829,author_id: 59155829,coversation_id: 902525404686233600,902525404686233600,2017-08-31T10:25:53.000Z,"[{'start': 0, 'end': 14, 'username': 'WilliamJHague', 'id': '122994639'}, {'start': 15, 'end': 25, 'username': 'Telegraph', 'id': '16343974'}]",903202173399519232,id: 903202173399519232,122994639,en,0,0,0,0,"[{'type': 'replied_to', 'id': '902525404686233600'}]",everyone,Twitter for iPhone,"@WilliamJHague @Telegraph At some point, the UK might want to consider just walking out of Europe, agreement or not. The EU need to consider the consequences of that.",2009-07-22T15:32:21.000Z,,59155829,George Knighton,57,652,2,1607,GeorgeKnighton,False
6,4827768857,author_id: 4827768857,coversation_id: 902525404686233600,902525404686233600,2017-08-30T20:53:38.000Z,"[{'start': 0, 'end': 14, 'username': 'WilliamJHague', 'id': '122994639'}, {'start': 15, 'end': 25, 'username': 'Telegraph', 'id': '16343974'}]",902997762379309057,id: 902997762379309057,122994639,en,0,0,0,0,"[{'type': 'replied_to', 'id': '902525404686233600'}]",everyone,Twitter for Android,@WilliamJHague @Telegraph get real William. UK team a shambles and you know it.,2016-01-19T22:07:06.000Z,"Champagne socialist. Remainer, animal lover, railway enthusiast, stressed-out dad.",4827768857,¡Ay Caramba! 🇪🇺,494,802,0,2855,billgdavies,False
7,2482753710,author_id: 2482753710,coversation_id: 902525404686233600,902525404686233600,2017-08-30T18:09:40.000Z,"[{'start': 0, 'end': 12, 'username': 'KernowChris', 'id': '20457003'}, {'start': 13, 'end': 27, 'username': 'WilliamJHague', 'id': '122994639'}, {'start': 28, 'end': 38, 'username': 'Telegraph', 'id': '16343974'}]",902956501228236800,id: 902956501228236800,20457003,en,0,0,0,0,"[{'type': 'replied_to', 'id': '902525898129379328'}]",everyone,Twitter for Android,@KernowChris @WilliamJHague @Telegraph Oh dear lol.,2014-05-07T21:11:34.000Z,Dad | Husband | Long Suffering Spurs Fan | Economics & Mathematical Science 🎓 | Cambridgeshire based food reviewer (Cambridge Foodies) |  #crypto | #40k,2482753710,Simon 🇬🇧,827,581,144,53162,Honest_Sy1,False
8,459605279,author_id: 459605279,coversation_id: 902525404686233600,902525404686233600,2017-08-30T15:24:09.000Z,"[{'start': 0, 'end': 14, 'username': 'WilliamJHague', 'id': '122994639'}, {'start': 15, 'end': 27, 'username': 'MarkFoxNews', 'id': '1193256401872867335'}, {'start': 28, 'end': 38, 'username': 'Telegraph', 'id': '16343974'}]",902914847528161281,id: 902914847528161281,122994639,en,0,0,0,0,"[{'type': 'replied_to', 'id': '902525404686233600'}]",everyone,Twitter for iPad,@WilliamJHague @MarkFoxNews @Telegraph EU position is not to give an mm in belief UK will not/cannot walk. You can't blame them. But then why waste time and money negotiating.,2012-01-09T21:18:41.000Z,Many years of advising boards of stressed companies but now also finding time to sit and reflect.,459605279,David Wilton,70,75,1,2888,DavidWilton2,False
9,4832614198,author_id: 4832614198,coversation_id: 902525404686233600,902525404686233600,2017-08-30T15:01:54.000Z,"[{'start': 0, 'end': 14, 'username': 'WilliamJHague', 'id': '122994639'}, {'start': 15, 'end': 25, 'username': 'Telegraph', 'id': '16343974'}]",902909246215421952,id: 902909246215421952,122994639,en,4,0,0,0,"[{'type': 'replied_to', 'id': '902525404686233600'}]",everyone,Twitter for Android,@WilliamJHague @Telegraph Only reason for referendum in first place - too scared to take on UKIP. Tories created the mess we are now in.,2016-01-21T11:40:04.000Z,Not a member of any political party.  Career in secondary & further education. Previously elected parent governor & vice chair at primary school.,4832614198,Don Pedley,68,108,2,17364,DonPedley1,False
10,259239256,author_id: 259239256,coversation_id: 902525404686233600,902525404686233600,2017-08-30T14:37:16.000Z,"[{'start': 0, 'end': 14, 'username': 'WilliamJHague', 'id': '122994639'}, {'start': 15, 'end': 25, 'username': 'Telegraph', 'id': '16343974'}]",902903048267329536,id: 902903048267329536,122994639,en,2,0,0,0,"[{'type': 'replied_to', 'id': '902525404686233600'}]",everyone,Twitter Web App,@WilliamJHague @Telegraph Do you think it's helpful to Britain  to publicly state the last election result weakens our position in the Brexit negotiations?,2011-03-01T12:55:48.000Z,,259239256,Paul Tolliday,8,56,0,243,tollytweeter,False
11,2949217649,author_id: 2949217649,coversation_id: 902525404686233600,902525404686233600,2017-08-30T12:56:00.000Z,"[{'start': 0, 'end': 11, 'username': '1Brexiteer', 'id': '310995043'}, {'start': 12, 'end': 26, 'username': 'WilliamJHague', 'id': '122994639'}, {'start': 27, 'end': 37, 'username': 'Telegraph', 'id': '16343974'}]",902877564502507521,id: 902877564502507521,310995043,en,0,0,0,0,"[{'type': 'replied_to', 'id': '902870423989313536'}]",everyone,Twitter for iPad,@1Brexiteer @WilliamJHague @Telegraph 250 billion+4% tariff divided by 450 million = €2 a head. 320 billion+4% tariff divided by 65 million €19 euro a head. Duhhh.,2014-12-29T13:31:38.000Z,"Retired civil servant in various roles (national and international), former teacher of languages/translation, very 🏳️‍🌈 and proudly married.",2949217649,DóC,475,509,1,20953,DOCasBAC,False
12,2949217649,author_id: 2949217649,coversation_id: 902525404686233600,902525404686233600,2017-08-30T12:48:40.000Z,"[{'start': 0, 'end': 11, 'username': '1Brexiteer', 'id': '310995043'}, {'start': 12, 'end': 26, 'username': 'WilliamJHague', 'id': '122994639'}, {'start': 27, 'end': 37, 'username': 'Telegraph', 'id': '16343974'}]",902875716613754881,id: 902875716613754881,310995043,en,0,0,0,0,"[{'type': 'replied_to', 'id': '902870423989313536'}]",everyone,Twitter for iPad,@1Brexiteer @WilliamJHague @Telegraph You'll still have that deficit after you leave but with 4% tariffs. LOL! 350 million a week to the NHS? You're PAYING that in xtra interest!,2014-12-29T13:31:38.000Z,"Retired civil servant in various roles (national and international), former teacher of languages/translation, very 🏳️‍🌈 and proudly married.",2949217649,DóC,475,509,1,20953,DOCasBAC,False
13,2949217649,author_id: 2949217649,coversation_id: 902525404686233600,902525404686233600,2017-08-30T12:42:25.000Z,"[{'start': 0, 'end': 14, 'username': 'WilliamJHague', 'id': '122994639'}, {'start': 15, 'end': 25, 'username': 'Telegraph', 'id': '16343974'}]",902874144299261952,id: 902874144299261952,122994639,en,0,0,0,0,"[{'type': 'replied_to', 'id': '902525404686233600'}]",everyone,Twitter for iPad,@WilliamJHague @Telegraph And why could they possibly be in a position to give you the runaround?,2014-12-29T13:31:38.000Z,"Retired civil servant in various roles (national and international), former teacher of languages/translation, very 🏳️‍🌈 and proudly married.",2949217649,DóC,475,509,1,20953,DOCasBAC,False
14,2949217649,author_id: 2949217649,coversation_id: 902525404686233600,902525404686233600,2017-08-30T12:41:50.000Z,"[{'start': 0, 'end': 11, 'username': '1Brexiteer', 'id': '310995043'}, {'start': 12, 'end': 26, 'username': 'WilliamJHague', 'id': '122994639'}, {'start': 27, 'end': 37, 'username': 'Telegraph', 'id': '16343974'}]",902873999272804353,id: 902873999272804353,310995043,en,0,0,0,0,"[{'type': 'replied_to', 'id': '902870423989313536'}]",everyone,Twitter for iPad,@1Brexiteer @WilliamJHague @Telegraph Time to rid yourselves of this 'they need us' myth. Only 4 EU countries get into double % trade figures with you. The others don't care.,2014-12-29T13:31:38.000Z,"Retired civil servant in various roles (national and international), former teacher of languages/translation, very 🏳️‍🌈 and proudly married.",2949217649,DóC,475,509,1,20953,DOCasBAC,False
15,2949217649,author_id: 2949217649,coversation_id: 902525404686233600,902525404686233600,2017-08-30T12:38:25.000Z,"[{'start': 0, 'end': 11, 'username': '1Brexiteer', 'id': '310995043'}, {'start': 12, 'end': 26, 'username': 'WilliamJHague', 'id': '122994639'}, {'start': 27, 'end': 37, 'username': 'Telegraph', 'id': '16343974'}]",902873136676438016,id: 902873136676438016,310995043,en,0,0,0,0,"[{'type': 'replied_to', 'id': '902870423989313536'}]",everyone,Twitter for iPad,@1Brexiteer @WilliamJHague @Telegraph The EU is a 20 *trillion* euro market. You sell 250 billion - peanuts and buy 320 billion - peanuts. The EU *doesn't* need you. Duuh.,2014-12-29T13:31:38.000Z,"Retired civil servant in various roles (national and international), former teacher of languages/translation, very 🏳️‍🌈 and proudly married.",2949217649,DóC,475,509,1,20953,DOCasBAC,False
16,2949217649,author_id: 2949217649,coversation_id: 902525404686233600,902525404686233600,2017-08-29T20:06:40.000Z,"[{'start': 0, 'end': 15, 'username': 'lydiawindsor70', 'id': '3927228082'}, {'start': 16, 'end': 30, 'username': 'WilliamJHague', 'id': '122994639'}, {'start': 31, 'end': 41, 'username': 'Telegraph', 'id': '16343974'}]",902623556143603712,id: 902623556143603712,3927228082,en,0,0,0,0,"[{'type': 'replied_to', 'id': '902599931701153796'}]",everyone,Twitter for iPad,"@lydiawindsor70 @WilliamJHague @Telegraph Oh, and you need a pebble, but Davis can't find his glasses, never mind a pebble.",2014-12-29T13:31:38.000Z,"Retired civil servant in various roles (national and international), former teacher of languages/translation, very 🏳️‍🌈 and proudly married.",2949217649,DóC,475,509,1,20953,DOCasBAC,False
17,2949217649,author_id: 2949217649,coversation_id: 902525404686233600,902525404686233600,2017-08-29T20:05:36.000Z,"[{'start': 0, 'end': 15, 'username': 'lydiawindsor70', 'id': '3927228082'}, {'start': 16, 'end': 30, 'username': 'WilliamJHague', 'id': '122994639'}, {'start': 31, 'end': 41, 'username': 'Telegraph', 'id': '16343974'}]",902623286533791745,id: 902623286533791745,3927228082,en,0,0,0,0,"[{'type': 'replied_to', 'id': '902599931701153796'}]",everyone,Twitter for iPad,@lydiawindsor70 @WilliamJHague @Telegraph David was rewarded because he worked with others. You do not know the meaning of collaboration. Everything is 'plucky us' vs 'nasty them'.,2014-12-29T13:31:38.000Z,"Retired civil servant in various roles (national and international), former teacher of languages/translation, very 🏳️‍🌈 and proudly married.",2949217649,DóC,475,509,1,20953,DOCasBAC,False
18,2949217649,author_id: 2949217649,coversation_id: 902525404686233600,902525404686233600,2017-08-29T14:05:33.000Z,"[{'start': 0, 'end': 14, 'username': 'WilliamJHague', 'id': '122994639'}, {'start': 15, 'end': 25, 'username': 'Telegraph', 'id': '16343974'}]",902532678808895488,id: 902532678808895488,122994639,en,2,0,2,0,"[{'type': 'replied_to', 'id': '902525404686233600'}]",everyone,Twitter for iPad,"@WilliamJHague @Telegraph No, it won't. Why does a 20 trillion euro economy have to be flexible with a 2 trillion euro one?",2014-12-29T13:31:38.000Z,"Retired civil servant in various roles (national and international), former teacher of languages/translation, very 🏳️‍🌈 and proudly married.",2949217649,DóC,475,509,1,20953,DOCasBAC,False
19,2949217649,author_id: 2949217649,coversation_id: 902525404686233600,902525404686233600,2017-08-29T14:03:56.000Z,"[{'start': 0, 'end': 10, 'username': 'grumpyboy', 'id': '4495211'}, {'start': 11, 'end': 25, 'username': 'WilliamJHague', 'id': '122994639'}, {'start': 26, 'end': 36, 'username': 'Telegraph', 'id': '16343974'}]",902532271621668864,id: 902532271621668864,4495211,en,0,0,0,0,"[{'type': 'replied_to', 'id': '902526303529828352'}]",everyone,Twitter for iPad,"@grumpyboy @WilliamJHague @Telegraph Treaty of Rome, Treay of Maastricht, Treaty of Nice, Treaty of Lisbon... you can't win. Not changing or changing too much...duhhh",2014-12-29T13:31:38.000Z,"Retired civil servant in various roles (national and international), former teacher of languages/translation, very 🏳️‍🌈 and proudly married.",2949217649,DóC,475,509,1,20953,DOCasBAC,False
20,2949217649,author_id: 2949217649,coversation_id: 902525404686233600,902525404686233600,2017-08-29T14:01:16.000Z,"[{'start': 0, 'end': 9, 'username': 'Joe16900', 'id': '351672990'}, {'start': 10, 'end': 24, 'username': 'WilliamJHague', 'id': '122994639'}, {'start': 25, 'end': 35, 'username': 'Telegraph', 'id': '16343974'}]",902531602533818368,id: 902531602533818368,351672990,en,1,0,0,0,"[{'type': 'replied_to', 'id': '902529361944989697'}]",everyone,Twitter for iPad,@Joe16900 @WilliamJHague @Telegraph Dream on. A 20 trillion euro economy doesn't need you.,2014-12-29T13:31:38.000Z,"Retired civil servant in various roles (national and international), former teacher of languages/translation, very 🏳️‍🌈 and proudly married.",2949217649,DóC,475,509,1,20953,DOCasBAC,False
21,310995043,author_id: 310995043,coversation_id: 902525404686233600,902525404686233600,2017-08-30T12:27:38.000Z,"[{'start': 0, 'end': 9, 'username': 'DOCasBAC', 'id': '2949217649'}, {'start': 10, 'end': 24, 'username': 'WilliamJHague', 'id': '122994639'}, {'start': 25, 'end': 35, 'username': 'Telegraph', 'id': '16343974'}]",902870423989313536,id: 902870423989313536,2949217649,en,0,0,4,0,"[{'type': 'replied_to', 'id': '902532678808895488'}]",everyone,Twitter for iPhone,"@DOCasBAC @WilliamJHague @Telegraph Because we have a very large trade deficit with the EU, that's why ! DOH !",2011-06-04T18:23:57.000Z,STAND WITH THE CATALONIANS,310995043,BREXITEER #StandUp4Brexit,1403,2349,72,76252,1Brexiteer,False
22,310995043,author_id: 310995043,coversation_id: 902525404686233600,902525404686233600,2017-08-30T12:25:07.000Z,"[{'start': 0, 'end': 9, 'username': 'Grombler', 'id': '56404284'}, {'start': 10, 'end': 24, 'username': 'WilliamJHague', 'id': '122994639'}, {'start': 25, 'end': 35, 'username': 'Telegraph', 'id': '16343974'}, {'start': 36, 'end': 52, 'username': 'yanisvaroufakis', 'id': '124690469'}]",902869791928721408,id: 902869791928721408,56404284,en,0,0,0,0,"[{'type': 'replied_to', 'id': '902554760829644801'}]",everyone,Twitter for iPhone,"@Grombler @WilliamJHague @Telegraph @yanisvaroufakis Of course he did, he know the UK contributes billions to his failing country, and knows it will lose out if the EU has to cut spending !",2011-06-04T18:23:57.000Z,STAND WITH THE CATALONIANS,310995043,BREXITEER #StandUp4Brexit,1403,2349,72,76252,1Brexiteer,False
23,310995043,author_id: 310995043,coversation_id: 902525404686233600,902525404686233600,2017-08-30T12:22:51.000Z,"[{'start': 0, 'end': 11, 'username': 'Stuart1642', 'id': '954242606'}, {'start': 12, 'end': 26, 'username': 'WilliamJHague', 'id': '122994639'}, {'start': 27, 'end': 37, 'username': 'Telegraph', 'id': '16343974'}]",902869220521893888,id: 902869220521893888,954242606,en,0,0,0,0,"[{'type': 'replied_to', 'id': '902536342722289665'}]",everyone,Twitter for iPhone,@Stuart1642 @WilliamJHague @Telegraph Because that failing political project needs our BILLIONS,2011-06-04T18:23:57.000Z,STAND WITH THE CATALONIANS,310995043,BREXITEER #StandUp4Brexit,1403,2349,72,76252,1Brexiteer,False
24,310995043,author_id: 310995043,coversation_id: 902525404686233600,902525404686233600,2017-08-30T12:21:09.000Z,"[{'start': 0, 'end': 12, 'username': 'KernowChris', 'id': '20457003'}, {'start': 13, 'end': 27, 'username': 'WilliamJHague', 'id': '122994639'}, {'start': 28, 'end': 38, 'username': 'Telegraph', 'id': '16343974'}]",902868794191872000,id: 902868794191872000,20457003,en,0,0,0,0,"[{'type': 'replied_to', 'id': '902525898129379328'}]",everyone,Twitter for iPhone,"@KernowChris @WilliamJHague @Telegraph You are kidding, the EU thinks it can still dictate to the UK, it can't WALK AWAY MAY !",2011-06-04T18:23:57.000Z,STAND WITH THE CATALONIANS,310995043,BREXITEER #StandUp4Brexit,1403,2349,72,76252,1Brexiteer,False
25,446624620,author_id: 446624620,coversation_id: 902525404686233600,902525404686233600,2017-08-30T12:15:29.000Z,"[{'start': 0, 'end': 15, 'username': 'Nonsombun_swim', 'id': '3224861918'}, {'start': 16, 'end': 30, 'username': 'WilliamJHague', 'id': '122994639'}, {'start': 31, 'end': 41, 'username': 'Telegraph', 'id': '16343974'}]",902867367243501568,id: 902867367243501568,3224861918,en,0,0,0,0,"[{'type': 'replied_to', 'id': '902850471391461378'}]",everyone,Twitter for iPhone,@Nonsombun_swim @WilliamJHague @Telegraph Bless,2011-12-25T23:45:11.000Z,"59yrs young,working class scouser, Gardener. Slave to wild 🦔 .XLabour now peace & justice project. Tories kippers & racists will be blocked, JC4PM #jft97",446624620,EvieB🌹#SocialistAlways,2610,1994,29,50732,queenEvieB,False
26,446624620,author_id: 446624620,coversation_id: 902525404686233600,902525404686233600,2017-08-30T10:20:35.000Z,"[{'start': 0, 'end': 15, 'username': 'Nonsombun_swim', 'id': '3224861918'}, {'start': 16, 'end': 30, 'username': 'WilliamJHague', 'id': '122994639'}, {'start': 31, 'end': 41, 'username': 'Telegraph', 'id': '16343974'}]",902838453922136064,id: 902838453922136064,3224861918,en,0,0,1,0,"[{'type': 'replied_to', 'id': '902833119769780225'}]",everyone,Twitter for iPhone,@Nonsombun_swim @WilliamJHague @Telegraph No answer then? 🙄,2011-12-25T23:45:11.000Z,"59yrs young,working class scouser, Gardener. Slave to wild 🦔 .XLabour now peace & justice project. Tories kippers & racists will be blocked, JC4PM #jft97",446624620,EvieB🌹#SocialistAlways,2610,1994,29,50732,queenEvieB,False
27,446624620,author_id: 446624620,coversation_id: 902525404686233600,902525404686233600,2017-08-30T09:28:14.000Z,"[{'start': 0, 'end': 10, 'username': 'brett1301', 'id': '283203197'}, {'start': 11, 'end': 25, 'username': 'WilliamJHague', 'id': '122994639'}, {'start': 26, 'end': 36, 'username': 'Telegraph', 'id': '16343974'}]",902825277604147200,id: 902825277604147200,283203197,und,0,0,0,0,"[{'type': 'replied_to', 'id': '902574690044141568'}]",everyone,Twitter for iPhone,@brett1301 @WilliamJHague @Telegraph 🤔,2011-12-25T23:45:11.000Z,"59yrs young,working class scouser, Gardener. Slave to wild 🦔 .XLabour now peace & justice project. Tories kippers & racists will be blocked, JC4PM #jft97",446624620,EvieB🌹#SocialistAlways,2610,1994,29,50732,queenEvieB,False
28,446624620,author_id: 446624620,coversation_id: 902525404686233600,902525404686233600,2017-08-30T09:26:40.000Z,"[{'start': 0, 'end': 15, 'username': 'Nonsombun_swim', 'id': '3224861918'}, {'start': 16, 'end': 30, 'username': 'WilliamJHague', 'id': '122994639'}, {'start': 31, 'end': 41, 'username': 'Telegraph', 'id': '16343974'}]",902824884274909184,id: 902824884274909184,3224861918,en,0,0,1,0,"[{'type': 'replied_to', 'id': '902757281464553472'}]",everyone,Twitter for iPhone,@Nonsombun_swim @WilliamJHague @Telegraph What problem?,2011-12-25T23:45:11.000Z,"59yrs young,working class scouser, Gardener. Slave to wild 🦔 .XLabour now peace & justice project. Tories kippers & racists will be blocked, JC4PM #jft97",446624620,EvieB🌹#SocialistAlways,2610,1994,29,50732,queenEvieB,False
29,446624620,author_id: 446624620,coversation_id: 902525404686233600,902525404686233600,2017-08-30T09:25:22.000Z,"[{'start': 0, 'end': 7, 'username': 'HS0058', 'id': '1047891186'}, {'start': 8, 'end': 22, 'username': 'WilliamJHague', 'id': '122994639'}, {'start': 23, 'end': 33, 'username': 'Telegraph', 'id': '16343974'}]",902824557102411776,id: 902824557102411776,1047891186,und,0,0,0,0,"[{'type': 'replied_to', 'id': '902584922522734593'}]",everyone,Twitter for iPhone,@HS0058 @WilliamJHague @Telegraph Why?,2011-12-25T23:45:11.000Z,"59yrs young,working class scouser, Gardener. Slave to wild 🦔 .XLabour now peace & justice project. Tories kippers & racists will be blocked, JC4PM #jft97",446624620,EvieB🌹#SocialistAlways,2610,1994,29,50732,queenEvieB,False
30,23459648,author_id: 23459648,coversation_id: 902525404686233600,902525404686233600,2017-08-30T11:35:37.000Z,"[{'start': 0, 'end': 14, 'username': 'WilliamJHague', 'id': '122994639'}, {'start': 15, 'end': 25, 'username': 'Telegraph', 'id': '16343974'}]",902857334405386240,id: 902857334405386240,122994639,en,2,0,0,0,"[{'type': 'replied_to', 'id': '902525404686233600'}]",everyone,Twitter for iPhone,"@WilliamJHague @Telegraph Why? We are leaving, they don't have to do anything they don't want to. We should never have triggered Brexit.",2009-03-09T17:02:44.000Z,"Houseboat dweller, gardener and bird lover, European 🇪🇺🇺🇦#Toriesout",23459648,Judy 🌻,412,1045,0,31049,JudyTheresa66,False
31,889086472627867649,author_id: 889086472627867649,coversation_id: 902525404686233600,902525404686233600,2017-08-30T11:11:42.000Z,"[{'start': 0, 'end': 14, 'username': 'WilliamJHague', 'id': '122994639'}, {'start': 15, 'end': 25, 'username': 'Telegraph', 'id': '16343974'}]",902851316153769984,id: 902851316153769984,122994639,en,0,0,0,0,"[{'type': 'replied_to', 'id': '902525404686233600'}]",everyone,Twitter Web App,@WilliamJHague @Telegraph Delaying tactics in the hope we'll follow the Irish 2008/9 route and have a second referendum to keep the money flowing!,2017-07-23T11:35:08.000Z,,889086472627867649,David Fairbairn,0,4,0,2,DavidFairbair15,False
32,89491345,author_id: 89491345,coversation_id: 902525404686233600,902525404686233600,2017-08-30T08:01:59.000Z,"[{'start': 0, 'end': 14, 'username': 'WilliamJHague', 'id': '122994639'}, {'start': 15, 'end': 25, 'username': 'Telegraph', 'id': '16343974'}]",902803570856165376,id: 902803570856165376,122994639,en,3,0,0,0,"[{'type': 'replied_to', 'id': '902525404686233600'}]",everyone,Twitter for iPhone,@WilliamJHague @Telegraph Flexible like in UK team making sure they have bank holiday rather than being at negotiation table ?,2009-11-12T17:15:51.000Z,,89491345,Mike Walton,46,170,0,3624,mikewalton106,False
