,author_id,author_id_new,conv_id_new,conversation_id,created_at,entities.mentions,id,id_new,in_reply_to_user_id,lang,public_metrics.like_count,public_metrics.quote_count,public_metrics.reply_count,public_metrics.retweet_count,referenced_tweets,reply_settings,source,text,users.created_at,users.description,users.id,users.name,users.public_metrics.followers_count,users.public_metrics.following_count,users.public_metrics.listed_count,users.public_metrics.tweet_count,users.username,users.verified
0,628351478,author_id: 628351478,coversation_id: 847527876576653312,847527876576653312,2017-04-02T15:35:40.000Z,"[{'start': 0, 'end': 13, 'username': 'BorisJohnson', 'id': '3131144855'}]",848559564622622724,id: 848559564622622724,3131144855,en,0,0,0,0,"[{'type': 'replied_to', 'id': '847527876576653312'}]",everyone,Twitter for Android,"@BorisJohnson do you ever wake up and just realise you are a shameless turncoat, I'd be embarrassed to be you.",2012-07-06T12:50:53.000Z,,628351478,McGraggle,27,166,1,599,McGraggle,False
1,18476160,author_id: 18476160,coversation_id: 847527876576653312,847527876576653312,2017-04-02T08:17:21.000Z,"[{'start': 0, 'end': 13, 'username': 'BorisJohnson', 'id': '3131144855'}]",848449260366516224,id: 848449260366516224,3131144855,en,0,0,0,0,"[{'type': 'replied_to', 'id': '847527876576653312'}]",everyone,Twitter for iPhone,@BorisJohnson Congratulations Boris. You've managed to Stuff Gibraltar...,2008-12-30T12:48:38.000Z,Filthy Remainer. New Scot. Old. Likes beer. OK as a Dad. All tweets in personal capacity. Blocked by some Tories. Racists Not Welcome.,18476160,Col_Irrelevant,1557,3641,25,50975,Col_Irrelevant,False
2,847926908008484864,author_id: 847926908008484864,coversation_id: 847527876576653312,847527876576653312,2017-03-31T21:56:43.000Z,"[{'start': 0, 'end': 13, 'username': 'BorisJohnson', 'id': '3131144855'}]",847930682735304705,id: 847930682735304705,3131144855,en,1,0,0,0,"[{'type': 'replied_to', 'id': '847527876576653312'}]",everyone,Twitter for iPhone,@BorisJohnson I hear you need woman in your entourage when supporting women meeting this week. Unemployed 6  yrs I need a job former worker at Whitehall!,2017-03-31T21:41:43.000Z,"Animals Archery photography Olympic Games volunteer 2012, 2016, film extra,",847926908008484864,Dee Wilson,0,27,0,17,Wils63631927Dee,False
3,1038344624,author_id: 1038344624,coversation_id: 847527876576653312,847527876576653312,2017-03-31T19:14:01.000Z,"[{'start': 0, 'end': 13, 'username': 'BorisJohnson', 'id': '3131144855'}]",847889739042697216,id: 847889739042697216,3131144855,en,0,0,0,0,"[{'type': 'replied_to', 'id': '847527876576653312'}]",everyone,Twitter Web Client,@BorisJohnson Just looked at the negotiation positions... they seem to be holding all the cards... So when do we get what we were promised again?!!!,2012-12-26T23:43:23.000Z,Physics geek. Hasn't got a clue how twitter works.,1038344624,Paul,52,1017,0,2199,PaulN20,False
4,2749476039,author_id: 2749476039,coversation_id: 847527876576653312,847527876576653312,2017-03-31T18:22:49.000Z,"[{'start': 0, 'end': 13, 'username': 'BorisJohnson', 'id': '3131144855'}]",847876856061865984,id: 847876856061865984,3131144855,en,0,0,0,0,"[{'type': 'replied_to', 'id': '847527876576653312'}]",everyone,Twitter Web Client,@BorisJohnson Why on earth doesn't he get a barber to go to his hotel &amp; get a hair cut,2014-08-21T20:45:12.000Z,,2749476039,Frances Blackhurst,39,174,1,323,blackhurst70,False
5,245492552,author_id: 245492552,coversation_id: 847527876576653312,847527876576653312,2017-03-31T18:17:28.000Z,"[{'start': 0, 'end': 13, 'username': 'BorisJohnson', 'id': '3131144855'}]",847875509698658304,id: 847875509698658304,3131144855,en,0,0,0,0,"[{'type': 'replied_to', 'id': '847527876576653312'}]",everyone,Twitter for Android,@BorisJohnson Come to cleethorpes boris,2011-01-31T20:35:16.000Z,Enjoy yourself it's later than you think.,245492552,Gray Johnson ðŸ¥š,146,1012,1,3531,hardboiledeggsa,False
6,819830849931792384,author_id: 819830849931792384,coversation_id: 847527876576653312,847527876576653312,2017-03-31T15:38:03.000Z,"[{'start': 0, 'end': 13, 'username': 'BorisJohnson', 'id': '3131144855'}, {'start': 14, 'end': 30, 'username': 'DouglasCarswell', 'id': '25097735'}]",847835388131594240,id: 847835388131594240,3131144855,en,0,0,0,0,"[{'type': 'replied_to', 'id': '847527876576653312'}]",everyone,Twitter for Android,"@BorisJohnson @DouglasCarswell How's the bagging of carpet  business going.Boris, so far you look like you may have gotten.away with it",2017-01-13T08:58:01.000Z,Just annoying,819830849931792384,Stephen Morrison,532,698,0,38191,Stephen54106076,False
7,788659769347375104,author_id: 788659769347375104,coversation_id: 847527876576653312,847527876576653312,2017-03-31T06:42:56.000Z,"[{'start': 0, 'end': 15, 'username': 'fakenewsjunkie', 'id': '3018910241'}, {'start': 16, 'end': 31, 'username': 'angelneptustar', 'id': '19644086'}, {'start': 32, 'end': 45, 'username': 'BorisJohnson', 'id': '3131144855'}]",847700723886309376,id: 847700723886309376,788659769347375104,en,0,0,0,0,"[{'type': 'replied_to', 'id': '847577423629742080'}]",everyone,Twitter for iPhone,@fakenewsjunkie @angelneptustar @BorisJohnson So you want me to find a poll you claim exists and then you block me? Oh dear ðŸ˜‚ðŸ˜‚ðŸ˜‚,2016-10-19T08:35:16.000Z,Mindless philosopher,788659769347375104,Knotty.,456,1033,3,18022,hongkongpoowee,False
8,788659769347375104,author_id: 788659769347375104,coversation_id: 847527876576653312,847527876576653312,2017-03-30T22:32:59.000Z,"[{'start': 0, 'end': 15, 'username': 'fakenewsjunkie', 'id': '3018910241'}, {'start': 16, 'end': 31, 'username': 'angelneptustar', 'id': '19644086'}, {'start': 32, 'end': 45, 'username': 'BorisJohnson', 'id': '3131144855'}]",847577423629742080,id: 847577423629742080,3018910241,en,0,0,2,0,"[{'type': 'replied_to', 'id': '847570292587286528'}]",everyone,Twitter for iPhone,@fakenewsjunkie @angelneptustar @BorisJohnson Any news on this poll yet Angie?,2016-10-19T08:35:16.000Z,Mindless philosopher,788659769347375104,Knotty.,456,1033,3,18022,hongkongpoowee,False
9,788659769347375104,author_id: 788659769347375104,coversation_id: 847527876576653312,847527876576653312,2017-03-30T22:01:01.000Z,"[{'start': 0, 'end': 15, 'username': 'angelneptustar', 'id': '19644086'}, {'start': 16, 'end': 29, 'username': 'BorisJohnson', 'id': '3131144855'}]",847569379223113729,id: 847569379223113729,19644086,en,0,0,0,0,"[{'type': 'replied_to', 'id': '847567734653300738'}]",everyone,Twitter for iPhone,@angelneptustar @BorisJohnson Can't find one. You obviously have a link to back up your claim?,2016-10-19T08:35:16.000Z,Mindless philosopher,788659769347375104,Knotty.,456,1033,3,18022,hongkongpoowee,False
10,788659769347375104,author_id: 788659769347375104,coversation_id: 847527876576653312,847527876576653312,2017-03-30T21:51:57.000Z,"[{'start': 0, 'end': 15, 'username': 'angelneptustar', 'id': '19644086'}, {'start': 16, 'end': 29, 'username': 'BorisJohnson', 'id': '3131144855'}]",847567094610890753,id: 847567094610890753,19644086,en,0,0,1,0,"[{'type': 'replied_to', 'id': '847566850053607424'}]",everyone,Twitter for iPhone,"@angelneptustar @BorisJohnson Really, and where are these polls? Because I know plenty who fell for the lies.",2016-10-19T08:35:16.000Z,Mindless philosopher,788659769347375104,Knotty.,456,1033,3,18022,hongkongpoowee,False
11,788659769347375104,author_id: 788659769347375104,coversation_id: 847527876576653312,847527876576653312,2017-03-30T21:45:02.000Z,"[{'start': 0, 'end': 15, 'username': 'angelneptustar', 'id': '19644086'}, {'start': 16, 'end': 29, 'username': 'BorisJohnson', 'id': '3131144855'}]",847565355757166592,id: 847565355757166592,19644086,en,0,0,1,0,"[{'type': 'replied_to', 'id': '847564452530540545'}]",everyone,Twitter for iPhone,@angelneptustar @BorisJohnson You've spoken to them all have you?,2016-10-19T08:35:16.000Z,Mindless philosopher,788659769347375104,Knotty.,456,1033,3,18022,hongkongpoowee,False
12,788659769347375104,author_id: 788659769347375104,coversation_id: 847527876576653312,847527876576653312,2017-03-30T21:38:13.000Z,"[{'start': 0, 'end': 13, 'username': 'BorisJohnson', 'id': '3131144855'}]",847563642409275392,id: 847563642409275392,3131144855,en,0,0,1,0,"[{'type': 'replied_to', 'id': '847527876576653312'}]",everyone,Twitter for iPhone,@BorisJohnson How many people voted for Brexit due to your claims of giving the NHS an extra Â£350 million?,2016-10-19T08:35:16.000Z,Mindless philosopher,788659769347375104,Knotty.,456,1033,3,18022,hongkongpoowee,False
13,19707518,author_id: 19707518,coversation_id: 847527876576653312,847527876576653312,2017-03-31T06:19:24.000Z,"[{'start': 0, 'end': 15, 'username': 'angelneptustar', 'id': '19644086'}]",847694799343726592,id: 847694799343726592,19644086,en,0,0,0,0,"[{'type': 'replied_to', 'id': '847685585825288192'}]",everyone,Twitter for iPhone,"@angelneptustar Denial. David Irving in disguise. Trumped up nonsense. Read some history. Trump to the west, Putin to the east. It's called defence.",2009-01-29T11:57:56.000Z,"Very lucky. Wonderful wife and three brilliant kids. Brexit a disaster, science rules. Love life & travel. A citizen of this fragile world.",19707518,Erik Childerhouse,116,396,2,4428,EChilderhouse,False
14,19707518,author_id: 19707518,coversation_id: 847527876576653312,847527876576653312,2017-03-31T05:00:13.000Z,"[{'start': 0, 'end': 15, 'username': 'angelneptustar', 'id': '19644086'}, {'start': 16, 'end': 29, 'username': 'BorisJohnson', 'id': '3131144855'}]",847674871928639491,id: 847674871928639491,19644086,en,0,0,4,0,"[{'type': 'replied_to', 'id': '847545885735219200'}]",everyone,Twitter for iPhone,@angelneptustar @BorisJohnson Deranged. Get some fresh air and a shrink,2009-01-29T11:57:56.000Z,"Very lucky. Wonderful wife and three brilliant kids. Brexit a disaster, science rules. Love life & travel. A citizen of this fragile world.",19707518,Erik Childerhouse,116,396,2,4428,EChilderhouse,False
15,19707518,author_id: 19707518,coversation_id: 847527876576653312,847527876576653312,2017-03-30T19:56:28.000Z,"[{'start': 0, 'end': 13, 'username': 'BorisJohnson', 'id': '3131144855'}]",847538035269009409,id: 847538035269009409,3131144855,en,1,0,2,0,"[{'type': 'replied_to', 'id': '847527876576653312'}]",everyone,Twitter for iPhone,@BorisJohnson Most Germans don't think you speak the truth that often. Clever buggers,2009-01-29T11:57:56.000Z,"Very lucky. Wonderful wife and three brilliant kids. Brexit a disaster, science rules. Love life & travel. A citizen of this fragile world.",19707518,Erik Childerhouse,116,396,2,4428,EChilderhouse,False
16,19644086,author_id: 19644086,coversation_id: 847527876576653312,847527876576653312,2017-03-31T05:50:11.000Z,,847687448087846912,id: 847687448087846912,19707518,en,0,0,0,0,"[{'type': 'replied_to', 'id': '847674871928639491'}]",everyone,Twitter for BlackBerryÂ®,@ErikChilderhous Your abusive interference typical. Do U have relatives in Argentina?,2009-01-28T09:58:52.000Z,"Campaigned 3 times for Boris Johnson, and twice for Tories, now blog & tweet in his support. All comments and opinions my own.: https://t.co/5UJTMNiY10",19644086,angie,18968,17640,249,572277,angelneptustar,False
17,19644086,author_id: 19644086,coversation_id: 847527876576653312,847527876576653312,2017-03-31T05:48:25.000Z,,847687003575435266,id: 847687003575435266,19707518,en,0,0,0,0,"[{'type': 'replied_to', 'id': '847674871928639491'}]",everyone,Twitter for BlackBerryÂ®,"@ErikChilderhous Papers on Fourth Reich, the EU, in hands of Historians, EU shud keep noses out of our business. #Brexit",2009-01-28T09:58:52.000Z,"Campaigned 3 times for Boris Johnson, and twice for Tories, now blog & tweet in his support. All comments and opinions my own.: https://t.co/5UJTMNiY10",19644086,angie,18968,17640,249,572277,angelneptustar,False
18,19644086,author_id: 19644086,coversation_id: 847527876576653312,847527876576653312,2017-03-31T05:45:52.000Z,,847686363533025280,id: 847686363533025280,19707518,en,0,0,0,0,"[{'type': 'replied_to', 'id': '847674871928639491'}]",everyone,Twitter for BlackBerryÂ®,@ErikChilderhous EU model for superstate identical to plans of Napoleon &amp; Hitler.  Why form EU army if not intending 2 fight? #Brexit,2009-01-28T09:58:52.000Z,"Campaigned 3 times for Boris Johnson, and twice for Tories, now blog & tweet in his support. All comments and opinions my own.: https://t.co/5UJTMNiY10",19644086,angie,18968,17640,249,572277,angelneptustar,False
19,19644086,author_id: 19644086,coversation_id: 847527876576653312,847527876576653312,2017-03-31T05:42:47.000Z,,847685585825288192,id: 847685585825288192,19707518,en,0,0,1,0,"[{'type': 'replied_to', 'id': '847674871928639491'}]",everyone,Twitter for BlackBerryÂ®,"@ErikChilderhous Have links. Reputable historians have found documents. Dr Julian Lewis, Andrew Roberts agree. #Brexit",2009-01-28T09:58:52.000Z,"Campaigned 3 times for Boris Johnson, and twice for Tories, now blog & tweet in his support. All comments and opinions my own.: https://t.co/5UJTMNiY10",19644086,angie,18968,17640,249,572277,angelneptustar,False
20,19644086,author_id: 19644086,coversation_id: 847527876576653312,847527876576653312,2017-03-31T04:40:24.000Z,"[{'start': 0, 'end': 15, 'username': 'hongkongpoowee', 'id': '788659769347375104'}]",847669885073203200,id: 847669885073203200,788659769347375104,en,0,0,0,0,"[{'type': 'replied_to', 'id': '847577423629742080'}]",everyone,Twitter for BlackBerryÂ®,"@hongkongpoowee U need to do  research, U aren't a baby.",2009-01-28T09:58:52.000Z,"Campaigned 3 times for Boris Johnson, and twice for Tories, now blog & tweet in his support. All comments and opinions my own.: https://t.co/5UJTMNiY10",19644086,angie,18968,17640,249,572277,angelneptustar,False
21,19644086,author_id: 19644086,coversation_id: 847527876576653312,847527876576653312,2017-03-30T21:54:29.000Z,"[{'start': 0, 'end': 15, 'username': 'hongkongpoowee', 'id': '788659769347375104'}, {'start': 16, 'end': 29, 'username': 'BorisJohnson', 'id': '3131144855'}]",847567734653300738,id: 847567734653300738,788659769347375104,en,0,0,1,0,"[{'type': 'replied_to', 'id': '847567094610890753'}]",everyone,TweetDeck,"@hongkongpoowee @BorisJohnson Research them, am not your slave.",2009-01-28T09:58:52.000Z,"Campaigned 3 times for Boris Johnson, and twice for Tories, now blog & tweet in his support. All comments and opinions my own.: https://t.co/5UJTMNiY10",19644086,angie,18968,17640,249,572277,angelneptustar,False
22,19644086,author_id: 19644086,coversation_id: 847527876576653312,847527876576653312,2017-03-30T21:50:58.000Z,"[{'start': 0, 'end': 15, 'username': 'hongkongpoowee', 'id': '788659769347375104'}, {'start': 16, 'end': 29, 'username': 'BorisJohnson', 'id': '3131144855'}]",847566850053607424,id: 847566850053607424,788659769347375104,en,0,0,3,0,"[{'type': 'replied_to', 'id': '847565355757166592'}]",everyone,TweetDeck,@hongkongpoowee @BorisJohnson They have done tons of polling.  NOT ONE PERSON gives that as the reason.  Not one.,2009-01-28T09:58:52.000Z,"Campaigned 3 times for Boris Johnson, and twice for Tories, now blog & tweet in his support. All comments and opinions my own.: https://t.co/5UJTMNiY10",19644086,angie,18968,17640,249,572277,angelneptustar,False
23,19644086,author_id: 19644086,coversation_id: 847527876576653312,847527876576653312,2017-03-30T21:48:44.000Z,"[{'start': 0, 'end': 12, 'username': 'keelingover', 'id': '56688219'}, {'start': 13, 'end': 22, 'username': 'PGEurope', 'id': '1515753927551160324'}, {'start': 23, 'end': 36, 'username': 'BorisJohnson', 'id': '3131144855'}, {'start': 97, 'end': 110, 'username': 'BorisJohnson', 'id': '3131144855'}]",847566286452338688,id: 847566286452338688,56688219,en,0,0,0,0,"[{'type': 'replied_to', 'id': '847565689103589377'}]",everyone,TweetDeck,@keelingover @pgeurope @BorisJohnson It's Remoaner.  Not Remoiner.  Cos they moan all day.  LOLZ @borisjohnson,2009-01-28T09:58:52.000Z,"Campaigned 3 times for Boris Johnson, and twice for Tories, now blog & tweet in his support. All comments and opinions my own.: https://t.co/5UJTMNiY10",19644086,angie,18968,17640,249,572277,angelneptustar,False
24,19644086,author_id: 19644086,coversation_id: 847527876576653312,847527876576653312,2017-03-30T21:48:03.000Z,"[{'start': 0, 'end': 12, 'username': 'keelingover', 'id': '56688219'}, {'start': 13, 'end': 22, 'username': 'PGEurope', 'id': '1515753927551160324'}, {'start': 23, 'end': 36, 'username': 'BorisJohnson', 'id': '3131144855'}]",847566114703933440,id: 847566114703933440,56688219,en,0,0,0,0,"[{'type': 'replied_to', 'id': '847565689103589377'}]",everyone,TweetDeck,"@keelingover @pgeurope @BorisJohnson Where you live not of slightest concern to me, why shud it be.  Where do U live?  Berlin?  Your relatives left for Argentina after last war?",2009-01-28T09:58:52.000Z,"Campaigned 3 times for Boris Johnson, and twice for Tories, now blog & tweet in his support. All comments and opinions my own.: https://t.co/5UJTMNiY10",19644086,angie,18968,17640,249,572277,angelneptustar,False
25,19644086,author_id: 19644086,coversation_id: 847527876576653312,847527876576653312,2017-03-30T21:41:27.000Z,"[{'start': 0, 'end': 15, 'username': 'hongkongpoowee', 'id': '788659769347375104'}, {'start': 16, 'end': 29, 'username': 'BorisJohnson', 'id': '3131144855'}]",847564452530540545,id: 847564452530540545,788659769347375104,en,0,0,1,0,"[{'type': 'replied_to', 'id': '847563642409275392'}]",everyone,TweetDeck,@hongkongpoowee @BorisJohnson NONE. Never even mentioned when ppl say why they voted leave.Mostly voted to B rid of EU. Get freedom back. Then fears about immigration.,2009-01-28T09:58:52.000Z,"Campaigned 3 times for Boris Johnson, and twice for Tories, now blog & tweet in his support. All comments and opinions my own.: https://t.co/5UJTMNiY10",19644086,angie,18968,17640,249,572277,angelneptustar,False
26,19644086,author_id: 19644086,coversation_id: 847527876576653312,847527876576653312,2017-03-30T21:37:41.000Z,"[{'start': 0, 'end': 9, 'username': 'PGEurope', 'id': '1515753927551160324'}, {'start': 10, 'end': 22, 'username': 'keelingover', 'id': '56688219'}, {'start': 23, 'end': 36, 'username': 'BorisJohnson', 'id': '3131144855'}]",847563504747814912,id: 847563504747814912,172310303,en,0,0,1,0,"[{'type': 'replied_to', 'id': '847562663680933888'}]",everyone,TweetDeck,@pgeurope @keelingover @BorisJohnson Remoaners desp. to find a lie they could blame Leavers for becos they told so many themselves. Leave told NO lies.  Remoan told loads.,2009-01-28T09:58:52.000Z,"Campaigned 3 times for Boris Johnson, and twice for Tories, now blog & tweet in his support. All comments and opinions my own.: https://t.co/5UJTMNiY10",19644086,angie,18968,17640,249,572277,angelneptustar,False
27,19644086,author_id: 19644086,coversation_id: 847527876576653312,847527876576653312,2017-03-30T21:03:45.000Z,"[{'start': 0, 'end': 11, 'username': 'saintashes', 'id': '49612919'}, {'start': 12, 'end': 25, 'username': 'BorisJohnson', 'id': '3131144855'}]",847554966780825600,id: 847554966780825600,49612919,en,0,0,1,0,"[{'type': 'replied_to', 'id': '847554673221529600'}]",everyone,TweetDeck,"@saintashes @BorisJohnson We were slaves.  EU was stealing democracy, freedoms, rights of its members.  Tried to conquer us in wars. Didn't work so tried EU. #Brexit",2009-01-28T09:58:52.000Z,"Campaigned 3 times for Boris Johnson, and twice for Tories, now blog & tweet in his support. All comments and opinions my own.: https://t.co/5UJTMNiY10",19644086,angie,18968,17640,249,572277,angelneptustar,False
28,19644086,author_id: 19644086,coversation_id: 847527876576653312,847527876576653312,2017-03-30T21:02:40.000Z,"[{'start': 17, 'end': 30, 'username': 'BorisJohnson', 'id': '3131144855'}, {'start': 157, 'end': 170, 'username': 'BorisJohnson', 'id': '3131144855'}]",847554694520197120,id: 847554694520197120,746620735918080000,en,0,0,0,0,"[{'type': 'replied_to', 'id': '847554299496284161'}]",everyone,TweetDeck,"@Horatios_Gunner @BorisJohnson Because bus made it clear it was only a suggestion.  Nobody pledges by saying ""Let's.....  do something, that's a suggestion. @borisjohnson",2009-01-28T09:58:52.000Z,"Campaigned 3 times for Boris Johnson, and twice for Tories, now blog & tweet in his support. All comments and opinions my own.: https://t.co/5UJTMNiY10",19644086,angie,18968,17640,249,572277,angelneptustar,False
29,19644086,author_id: 19644086,coversation_id: 847527876576653312,847527876576653312,2017-03-30T21:01:38.000Z,"[{'start': 0, 'end': 14, 'username': 'brown_browntg', 'id': '944600196'}, {'start': 15, 'end': 28, 'username': 'BorisJohnson', 'id': '3131144855'}, {'start': 29, 'end': 45, 'username': 'DouglasCarswell', 'id': '25097735'}, {'start': 176, 'end': 189, 'username': 'BorisJohnson', 'id': '3131144855'}]",847554435299643392,id: 847554435299643392,944600196,en,0,0,1,0,"[{'type': 'replied_to', 'id': '847554009456140289'}]",everyone,TweetDeck,"@brown_browntg @BorisJohnson @DouglasCarswell You consider recovery of our democracy, rights &amp; freedoms, British Law etc. contemptible?  Most ppl wud die to recover them.  @borisjohnson",2009-01-28T09:58:52.000Z,"Campaigned 3 times for Boris Johnson, and twice for Tories, now blog & tweet in his support. All comments and opinions my own.: https://t.co/5UJTMNiY10",19644086,angie,18968,17640,249,572277,angelneptustar,False
30,19644086,author_id: 19644086,coversation_id: 847527876576653312,847527876576653312,2017-03-30T20:59:45.000Z,"[{'start': 0, 'end': 15, 'username': 'fakenewsjunkie', 'id': '3018910241'}, {'start': 16, 'end': 29, 'username': 'BorisJohnson', 'id': '3131144855'}, {'start': 127, 'end': 140, 'username': 'BorisJohnson', 'id': '3131144855'}]",847553960080588800,id: 847553960080588800,3018910241,en,0,0,0,0,"[{'type': 'replied_to', 'id': '847552459316789248'}]",everyone,TweetDeck,"@fakenewsjunkie @BorisJohnson But you really know that, don't you.  They were all in different parties, how could that work??  @borisjohnson",2009-01-28T09:58:52.000Z,"Campaigned 3 times for Boris Johnson, and twice for Tories, now blog & tweet in his support. All comments and opinions my own.: https://t.co/5UJTMNiY10",19644086,angie,18968,17640,249,572277,angelneptustar,False
31,19644086,author_id: 19644086,coversation_id: 847527876576653312,847527876576653312,2017-03-30T20:58:56.000Z,"[{'start': 0, 'end': 15, 'username': 'fakenewsjunkie', 'id': '3018910241'}, {'start': 16, 'end': 29, 'username': 'BorisJohnson', 'id': '3131144855'}, {'start': 116, 'end': 129, 'username': 'BorisJohnson', 'id': '3131144855'}]",847553754044010496,id: 847553754044010496,3018910241,en,0,0,0,0,"[{'type': 'replied_to', 'id': '847552459316789248'}]",everyone,TweetDeck,@fakenewsjunkie @BorisJohnson He never pledged Â£350M.  Nobody pledges in a Ref.  Only in a GE.  You were confused.  @borisjohnson,2009-01-28T09:58:52.000Z,"Campaigned 3 times for Boris Johnson, and twice for Tories, now blog & tweet in his support. All comments and opinions my own.: https://t.co/5UJTMNiY10",19644086,angie,18968,17640,249,572277,angelneptustar,False
32,19644086,author_id: 19644086,coversation_id: 847527876576653312,847527876576653312,2017-03-30T20:57:51.000Z,"[{'start': 0, 'end': 12, 'username': 'LORD_FRASER', 'id': '2525700506'}, {'start': 13, 'end': 26, 'username': 'BorisJohnson', 'id': '3131144855'}, {'start': 93, 'end': 106, 'username': 'BorisJohnson', 'id': '3131144855'}]",847553481099497477,id: 847553481099497477,2525700506,en,0,0,1,0,"[{'type': 'replied_to', 'id': '847552415381549061'}]",everyone,TweetDeck,@LORD_FRASER @BorisJohnson /forced to admit NO LEAVER pledged cash.  PARA 4.  U R confused.  @borisjohnson,2009-01-28T09:58:52.000Z,"Campaigned 3 times for Boris Johnson, and twice for Tories, now blog & tweet in his support. All comments and opinions my own.: https://t.co/5UJTMNiY10",19644086,angie,18968,17640,249,572277,angelneptustar,False
33,19644086,author_id: 19644086,coversation_id: 847527876576653312,847527876576653312,2017-03-30T20:57:01.000Z,"[{'start': 0, 'end': 12, 'username': 'LORD_FRASER', 'id': '2525700506'}, {'start': 13, 'end': 26, 'username': 'BorisJohnson', 'id': '3131144855'}, {'start': 152, 'end': 165, 'username': 'BorisJohnson', 'id': '3131144855'}]",847553273892667392,id: 847553273892667392,2525700506,en,0,0,0,0,"[{'type': 'replied_to', 'id': '847552415381549061'}]",everyone,TweetDeck,"@LORD_FRASER @BorisJohnson Not possible to pledge cash in a Ref. only in a GE.  Ref. requires only YES/NO answer. https://t.co/jctfa6NRZB Even Chuka  /
@borisjohnson",2009-01-28T09:58:52.000Z,"Campaigned 3 times for Boris Johnson, and twice for Tories, now blog & tweet in his support. All comments and opinions my own.: https://t.co/5UJTMNiY10",19644086,angie,18968,17640,249,572277,angelneptustar,False
34,19644086,author_id: 19644086,coversation_id: 847527876576653312,847527876576653312,2017-03-30T20:53:13.000Z,"[{'start': 0, 'end': 12, 'username': 'keelingover', 'id': '56688219'}, {'start': 13, 'end': 26, 'username': 'BorisJohnson', 'id': '3131144855'}, {'start': 90, 'end': 103, 'username': 'BorisJohnson', 'id': '3131144855'}]",847552314143637505,id: 847552314143637505,56688219,en,0,0,0,0,"[{'type': 'replied_to', 'id': '847550784401281024'}]",everyone,TweetDeck,@keelingover @BorisJohnson NOTHING to do with propaganda.  ONLY about a YES / NO answer.  @BorisJohnson,2009-01-28T09:58:52.000Z,"Campaigned 3 times for Boris Johnson, and twice for Tories, now blog & tweet in his support. All comments and opinions my own.: https://t.co/5UJTMNiY10",19644086,angie,18968,17640,249,572277,angelneptustar,False
