,author_id,author_id_new,conv_id_new,conversation_id,created_at,entities.mentions,id,id_new,in_reply_to_user_id,lang,public_metrics.like_count,public_metrics.quote_count,public_metrics.reply_count,public_metrics.retweet_count,referenced_tweets,reply_settings,source,text,users.created_at,users.description,users.id,users.name,users.public_metrics.followers_count,users.public_metrics.following_count,users.public_metrics.listed_count,users.public_metrics.tweet_count,users.username,users.verified
61,174241258,author_id: 174241258,coversation_id: 920934823006490624,920934823006490624,2017-10-19T09:56:41.000Z,"[{'start': 0, 'end': 12, 'username': 'theresa_may', 'id': '747807250819981312'}]",920951831886475264,id: 920951831886475264,747807250819981312,und,0,0,0,0,"[{'type': 'replied_to', 'id': '920934823006490624'}]",everyone,Twitter for Android,@theresa_may https://t.co/4VulFkiONu,2010-08-03T13:04:54.000Z,,174241258,Gareth C,655,1570,10,48925,garethc100,False
62,919984183518351360,author_id: 919984183518351360,coversation_id: 920934823006490624,920934823006490624,2017-10-19T09:54:39.000Z,"[{'start': 0, 'end': 12, 'username': 'theresa_may', 'id': '747807250819981312'}]",920951318168195073,id: 920951318168195073,919984183518351360,fr,1,0,0,1,"[{'type': 'replied_to', 'id': '920949897565757440'}]",everyone,Twitter for Android,"@theresa_may Pour information, je ne me sert plus réellement de FB, donc je n'est pû lire, que ce tweet... Ça aurait été mieux d'ajouter dans les moments",2017-10-16T17:51:36.000Z,"Jeune trentenaire, blogger et inspiré par le nouveau Twitter... Suivez-moi sur mon compte officiel, qui est... ici! Oubliez les fake's!",919984183518351360,william bourgade,87,443,1,343,williambourgade,False
63,919984183518351360,author_id: 919984183518351360,coversation_id: 920934823006490624,920934823006490624,2017-10-19T09:49:00.000Z,"[{'start': 0, 'end': 12, 'username': 'theresa_may', 'id': '747807250819981312'}]",920949897565757440,id: 920949897565757440,747807250819981312,fr,1,0,1,1,"[{'type': 'replied_to', 'id': '920934823006490624'}]",everyone,Twitter for Android,@theresa_may Oui... Très bien écrit... ''D'abord les peuples''. Le métissage des cultures c'est être avec un avenir meilleur! C'est très important ! https://t.co/ZLLInek2Ld,2017-10-16T17:51:36.000Z,"Jeune trentenaire, blogger et inspiré par le nouveau Twitter... Suivez-moi sur mon compte officiel, qui est... ici! Oubliez les fake's!",919984183518351360,william bourgade,87,443,1,343,williambourgade,False
64,783544465931792384,author_id: 783544465931792384,coversation_id: 920934823006490624,920934823006490624,2017-10-19T09:54:26.000Z,"[{'start': 0, 'end': 12, 'username': 'theresa_may', 'id': '747807250819981312'}]",920951262769745920,id: 920951262769745920,747807250819981312,en,0,0,0,0,"[{'type': 'replied_to', 'id': '920934823006490624'}]",everyone,Twitter for iPhone,@theresa_may Tories never put “people first”.,2016-10-05T05:48:53.000Z,socialist bit sweary RT’s not endorsements just informative.,783544465931792384,just me #corbynwasright,2795,3276,4,71182,JCorbynwasright,False
65,302550283,author_id: 302550283,coversation_id: 920934823006490624,920934823006490624,2017-10-19T09:53:06.000Z,"[{'start': 0, 'end': 12, 'username': 'theresa_may', 'id': '747807250819981312'}]",920950928311808000,id: 920950928311808000,747807250819981312,en,6,0,0,0,"[{'type': 'replied_to', 'id': '920934823006490624'}]",everyone,Twitter for iPad,"@theresa_may If you were to really put people first you would #StopBrexit, it will hurt everyone who's not a millionaire for decades to come. #FinalSay",2011-05-21T11:18:20.000Z,"Conservatives the Party of No Law or Order. 
The PM lies, he breaks the law, there is no decency. He is supported by 300+ MPs. Time to #DrainTheTorySwamp",302550283,"Andrew Robertson wear a Face Mask, 2m Space 💙🌈",1114,3894,96,143442,arobertsonphoto,False
66,108042087,author_id: 108042087,coversation_id: 920934823006490624,920934823006490624,2017-10-19T09:53:05.000Z,"[{'start': 0, 'end': 14, 'username': 'MckenzieMoll1', 'id': '913523407886700545'}, {'start': 15, 'end': 27, 'username': 'theresa_may', 'id': '747807250819981312'}]",920950924344025088,id: 920950924344025088,913523407886700545,en,4,0,1,0,"[{'type': 'replied_to', 'id': '920945577738817536'}]",everyone,Twitter for Android,@MckenzieMoll1 @theresa_may That we can agree on!,2010-01-24T16:46:05.000Z,"Musician and QPR sufferer.
Patron of Warwick Folk Festival.",108042087,Will Pound,3815,3795,52,9267,willharmonica,False
67,2981826010,author_id: 2981826010,coversation_id: 920934823006490624,920934823006490624,2017-10-19T09:52:58.000Z,"[{'start': 0, 'end': 12, 'username': 'theresa_may', 'id': '747807250819981312'}]",920950893868089344,id: 920950893868089344,747807250819981312,en,0,0,0,0,"[{'type': 'replied_to', 'id': '920934823006490624'}]",everyone,Twitter for iPad,"@theresa_may Oh and to those saying, give us another vote. We already voted, doing anything to ignore that would spell disaster for us all. We’re leaving",2015-01-16T21:58:33.000Z,A smartass to the core 😏 #HugeBookNerd #ArmyBrat #BritishArmy #MilitaryJunkie #NFL (before the kneel thing) & #NHL fan #Brexit Lover of 🇬🇧 & 🇺🇸 Sense8 fan,2981826010,Kellie-Marie,368,573,1,2428,KellieMarie2901,False
68,2981826010,author_id: 2981826010,coversation_id: 920934823006490624,920934823006490624,2017-10-19T09:51:08.000Z,"[{'start': 17, 'end': 29, 'username': 'theresa_may', 'id': '747807250819981312'}]",920950433279107072,id: 920950433279107072,59096088,en,10,0,2,0,"[{'type': 'replied_to', 'id': '920936139778936832'}]",everyone,Twitter for iPad,"@HaiderSonneteer @theresa_may We the people chose #Brexit for a reason. We’re a tiny island, we can’t take more people. It’s that simple",2015-01-16T21:58:33.000Z,A smartass to the core 😏 #HugeBookNerd #ArmyBrat #BritishArmy #MilitaryJunkie #NFL (before the kneel thing) & #NHL fan #Brexit Lover of 🇬🇧 & 🇺🇸 Sense8 fan,2981826010,Kellie-Marie,368,573,1,2428,KellieMarie2901,False
69,2981826010,author_id: 2981826010,coversation_id: 920934823006490624,920934823006490624,2017-10-19T09:48:29.000Z,"[{'start': 0, 'end': 12, 'username': 'theresa_may', 'id': '747807250819981312'}]",920949767127085056,id: 920949767127085056,747807250819981312,en,0,0,1,0,"[{'type': 'replied_to', 'id': '920934823006490624'}]",everyone,Twitter for iPad,"@theresa_may I’m sorry, but I’m sick of feeling like a second class citizen in my own country. UK people FIRST. Don’t like it, leave!",2015-01-16T21:58:33.000Z,A smartass to the core 😏 #HugeBookNerd #ArmyBrat #BritishArmy #MilitaryJunkie #NFL (before the kneel thing) & #NHL fan #Brexit Lover of 🇬🇧 & 🇺🇸 Sense8 fan,2981826010,Kellie-Marie,368,573,1,2428,KellieMarie2901,False
70,1392759961,author_id: 1392759961,coversation_id: 920934823006490624,920934823006490624,2017-10-19T09:52:38.000Z,"[{'start': 0, 'end': 12, 'username': 'theresa_may', 'id': '747807250819981312'}]",920950812351877121,id: 920950812351877121,747807250819981312,es,0,0,0,0,"[{'type': 'replied_to', 'id': '920934823006490624'}]",everyone,Twitter for Android,"@theresa_may Thank you very much President May, un abrazo :) Que vaya bien la reunión",2013-04-30T18:32:46.000Z,Feliz. Sonriendo por la vida,1392759961,M.Pilar M.A. :),1,78,16,70936,Luz_Color_PMA,False
71,1923318924,author_id: 1923318924,coversation_id: 920934823006490624,920934823006490624,2017-10-19T09:47:21.000Z,"[{'start': 0, 'end': 12, 'username': 'theresa_may', 'id': '747807250819981312'}]",920949481801166848,id: 920949481801166848,747807250819981312,en,0,0,0,0,"[{'type': 'replied_to', 'id': '920934823006490624'}]",everyone,Twitter for iPad,@theresa_may Bexit means Brexit. Sinking the UK fast!,2013-10-01T12:44:55.000Z,When good people do nothing! Shit Happens! That's how I got to the top of the establishment!,1923318924,Harry P Flashman,1131,1234,19,27706,dozzybuzz,False
72,1923318924,author_id: 1923318924,coversation_id: 920934823006490624,920934823006490624,2017-10-19T09:44:02.000Z,"[{'start': 0, 'end': 12, 'username': 'theresa_may', 'id': '747807250819981312'}]",920948647369543680,id: 920948647369543680,747807250819981312,en,0,0,0,0,"[{'type': 'replied_to', 'id': '920934823006490624'}]",everyone,Twitter for iPad,@theresa_may Platitudes!,2013-10-01T12:44:55.000Z,When good people do nothing! Shit Happens! That's how I got to the top of the establishment!,1923318924,Harry P Flashman,1131,1234,19,27706,dozzybuzz,False
73,37245927,author_id: 37245927,coversation_id: 920934823006490624,920934823006490624,2017-10-19T09:47:00.000Z,"[{'start': 0, 'end': 12, 'username': 'theresa_may', 'id': '747807250819981312'}]",920949395461496832,id: 920949395461496832,747807250819981312,en,1,0,0,0,"[{'type': 'replied_to', 'id': '920934823006490624'}]",everyone,Twitter for iPhone,@theresa_may You will never put angone first because you're a selfish woman who thinks about herself and money. I hope your family has to go on UC 🙌🏻,2009-05-02T17:55:39.000Z,,37245927,Casey,1914,1790,33,20808,CaseyLeighD,False
74,760917257958678529,author_id: 760917257958678529,coversation_id: 920934823006490624,920934823006490624,2017-10-19T09:46:37.000Z,"[{'start': 0, 'end': 12, 'username': 'theresa_may', 'id': '747807250819981312'}]",920949296089976832,id: 920949296089976832,747807250819981312,en,0,0,0,0,"[{'type': 'replied_to', 'id': '920934823006490624'}]",everyone,Twitter for iPhone,@theresa_may Putting people first? When was this policy change implemented?,2016-08-03T19:16:26.000Z,"Go easy, step lightly, stay free.",760917257958678529,Pete,71,467,0,3961,hirstysboots,False
75,234694571,author_id: 234694571,coversation_id: 920934823006490624,920934823006490624,2017-10-19T09:44:34.000Z,"[{'start': 0, 'end': 12, 'username': 'theresa_may', 'id': '747807250819981312'}]",920948781767675905,id: 920948781767675905,747807250819981312,en,28,0,1,13,"[{'type': 'replied_to', 'id': '920934823006490624'}]",everyone,Twitter Web Client,"@theresa_may You knew Brexit would hurt the people
You know Brexit is hurting the people
You know Brexit will keep hurting the people
#PuttingPeopleFirst",2011-01-06T09:50:22.000Z,"Femi Oluwole
🇬🇧Law grad ''Do-Gooder''
Writer for @Independent
Media enquiries: Femi.Sorry@gmail.com (DM me to be sure)",234694571,Femi,362148,2440,1432,96837,Femi_Sorry,True
76,562990635,author_id: 562990635,coversation_id: 920934823006490624,920934823006490624,2017-10-19T09:41:51.000Z,"[{'start': 0, 'end': 12, 'username': 'theresa_may', 'id': '747807250819981312'}]",920948097022382080,id: 920948097022382080,747807250819981312,en,0,0,0,0,"[{'type': 'replied_to', 'id': '920934823006490624'}]",everyone,Twitter for Android,@theresa_may You put yourself first. You're an embarrassment,2012-04-25T14:07:19.000Z,,562990635,Northern Kitty 🟨🟥,580,999,7,68439,NorthernKitty69,False
77,2792425911,author_id: 2792425911,coversation_id: 920934823006490624,920934823006490624,2017-10-19T09:41:31.000Z,"[{'start': 0, 'end': 14, 'username': 'MckenzieMoll1', 'id': '913523407886700545'}, {'start': 15, 'end': 29, 'username': 'Steven_Lanham', 'id': '532023520'}, {'start': 30, 'end': 42, 'username': 'theresa_may', 'id': '747807250819981312'}]",920948012364517376,id: 920948012364517376,913523407886700545,en,8,0,0,1,"[{'type': 'replied_to', 'id': '920940876142137346'}]",everyone,Twitter for iPhone,@MckenzieMoll1 @Steven_Lanham @theresa_may they’re,2014-09-29T18:39:29.000Z,"Various languages/interests: #opera discography, #sports, #baking & #politics. #Libertarian w/a 💜#TeamGay #TeamTaken ⚽ #COYS #runner #avgeek - usual fineprint",2792425911,Till,1216,2880,117,110703,iamths1973,False
78,195732356,author_id: 195732356,coversation_id: 920934823006490624,920934823006490624,2017-10-19T09:40:39.000Z,"[{'start': 0, 'end': 12, 'username': 'theresa_may', 'id': '747807250819981312'}]",920947795221196800,id: 920947795221196800,747807250819981312,en,0,0,0,0,"[{'type': 'replied_to', 'id': '920934823006490624'}]",everyone,Twitter for iPhone,@theresa_may Putting party first 😂,2010-09-27T13:05:47.000Z,"All about running. marathon 3:06, half 1:23:26, 10k 37:22, 5k 17:22",195732356,the truth,677,562,12,49962,joevankas,False
79,908452616132276226,author_id: 908452616132276226,coversation_id: 920934823006490624,920934823006490624,2017-10-19T09:38:05.000Z,"[{'start': 0, 'end': 12, 'username': 'theresa_may', 'id': '747807250819981312'}]",920947148597989378,id: 920947148597989378,747807250819981312,en,0,0,0,0,"[{'type': 'replied_to', 'id': '920934823006490624'}]",everyone,Twitter for Android,@theresa_may YOU 'DO NOT' PUT PEOPLE FIRST ANOTHER DAY ANOTHER LIE. POLITICS THINKS ABOUT POLITICS 1ST. NO BENEFIT TO THE PUBLIC EVER. YOUR DISGUSTING.,2017-09-14T22:09:16.000Z,,908452616132276226,Brad4d,5,36,0,481,_Brad4d,False
80,550300091,author_id: 550300091,coversation_id: 920934823006490624,920934823006490624,2017-10-19T09:36:09.000Z,"[{'start': 0, 'end': 12, 'username': 'theresa_may', 'id': '747807250819981312'}]",920946662968872960,id: 920946662968872960,550300091,en,0,0,0,0,"[{'type': 'replied_to', 'id': '920946433850789888'}]",everyone,Twitter for iPhone,"@theresa_may We were called ""negotiating capital"", ""bargaining capital"" - do you believe we are stupid? As Home Sec, you hated immigrants - no change",2012-04-10T17:43:01.000Z,"Writer, pagan, coach, immigrant. 🏳️‍🌈🇪🇺🌳 Discord: https://t.co/zm753JCZkm",550300091,Aleksandr Voinov,4247,955,170,108035,AleksandrVoinov,False
81,550300091,author_id: 550300091,coversation_id: 920934823006490624,920934823006490624,2017-10-19T09:35:14.000Z,"[{'start': 0, 'end': 12, 'username': 'theresa_may', 'id': '747807250819981312'}]",920946433850789888,id: 920946433850789888,747807250819981312,en,0,0,1,0,"[{'type': 'replied_to', 'id': '920934823006490624'}]",everyone,Twitter for iPhone,"@theresa_may Full of lies, gas-lighting, denying abusive treatment and easily refuted. You called us ""citizens of nowhere"" - choke on your cake. #Leaving",2012-04-10T17:43:01.000Z,"Writer, pagan, coach, immigrant. 🏳️‍🌈🇪🇺🌳 Discord: https://t.co/zm753JCZkm",550300091,Aleksandr Voinov,4247,955,170,108035,AleksandrVoinov,False
82,520462798,author_id: 520462798,coversation_id: 920934823006490624,920934823006490624,2017-10-19T09:36:01.000Z,"[{'start': 0, 'end': 12, 'username': 'theresa_may', 'id': '747807250819981312'}]",920946628583940096,id: 920946628583940096,747807250819981312,en,0,0,0,0,"[{'type': 'replied_to', 'id': '920934823006490624'}]",everyone,Twitter for iPhone,@theresa_may What about graduated students that will be willing to follow their first entry level job in UK for 2018?,2012-03-10T14:56:56.000Z,Marseille📍#fromBordeaux 🍷,520462798,fadou_,75,187,0,4443,fadoou,False
83,254124375,author_id: 254124375,coversation_id: 920934823006490624,920934823006490624,2017-10-19T09:35:47.000Z,"[{'start': 0, 'end': 12, 'username': 'theresa_may', 'id': '747807250819981312'}]",920946571839180801,id: 920946571839180801,747807250819981312,en,0,0,0,0,"[{'type': 'replied_to', 'id': '920934823006490624'}]",everyone,Twitter for Android,@theresa_may Can't hear you cos ya mouth's full of shit #brexitlies #torylies,2011-02-18T17:07:06.000Z,Photographer. Sports enthusiast. Person.,254124375,Iam Burn,238,374,16,15286,itsaphotofinish,False
84,738811578557026305,author_id: 738811578557026305,coversation_id: 920934823006490624,920934823006490624,2017-10-19T09:34:31.000Z,"[{'start': 0, 'end': 12, 'username': 'theresa_may', 'id': '747807250819981312'}]",920946252434563072,id: 920946252434563072,747807250819981312,en,0,0,0,0,"[{'type': 'replied_to', 'id': '920934823006490624'}]",everyone,Twitter for iPhone,"@theresa_may Mrs May, from the outside it does appear that today’s article in the time rings true.  I haven’t once read of a proposal from the EU team.",2016-06-03T19:16:21.000Z,"Husband, Father and 100% Blade",738811578557026305,middle aged man,27,487,0,1048,illo1976,False
85,47615315,author_id: 47615315,coversation_id: 920934823006490624,920934823006490624,2017-10-19T09:30:45.000Z,"[{'start': 0, 'end': 12, 'username': 'theresa_may', 'id': '747807250819981312'}]",920945303431282688,id: 920945303431282688,747807250819981312,en,0,0,0,0,"[{'type': 'replied_to', 'id': '920934823006490624'}]",everyone,Tweetbot for iΟS,"@theresa_may You must be fucking kidding me. May, you are an empty disgrace. Take your husbands millions and fuck off.",2009-06-16T12:49:43.000Z,"Composer / Technical Writer / Technician
1960-2018",47615315,John Molloy,260,754,12,22104,jgpmolloy,False
86,370728610,author_id: 370728610,coversation_id: 920934823006490624,920934823006490624,2017-10-19T09:30:08.000Z,"[{'start': 0, 'end': 12, 'username': 'theresa_may', 'id': '747807250819981312'}]",920945148560855040,id: 920945148560855040,747807250819981312,en,0,0,0,0,"[{'type': 'replied_to', 'id': '920934823006490624'}]",everyone,Twitter for iPad,@theresa_may Putting who ? What? First ?..... Your government are only out for yourselves not the hard workers of our country ! https://t.co/BOUqyt52zY,2011-09-09T14:44:10.000Z,shape your life the way you want. be your own creator and paint your own path ♥️,370728610,Stephen Jacob,470,1447,4,3431,stevieboi2012,False
87,22780471,author_id: 22780471,coversation_id: 920934823006490624,920934823006490624,2017-10-19T09:28:59.000Z,"[{'start': 0, 'end': 12, 'username': 'theresa_may', 'id': '747807250819981312'}]",920944859258720256,id: 920944859258720256,747807250819981312,en,10,0,0,1,"[{'type': 'replied_to', 'id': '920934823006490624'}]",everyone,Twitter Web Client,"@theresa_may UK citizens are also current EU citizens, many very happily. Why are you stripping our rights? Please just halt this self-destructive idiocy",2009-03-04T14:41:22.000Z,design—imagination—climate—amateur futures ⦿ Imaginaries Lab ⦿ https://t.co/WZOWDABKjd ⦿ he/him ⦿ A Prof Future Everyday @TUEindhoven; exes inc @carnegiemellon @rca,22780471,Dan Lockton,9766,10724,478,14180,imaginari_es,False
88,118174495,author_id: 118174495,coversation_id: 920934823006490624,920934823006490624,2017-10-19T09:27:42.000Z,"[{'start': 0, 'end': 12, 'username': 'theresa_may', 'id': '747807250819981312'}]",920944536574222336,id: 920944536574222336,747807250819981312,en,6,0,0,2,"[{'type': 'replied_to', 'id': '920934823006490624'}]",everyone,Twitter for Android,@theresa_may How about #waspi who were robbed,2010-02-27T20:53:57.000Z,"𝙊𝙖𝙨𝙞𝙨! is life.                                                            
Born to support Mufc! 🇾🇪
❤",118174495,🏺Anna🏺,2932,4911,55,75079,Anna_Star98,False
89,296145792,author_id: 296145792,coversation_id: 920934823006490624,920934823006490624,2017-10-19T09:27:34.000Z,"[{'start': 0, 'end': 12, 'username': 'theresa_may', 'id': '747807250819981312'}]",920944502717800448,id: 920944502717800448,747807250819981312,en,7,0,0,0,"[{'type': 'replied_to', 'id': '920934823006490624'}]",everyone,Twitter Web Client,"@theresa_may holy shit woman!

maybe if you lost half your fortune every time you lied you'd be a little more circumspect, act with a little more probity",2011-05-10T08:30:27.000Z,"want a fair society so people pay their dues, look after the young, old weak and vulnerable. views are my own. RT means I wish I'd said it #FBPE",296145792,The very reverend left_of_right #FBPE,577,705,27,27977,julianhopes,False
90,232202909,author_id: 232202909,coversation_id: 920934823006490624,920934823006490624,2017-10-19T09:26:59.000Z,"[{'start': 0, 'end': 12, 'username': 'theresa_may', 'id': '747807250819981312'}]",920944354340102144,id: 920944354340102144,747807250819981312,en,0,0,0,0,"[{'type': 'replied_to', 'id': '920934823006490624'}]",everyone,Twitter Web Client,@theresa_may What happens to the non-UK partner in marriages currently outside the UK?,2010-12-30T14:28:22.000Z,"Pearls before swine (no, not you). https://t.co/sV5NE51LJj",232202909,John Deans,364,720,4,17298,jjbillyd,False
91,715068598520307713,author_id: 715068598520307713,coversation_id: 920934823006490624,920934823006490624,2017-10-19T09:26:38.000Z,"[{'start': 0, 'end': 12, 'username': 'theresa_may', 'id': '747807250819981312'}]",920944270223249408,id: 920944270223249408,747807250819981312,en,0,0,0,0,"[{'type': 'replied_to', 'id': '920934823006490624'}]",everyone,Twitter for Android,@theresa_may I've got it and I'm pleased to read it! Thank you!,2016-03-30T06:50:14.000Z,,715068598520307713,Anita Ludanyi,2,14,0,268,nemeti_anita,False
92,27884329,author_id: 27884329,coversation_id: 920934823006490624,920934823006490624,2017-10-19T09:26:26.000Z,"[{'start': 0, 'end': 12, 'username': 'theresa_may', 'id': '747807250819981312'}]",920944218444587008,id: 920944218444587008,747807250819981312,en,1,0,0,0,"[{'type': 'replied_to', 'id': '920934823006490624'}]",everyone,Twitter for iPhone,@theresa_may Resign.,2009-03-31T14:48:30.000Z,Glory to Ukraine. Death to Putin.,27884329,Christian Betts,512,203,20,11225,christianbetts,False
93,823237977996464129,author_id: 823237977996464129,coversation_id: 920934823006490624,920934823006490624,2017-10-19T09:25:27.000Z,"[{'start': 0, 'end': 12, 'username': 'theresa_may', 'id': '747807250819981312'}]",920943972163424256,id: 920943972163424256,747807250819981312,en,0,0,0,0,"[{'type': 'replied_to', 'id': '920934823006490624'}]",everyone,Twitter for iPhone,@theresa_may Price of suit &amp; shop brought?? most people can’t afford what u wear maybe a months waiting for money,2017-01-22T18:36:43.000Z,,823237977996464129,Empress Gad,106,287,1,6213,LadyrootsE,False
94,1287454771,author_id: 1287454771,coversation_id: 920934823006490624,920934823006490624,2017-10-19T09:24:41.000Z,"[{'start': 0, 'end': 12, 'username': 'theresa_may', 'id': '747807250819981312'}]",920943776516005889,id: 920943776516005889,747807250819981312,en,0,0,0,0,"[{'type': 'replied_to', 'id': '920934823006490624'}]",everyone,Twitter for iPhone,"@theresa_may Ambiguous May give me my country back

#indyref2",2013-03-22T01:40:35.000Z,Imagine...,1287454771,Brogan,293,1038,0,11965,djbrogandj,False
95,2294509452,author_id: 2294509452,coversation_id: 920934823006490624,920934823006490624,2017-10-19T09:24:12.000Z,"[{'start': 0, 'end': 12, 'username': 'theresa_may', 'id': '747807250819981312'}]",920943655510257664,id: 920943655510257664,747807250819981312,en,5,0,0,0,"[{'type': 'replied_to', 'id': '920934823006490624'}]",everyone,Twitter Web Client,"@theresa_may But back in October, we were the governments ""main negotiating cards"" (according to L Fox). How's that working out, using humans as objects?",2014-01-16T14:14:56.000Z,"Philosophy professor. Philosophy, science, religion, SFF, @SFWA, Codex, occasional lute video, Philosophy Illustrated w/ @OUPAcademic. Any pronouns",2294509452,Helen De Cruz,18815,8195,192,31148,Helenreflects,False
96,14132016,author_id: 14132016,coversation_id: 920934823006490624,920934823006490624,2017-10-19T09:23:41.000Z,"[{'start': 0, 'end': 12, 'username': 'theresa_may', 'id': '747807250819981312'}]",920943525914652674,id: 920943525914652674,747807250819981312,en,1,0,0,0,"[{'type': 'replied_to', 'id': '920934823006490624'}]",everyone,Twitter for iPhone,"@theresa_may If you’re putting people first, you won’t kill my Freedom of Movement for a failed attempt to quell your party’s disharmony.",2008-03-12T13:21:00.000Z,Active Travel and Product Management.,14132016,Rich Warner,1257,1050,48,33305,rgwarner,False
0,823237977996464129,author_id: 823237977996464129,coversation_id: 920934823006490624,920934823006490624,2017-10-19T09:22:21.000Z,"[{'start': 0, 'end': 12, 'username': 'theresa_may', 'id': '747807250819981312'}]",920943188210323457,id: 920943188210323457,747807250819981312,en,0,0,0,0,"[{'type': 'replied_to', 'id': '920934823006490624'}]",everyone,Twitter for iPhone,@theresa_may PMQ live yesterday ur suit is my style but must say ur a very cold person in all ur answers to questions expressions on ur face 😮😮😮😮,2017-01-22T18:36:43.000Z,,823237977996464129,Empress Gad,106,287,1,6213,LadyrootsE,False
1,823237977996464129,author_id: 823237977996464129,coversation_id: 920934823006490624,920934823006490624,2017-10-19T09:16:05.000Z,"[{'start': 0, 'end': 11, 'username': 'Jasontoni2', 'id': '4860688038'}, {'start': 12, 'end': 24, 'username': 'theresa_may', 'id': '747807250819981312'}, {'start': 25, 'end': 37, 'username': 'topradio909', 'id': '159088664'}]",920941613555290112,id: 920941613555290112,4860688038,en,0,0,0,0,"[{'type': 'replied_to', 'id': '920939517045084160'}]",everyone,Twitter for iPhone,@Jasontoni2 @theresa_may @TopRadio909 There lovers 😂😂 they think the same &amp; their conservatives,2017-01-22T18:36:43.000Z,,823237977996464129,Empress Gad,106,287,1,6213,LadyrootsE,False
2,823237977996464129,author_id: 823237977996464129,coversation_id: 920934823006490624,920934823006490624,2017-10-19T09:13:38.000Z,"[{'start': 16, 'end': 28, 'username': 'theresa_may', 'id': '747807250819981312'}]",920940997793779713,id: 920940997793779713,860880537904455680,en,0,0,0,0,"[{'type': 'replied_to', 'id': '920937942536814592'}]",everyone,Twitter for iPhone,@deepskywarrior @theresa_may Exactly,2017-01-22T18:36:43.000Z,,823237977996464129,Empress Gad,106,287,1,6213,LadyrootsE,False
3,1287454771,author_id: 1287454771,coversation_id: 920934823006490624,920934823006490624,2017-10-19T09:20:40.000Z,"[{'start': 0, 'end': 13, 'username': 'Axelrose1993', 'id': '386130967'}, {'start': 14, 'end': 26, 'username': 'theresa_may', 'id': '747807250819981312'}, {'start': 62, 'end': 75, 'username': 'Axelrose1993', 'id': '386130967'}]",920942765806178304,id: 920942765806178304,386130967,en,0,0,0,0,"[{'type': 'replied_to', 'id': '920937691121889280'}]",everyone,Twitter for iPhone,"@Axelrose1993 @theresa_may “Get the fuck outta here” you mean @Axelrose1993 

You know there are another 3 countries in the UK 2 of which voted to #remain

#democracy",2013-03-22T01:40:35.000Z,Imagine...,1287454771,Brogan,293,1038,0,11965,djbrogandj,False
