,author_id,author_id_new,conv_id_new,conversation_id,created_at,entities.mentions,id,id_new,in_reply_to_user_id,lang,public_metrics.like_count,public_metrics.quote_count,public_metrics.reply_count,public_metrics.retweet_count,referenced_tweets,reply_settings,source,text,users.created_at,users.description,users.id,users.name,users.public_metrics.followers_count,users.public_metrics.following_count,users.public_metrics.listed_count,users.public_metrics.tweet_count,users.username,users.verified
0,1110931862984290305,author_id: 1110931862984290305,coversation_id: 920934823006490624,920934823006490624,2019-06-20T23:06:59.000Z,"[{'start': 0, 'end': 12, 'username': 'theresa_may', 'id': '747807250819981312'}]",1141844926428340227,id: 1141844926428340227,747807250819981312,no,0,0,0,0,"[{'type': 'replied_to', 'id': '920934823006490624'}]",everyone,Twitter for Android,@theresa_may Utter liar.,2019-03-27T15:49:31.000Z,Nothing particularly special about me! But passionate about trying to improve the lives of vulnerable groups.,1110931862984290305,George Herbert,8,18,0,820,GeorgeH11549373,False
1,434853708,author_id: 434853708,coversation_id: 920934823006490624,920934823006490624,2017-11-08T12:55:10.000Z,"[{'start': 0, 'end': 12, 'username': 'theresa_may', 'id': '747807250819981312'}]",928244502724272128,id: 928244502724272128,747807250819981312,en,0,0,0,0,"[{'type': 'replied_to', 'id': '920934823006490624'}]",everyone,Twitter Web Client,@theresa_may Since when have the Tories put anyone first except their own elitist cohorts? How can she make such claims when she is about to turn this nation's landscape into a fracking industrial complex against the electorate's wishes in return for US dollar bribes?,2011-12-12T11:47:42.000Z,"I am married, retired & enjoy photography, reading history/historical biographies. In summer, my wife & I take frequent caravan holidays in the UK & Europe.",434853708,Brian Chambers,11,13,0,280,PtolomyOne,False
2,49015701,author_id: 49015701,coversation_id: 920934823006490624,920934823006490624,2017-11-03T20:40:06.000Z,"[{'start': 0, 'end': 12, 'username': 'theresa_may', 'id': '747807250819981312'}]",926549567771938817,id: 926549567771938817,747807250819981312,en,0,0,0,0,"[{'type': 'replied_to', 'id': '920934823006490624'}]",everyone,Twitter for iPhone,@theresa_may Your letter did not reach Catalonia. Intercepted by the fascist opressor. But close your eyes and sleep well... https://t.co/2l8tWiJQUY,2009-06-20T14:17:15.000Z,,49015701,Binoclard,133,180,0,8433,Bremborio,False
3,914917512931921920,author_id: 914917512931921920,coversation_id: 920934823006490624,920934823006490624,2017-10-31T13:00:39.000Z,"[{'start': 16, 'end': 30, 'username': 'haut_francais', 'id': '492944111'}, {'start': 31, 'end': 43, 'username': 'theresa_may', 'id': '747807250819981312'}]",925346783290683392,id: 925346783290683392,23298138,en,0,0,0,0,"[{'type': 'replied_to', 'id': '920951393682325505'}]",everyone,Twitter for iPhone,@WendyLilygreen @haut_francais @theresa_may Oh and you forgot money...,2017-10-02T18:18:28.000Z,Truths and Observations General News Health Politics YouTube Science & Technology Music Comedy Bull 💩 detector on full,914917512931921920,Leon,152,273,1,11798,dliono112,False
4,914917512931921920,author_id: 914917512931921920,coversation_id: 920934823006490624,920934823006490624,2017-10-31T13:00:13.000Z,"[{'start': 0, 'end': 14, 'username': 'haut_francais', 'id': '492944111'}, {'start': 15, 'end': 27, 'username': 'theresa_may', 'id': '747807250819981312'}]",925346674259742720,id: 925346674259742720,492944111,en,0,0,0,0,"[{'type': 'replied_to', 'id': '920946529816535040'}]",everyone,Twitter for iPhone,@haut_francais @theresa_may Simple they cut police numbers a few years ago...,2017-10-02T18:18:28.000Z,Truths and Observations General News Health Politics YouTube Science & Technology Music Comedy Bull 💩 detector on full,914917512931921920,Leon,152,273,1,11798,dliono112,False
5,914917512931921920,author_id: 914917512931921920,coversation_id: 920934823006490624,920934823006490624,2017-10-31T12:59:47.000Z,"[{'start': 0, 'end': 12, 'username': 'theresa_may', 'id': '747807250819981312'}]",925346564419280897,id: 925346564419280897,747807250819981312,en,0,0,0,0,"[{'type': 'replied_to', 'id': '920934823006490624'}]",everyone,Twitter for iPhone,@theresa_may Better late then....,2017-10-02T18:18:28.000Z,Truths and Observations General News Health Politics YouTube Science & Technology Music Comedy Bull 💩 detector on full,914917512931921920,Leon,152,273,1,11798,dliono112,False
6,2434081019,author_id: 2434081019,coversation_id: 920934823006490624,920934823006490624,2017-10-29T16:10:54.000Z,"[{'start': 0, 'end': 12, 'username': 'theresa_may', 'id': '747807250819981312'}]",924669884419706880,id: 924669884419706880,747807250819981312,en,0,0,0,0,"[{'type': 'replied_to', 'id': '920934823006490624'}]",everyone,Twitter for iPad,@theresa_may Is this how you make sure EU citizens living lawfully in UK are welcomed as you claimed in your letter? https://t.co/ZCQYQFh14Q,2014-03-24T20:32:36.000Z,,2434081019,Patricia Feldhoff 🇺🇦🇪🇺🕯#FBPE,979,552,2,119521,mpfeldhoff,False
7,1043960562,author_id: 1043960562,coversation_id: 920934823006490624,920934823006490624,2017-10-28T02:10:41.000Z,"[{'start': 0, 'end': 12, 'username': 'theresa_may', 'id': '747807250819981312'}]",924096049135812609,id: 924096049135812609,747807250819981312,en,0,0,0,0,"[{'type': 'replied_to', 'id': '920934823006490624'}]",everyone,Twitter Web Client,"@theresa_may What  about UK citizens living in Europe, There is no reciprocal benefits given them!
Pity our pensions don't reflect EU Pensions!!!!!!!!!!!",2012-12-29T06:05:14.000Z,,1043960562,Alan Williams,3,3,0,630,VK7AM,False
8,788843714571603970,author_id: 788843714571603970,coversation_id: 920934823006490624,920934823006490624,2017-10-26T11:58:51.000Z,"[{'start': 0, 'end': 12, 'username': 'theresa_may', 'id': '747807250819981312'}]",923519290049028096,id: 923519290049028096,747807250819981312,en,0,0,0,0,"[{'type': 'replied_to', 'id': '920934823006490624'}]",everyone,Twitter for iPhone,@theresa_may Did you change the printer settings in HO yet? If anything I think you gave ppl more reasons to leave what with ur van &amp; Incompetence in HO,2016-10-19T20:46:12.000Z,"olive skinned, stubborn, assertive & caring, no/ little time 4 nonsense. Born Anti-Tory #GTTO #ForTheManyNotTheFew #ThankYouCorbyn",788843714571603970,S. Nyang,5223,5171,1,53303,S_Nyang74,False
9,910948257748148227,author_id: 910948257748148227,coversation_id: 920934823006490624,920934823006490624,2017-10-25T03:11:27.000Z,"[{'start': 0, 'end': 12, 'username': 'theresa_may', 'id': '747807250819981312'}]",923024179359899648,id: 923024179359899648,747807250819981312,en,0,0,0,0,"[{'type': 'replied_to', 'id': '920934823006490624'}]",everyone,Twitter for Android,@theresa_may Hollow and once again late to the party Mrs May! You are a remainer and need to accept that regardless of the consequences. Bargaining chips,2017-09-21T19:26:04.000Z,We still have a CO2 -green house gas- climate change denier problem. Pesticides are killing bees. We need a proportional representation voting system & UBI.,910948257748148227,Robert Short #FBPE #3.5% #Rejoin #Reform #FBPA,5962,6152,10,1925,RobertShort100,False
10,869619504808157184,author_id: 869619504808157184,coversation_id: 920934823006490624,920934823006490624,2017-10-23T22:15:12.000Z,"[{'start': 0, 'end': 12, 'username': 'theresa_may', 'id': '747807250819981312'}]",922587234552786944,id: 922587234552786944,747807250819981312,en,0,0,0,0,"[{'type': 'replied_to', 'id': '920934823006490624'}]",everyone,Twitter for iPhone,@theresa_may I think you mean “putting people with loads of money first”,2017-05-30T18:20:21.000Z,,869619504808157184,.,75,270,0,1517,lpatricia___,False
11,542525921,author_id: 542525921,coversation_id: 920934823006490624,920934823006490624,2017-10-23T06:19:55.000Z,"[{'start': 0, 'end': 12, 'username': 'theresa_may', 'id': '747807250819981312'}]",922346829865455616,id: 922346829865455616,747807250819981312,en,0,0,0,0,"[{'type': 'replied_to', 'id': '920934823006490624'}]",everyone,Twitter Web Client,@theresa_may Should be 'Putting british people first' Theresa May,2012-04-01T13:01:40.000Z,,542525921,Stuart Burton,17,53,0,327,Manowarmetal666,False
12,56147198,author_id: 56147198,coversation_id: 920934823006490624,920934823006490624,2017-10-22T22:14:09.000Z,"[{'start': 0, 'end': 12, 'username': 'theresa_may', 'id': '747807250819981312'}]",922224582928543744,id: 922224582928543744,747807250819981312,en,0,0,0,0,"[{'type': 'replied_to', 'id': '920934823006490624'}]",everyone,Twitter Web Client,@theresa_may Putting tories first...,2009-07-12T17:54:18.000Z,Adventure-prone:Survivor of degrees in Social Work/American Studies/Hurricane Katrina/The Arab Spring/an Ice Storm/Employment Discrimination Case/Uni Challenge.,56147198,Rosemary #FBPA,1019,498,4,168321,rosepoet,False
13,888437685609787392,author_id: 888437685609787392,coversation_id: 920934823006490624,920934823006490624,2017-10-22T18:37:43.000Z,"[{'start': 0, 'end': 12, 'username': 'theresa_may', 'id': '747807250819981312'}]",922170117043228672,id: 922170117043228672,747807250819981312,en,2,0,0,1,"[{'type': 'replied_to', 'id': '920934823006490624'}]",everyone,Twitter for iPhone,@theresa_may Putting people first 🤣🤣🤣🤣🤣,2017-07-21T16:37:05.000Z,Like the Phoenix - #United4Grenfell #Saftey4All #DemandChange,888437685609787392,Grenfell Tower 💚,6182,5937,22,16893,Still_I_Rise_GT,False
14,1621336758,author_id: 1621336758,coversation_id: 920934823006490624,920934823006490624,2017-10-22T10:48:01.000Z,"[{'start': 0, 'end': 14, 'username': 'willharmonica', 'id': '108042087'}, {'start': 15, 'end': 29, 'username': 'MckenzieMoll1', 'id': '913523407886700545'}, {'start': 30, 'end': 42, 'username': 'theresa_may', 'id': '747807250819981312'}]",922051913063043072,id: 922051913063043072,108042087,en,0,0,0,0,"[{'type': 'replied_to', 'id': '920950924344025088'}]",everyone,Twitter for Android,@willharmonica @MckenzieMoll1 @theresa_may #BrexitCat is too proud to admit it is throwing good catfood out after bad https://t.co/lckvf3C6te,2013-07-25T21:48:07.000Z,"Z. Third-rate polymath. Bristling Tyke
Benefit of doubt unless you're a #SabrinaJoy or the meanest teacher in the UK
80%she/20%🤷👾
#ActuallyAutistic👩‍💻",1621336758,Mrs Krampus 🐙🍰🎮🎶🎻🧠,279,662,7,35271,TheGrampusWife,False
15,20754491,author_id: 20754491,coversation_id: 920934823006490624,920934823006490624,2017-10-22T09:30:33.000Z,"[{'start': 0, 'end': 12, 'username': 'theresa_may', 'id': '747807250819981312'}]",922032417908690944,id: 922032417908690944,747807250819981312,en,0,0,0,0,"[{'type': 'replied_to', 'id': '920934823006490624'}]",everyone,Twitter Web Client,@theresa_may I bet you gagged while you were writing that letter. You have NEVER put people first. You have been forced to put them first by the EU.,2009-02-13T07:26:51.000Z,"Never has so much been taken off so many by so few.
RT's are interesting and not endorsements.",20754491,Jen Wood - est optimum simpliciter,15951,8990,12,458730,unojen_wood,False
16,3427661555,author_id: 3427661555,coversation_id: 920934823006490624,920934823006490624,2017-10-22T08:59:57.000Z,"[{'start': 0, 'end': 12, 'username': 'theresa_may', 'id': '747807250819981312'}]",922024715232907264,id: 922024715232907264,747807250819981312,en,0,0,0,0,"[{'type': 'replied_to', 'id': '920934823006490624'}]",everyone,Twitter for Android,"@theresa_may keep up the shambles it's not as if we'll suffer, https://t.co/4dUWYAWbLL",2015-08-17T08:45:19.000Z,,3427661555,fat lad🇺🇦 🌈 NHS,4959,5448,19,103635,formerlyknow,False
17,586013773,author_id: 586013773,coversation_id: 920934823006490624,920934823006490624,2017-10-22T04:43:08.000Z,"[{'start': 0, 'end': 14, 'username': 'haut_francais', 'id': '492944111'}, {'start': 15, 'end': 27, 'username': 'theresa_may', 'id': '747807250819981312'}]",921960085991149568,id: 921960085991149568,492944111,en,0,0,0,0,"[{'type': 'replied_to', 'id': '920946529816535040'}]",everyone,Twitter for Android,@haut_francais @theresa_may ToryTwattery luv,2012-05-20T21:32:06.000Z,now incurable and going downhill fast. fuck fucking cancer,586013773,Carolan Lockett,163,206,2,13821,carolanlockett,False
18,586013773,author_id: 586013773,coversation_id: 920934823006490624,920934823006490624,2017-10-22T04:38:42.000Z,"[{'start': 0, 'end': 14, 'username': 'MckenzieMoll1', 'id': '913523407886700545'}, {'start': 15, 'end': 30, 'username': 'iMAM_MAHDi_313', 'id': '56235675'}, {'start': 31, 'end': 43, 'username': 'theresa_may', 'id': '747807250819981312'}]",921958972080484352,id: 921958972080484352,913523407886700545,en,0,0,0,0,"[{'type': 'replied_to', 'id': '920944093223636992'}]",everyone,Twitter for Android,@MckenzieMoll1 @iMAM_MAHDi_313 @theresa_may Because of jeremy cunt and twats like branson,2012-05-20T21:32:06.000Z,now incurable and going downhill fast. fuck fucking cancer,586013773,Carolan Lockett,163,206,2,13821,carolanlockett,False
19,586013773,author_id: 586013773,coversation_id: 920934823006490624,920934823006490624,2017-10-22T04:37:17.000Z,"[{'start': 0, 'end': 12, 'username': 'theresa_may', 'id': '747807250819981312'}]",921958614558003201,id: 921958614558003201,747807250819981312,en,0,0,0,0,"[{'type': 'replied_to', 'id': '920934823006490624'}]",everyone,Twitter for Android,@theresa_may why are you deporting students and pregnant women then?,2012-05-20T21:32:06.000Z,now incurable and going downhill fast. fuck fucking cancer,586013773,Carolan Lockett,163,206,2,13821,carolanlockett,False
20,419878970,author_id: 419878970,coversation_id: 920934823006490624,920934823006490624,2017-10-21T19:46:18.000Z,"[{'start': 0, 'end': 12, 'username': 'NotMyBrexit', 'id': '1182726811861573633'}, {'start': 13, 'end': 25, 'username': 'theresa_may', 'id': '747807250819981312'}]",921824986377146369,id: 921824986377146369,746647040826970112,en,1,0,0,1,"[{'type': 'replied_to', 'id': '921076349992886274'}]",everyone,Twitter for iPhone,@notmybrexit @theresa_may We lost now unite behind PM to get the best deal full stop 🛑,2011-11-23T22:22:32.000Z,Business Support Project Graduate of kingston law university surrey former civil servant passion tennis films writing... enjoy kettlebells trx training in Gym:),419878970,janet osuji,274,0,4,4736,JanetOsuji,False
21,419878970,author_id: 419878970,coversation_id: 920934823006490624,920934823006490624,2017-10-21T19:42:09.000Z,"[{'start': 0, 'end': 12, 'username': 'theresa_may', 'id': '747807250819981312'}]",921823942049959936,id: 921823942049959936,747807250819981312,en,0,0,0,0,"[{'type': 'replied_to', 'id': '920934823006490624'}]",everyone,Twitter for iPhone,"@theresa_may Along time ago the Government offered EU citizens settled status, there are other people in U.K. Too and no one wants settled EU gone correc",2011-11-23T22:22:32.000Z,Business Support Project Graduate of kingston law university surrey former civil servant passion tennis films writing... enjoy kettlebells trx training in Gym:),419878970,janet osuji,274,0,4,4736,JanetOsuji,False
22,920000320230453249,author_id: 920000320230453249,coversation_id: 920934823006490624,920934823006490624,2017-10-21T18:08:27.000Z,"[{'start': 0, 'end': 12, 'username': 'theresa_may', 'id': '747807250819981312'}]",921800362222411778,id: 921800362222411778,747807250819981312,en,0,0,0,0,"[{'type': 'replied_to', 'id': '920934823006490624'}]",everyone,Twitter Web Client,@theresa_may Get £500 Amazon Gift Card. to win your gift card visit https://t.co/M3NQAxTNtf,2017-10-16T18:55:43.000Z,You will get 100% legit Offers.  please visit the blog and follow instructions to get yours.,920000320230453249,GLOBAL WIDE GIFTS,933,1329,1,1163,globalwidegifts,False
23,920000320230453249,author_id: 920000320230453249,coversation_id: 920934823006490624,920934823006490624,2017-10-21T17:37:08.000Z,"[{'start': 0, 'end': 12, 'username': 'theresa_may', 'id': '747807250819981312'}]",921792483452784640,id: 921792483452784640,747807250819981312,en,0,0,0,0,"[{'type': 'replied_to', 'id': '920934823006490624'}]",everyone,Twitter Web Client,@theresa_may Get £500 Amazon Gift Card. to get your gift card visit https://t.co/M3NQAybokN &amp; fill out informations,2017-10-16T18:55:43.000Z,You will get 100% legit Offers.  please visit the blog and follow instructions to get yours.,920000320230453249,GLOBAL WIDE GIFTS,933,1329,1,1163,globalwidegifts,False
24,4189500742,author_id: 4189500742,coversation_id: 920934823006490624,920934823006490624,2017-10-21T07:48:54.000Z,"[{'start': 0, 'end': 12, 'username': 'theresa_may', 'id': '747807250819981312'}]",921644449599574016,id: 921644449599574016,747807250819981312,und,0,0,0,0,"[{'type': 'replied_to', 'id': '920934823006490624'}]",everyone,Twitter for Android,@theresa_may #SupportKurdistan #SupportKurdistan  #SupportKurdistan #SupportKurdistan #SupportKurdistan #SupportKurdistan #SupportKurds,2015-11-14T22:12:27.000Z,Life is a fuckin empty box!,4189500742,Danial karimi,2,16,0,44,mohannadkarimi,False
25,3431719432,author_id: 3431719432,coversation_id: 920934823006490624,920934823006490624,2017-10-20T23:43:19.000Z,"[{'start': 0, 'end': 12, 'username': 'theresa_may', 'id': '747807250819981312'}]",921522248808312832,id: 921522248808312832,747807250819981312,en,0,0,0,0,"[{'type': 'replied_to', 'id': '920934823006490624'}]",everyone,Twitter for iPhone,@theresa_may Wow! we've waited 18 months for this reassurance! Btw it's not '4 million' worrying about their futures. It 4million plus their UK families,2015-08-19T16:03:37.000Z,,3431719432,Doric Day,33,359,0,703,DoricDay,False
26,276140095,author_id: 276140095,coversation_id: 920934823006490624,920934823006490624,2017-10-20T20:59:23.000Z,"[{'start': 0, 'end': 12, 'username': 'theresa_may', 'id': '747807250819981312'}]",921480993554550784,id: 921480993554550784,747807250819981312,en,0,0,0,0,"[{'type': 'replied_to', 'id': '920934823006490624'}]",everyone,Twitter Web App,@theresa_may Mrs Theresa I am right with you Putting people first and for the mayority of Catalans what you think 🤗🙏🏻??,2011-04-02T18:51:44.000Z,Defensora de les llibertats i de la meva terra on he nascut Catalunya. Visco entre Catalunya-Andorra-Ibiza,276140095,Esvear,36,254,4,552,KlaudiaCloo,False
27,283509662,author_id: 283509662,coversation_id: 920934823006490624,920934823006490624,2017-10-20T19:56:03.000Z,"[{'start': 0, 'end': 12, 'username': 'theresa_may', 'id': '747807250819981312'}]",921465052561014785,id: 921465052561014785,747807250819981312,en,0,1,0,0,"[{'type': 'replied_to', 'id': '920934823006490624'}]",everyone,Twitter for Android,@theresa_may Why don't you put British people first? People are starving because of universal credit and sanctions #DWP #UniversalCredit,2011-04-17T12:40:31.000Z,"Barking mad opinionated dog lover. Love 70s music, Hate the Tories and want all animal abusers to be strung up by whichever bits will hurt the most.",283509662,Lady Charlene of Corrupt UK 🐶 #backto60,1011,1085,59,75784,longtallshazza,False
28,851748925,author_id: 851748925,coversation_id: 920934823006490624,920934823006490624,2017-10-20T19:51:45.000Z,"[{'start': 0, 'end': 12, 'username': 'NotMyBrexit', 'id': '1182726811861573633'}, {'start': 13, 'end': 25, 'username': 'theresa_may', 'id': '747807250819981312'}]",921463972871667712,id: 921463972871667712,746647040826970112,en,0,0,0,0,"[{'type': 'replied_to', 'id': '921412363752034305'}]",everyone,Twitter for iPhone,@notmybrexit @theresa_may Who told you i voted?,2012-09-28T21:07:16.000Z,,851748925,Natalie,12,62,0,509,sosweet_dimples,False
29,851748925,author_id: 851748925,coversation_id: 920934823006490624,920934823006490624,2017-10-20T06:08:11.000Z,"[{'start': 0, 'end': 14, 'username': 'willharmonica', 'id': '108042087'}, {'start': 15, 'end': 29, 'username': 'MckenzieMoll1', 'id': '913523407886700545'}, {'start': 30, 'end': 42, 'username': 'theresa_may', 'id': '747807250819981312'}]",921256714061733888,id: 921256714061733888,108042087,en,1,0,0,0,"[{'type': 'replied_to', 'id': '921067486652616704'}]",everyone,Twitter for iPhone,@willharmonica @MckenzieMoll1 @theresa_may Thanks. I think the UK is going to need it.,2012-09-28T21:07:16.000Z,,851748925,Natalie,12,62,0,509,sosweet_dimples,False
30,851748925,author_id: 851748925,coversation_id: 920934823006490624,920934823006490624,2017-10-20T06:06:56.000Z,"[{'start': 0, 'end': 12, 'username': 'NotMyBrexit', 'id': '1182726811861573633'}, {'start': 13, 'end': 25, 'username': 'theresa_may', 'id': '747807250819981312'}]",921256401372110848,id: 921256401372110848,746647040826970112,en,0,0,0,0,"[{'type': 'replied_to', 'id': '921079097777934338'}]",everyone,Twitter for iPhone,"@notmybrexit @theresa_may Tell that to our government please. The fact is, no one appears to know the facts. If they did, negotiations with EU should be easier???",2012-09-28T21:07:16.000Z,,851748925,Natalie,12,62,0,509,sosweet_dimples,False
31,343294002,author_id: 343294002,coversation_id: 920934823006490624,920934823006490624,2017-10-20T17:57:14.000Z,"[{'start': 0, 'end': 12, 'username': 'theresa_may', 'id': '747807250819981312'}]",921435154576560134,id: 921435154576560134,747807250819981312,en,0,0,0,0,"[{'type': 'replied_to', 'id': '920934823006490624'}]",everyone,Twitter for Android,"@theresa_may You appear to have missed the word ""rich"" in your quote...",2011-07-27T10:27:08.000Z,,343294002,James Willson,15,132,0,348,JamesWillson_,False
32,918918350,author_id: 918918350,coversation_id: 920934823006490624,920934823006490624,2017-10-20T17:31:15.000Z,"[{'start': 0, 'end': 12, 'username': 'theresa_may', 'id': '747807250819981312'}]",921428612905127936,id: 921428612905127936,747807250819981312,und,0,0,0,0,"[{'type': 'replied_to', 'id': '920934823006490624'}]",everyone,Twitter Web Client,@theresa_may Ok....,2012-11-01T12:32:51.000Z,,918918350,Adriano Henrique,21,233,0,6861,adriano92031920,False
33,102949177,author_id: 102949177,coversation_id: 920934823006490624,920934823006490624,2017-10-20T15:36:04.000Z,"[{'start': 0, 'end': 13, 'username': 'Axelrose1993', 'id': '386130967'}, {'start': 14, 'end': 25, 'username': 'pylade1779', 'id': '2338414994'}, {'start': 26, 'end': 38, 'username': 'theresa_may', 'id': '747807250819981312'}]",921399627659862016,id: 921399627659862016,386130967,en,1,0,0,1,"[{'type': 'replied_to', 'id': '921236691381129223'}]",everyone,Twitter for iPhone,@Axelrose1993 @pylade1779 @theresa_may Anyone under 30 uses text speak anyway.  The English language is fluid ...,2010-01-08T10:37:36.000Z,"Probably hiding in my room to avoid housework right now. Imperfect Mother; 2 beautiful girls, one with autism. My opinion changes frequently as I grow up",102949177,writer741 #FBPE,1127,1467,10,6091,writer741,False
34,102949177,author_id: 102949177,coversation_id: 920934823006490624,920934823006490624,2017-10-20T00:50:15.000Z,"[{'start': 0, 'end': 11, 'username': 'pylade1779', 'id': '2338414994'}, {'start': 12, 'end': 25, 'username': 'Axelrose1993', 'id': '386130967'}, {'start': 26, 'end': 38, 'username': 'theresa_may', 'id': '747807250819981312'}]",921176705607323650,id: 921176705607323650,2338414994,en,0,0,1,0,"[{'type': 'replied_to', 'id': '920964303498465280'}]",everyone,Twitter for iPhone,@pylade1779 @Axelrose1993 @theresa_may Lol: few English bother to learn grammar and spelling. Maybe uk should dish out dictionaries to all citizens,2010-01-08T10:37:36.000Z,"Probably hiding in my room to avoid housework right now. Imperfect Mother; 2 beautiful girls, one with autism. My opinion changes frequently as I grow up",102949177,writer741 #FBPE,1127,1467,10,6091,writer741,False
35,26990954,author_id: 26990954,coversation_id: 920934823006490624,920934823006490624,2017-10-20T15:26:04.000Z,"[{'start': 0, 'end': 13, 'username': 'carolJhedges', 'id': '711945679'}, {'start': 14, 'end': 26, 'username': 'theresa_may', 'id': '747807250819981312'}]",921397112222470144,id: 921397112222470144,711945679,en,0,0,0,0,"[{'type': 'replied_to', 'id': '921387975761645569'}]",everyone,Twitter for iPhone,@carolJhedges @theresa_may 😕 you stay here we will send May to Germany to be straightened out by Mrs Merkle 😊,2009-03-27T12:07:02.000Z,UAL BA (Hons) Surface Design. Ex Labour. Corbyn supporter. Hate anything Tory. Remainer.  Blocks idiots and extremists. Art loving socialist #JOHNSONOUT,26990954,Trish Westrop 🌹💙,1624,1586,26,63389,morethandivine,False
36,28124999,author_id: 28124999,coversation_id: 920934823006490624,920934823006490624,2017-10-20T15:14:06.000Z,"[{'start': 0, 'end': 12, 'username': 'theresa_may', 'id': '747807250819981312'}]",921394099336433669,id: 921394099336433669,747807250819981312,en,0,0,0,0,"[{'type': 'replied_to', 'id': '920934823006490624'}]",everyone,Twitter for iPhone,@theresa_may You never put the people first just you right wing party.,2009-04-01T15:23:55.000Z,,28124999,Michael 🇪🇺 #FBPE #ProEU🇪🇺#Rejoiner #JOHNSONOUT,1327,1066,4,105886,Mick2465,False
37,3047568909,author_id: 3047568909,coversation_id: 920934823006490624,920934823006490624,2017-10-20T14:29:07.000Z,"[{'start': 0, 'end': 12, 'username': 'theresa_may', 'id': '747807250819981312'}]",921382779593641984,id: 921382779593641984,747807250819981312,en,1,0,0,0,"[{'type': 'replied_to', 'id': '920934823006490624'}]",everyone,Twitter Web Client,@theresa_may You've never put people first - your govt has destroyed lives with austerity &amp; are doing same with Brexit - Treachory &amp; Lies #StopBrexit,2015-02-20T18:40:04.000Z,"#IStandWithUkraine rugby loving pony, #COYQ #WearTheRose  #BlackLivesMatter #NeverVoteConservative",3047568909,Duchess Honey Pony💙🖤 ❤🇪🇺 ❤️🏉,790,1623,10,35670,honeypony222,False
