,author_id,author_id_new,conv_id_new,conversation_id,created_at,entities.mentions,id,id_new,in_reply_to_user_id,lang,public_metrics.like_count,public_metrics.quote_count,public_metrics.reply_count,public_metrics.retweet_count,referenced_tweets,reply_settings,source,text,users.created_at,users.description,users.id,users.name,users.public_metrics.followers_count,users.public_metrics.following_count,users.public_metrics.listed_count,users.public_metrics.tweet_count,users.username,users.verified
50,853218642477101056,author_id: 853218642477101056,coversation_id: 920934823006490624,920934823006490624,2017-10-19T14:29:12.000Z,"[{'start': 0, 'end': 12, 'username': 'theresa_may', 'id': '747807250819981312'}]",921020411319635968,id: 921020411319635968,747807250819981312,en,0,0,0,0,"[{'type': 'replied_to', 'id': '920934823006490624'}]",everyone,Twitter Web Client,"@theresa_may bollocks. you've overseen the demise of the NHS, rising crime figures, most stagnant wages in 210 years and the largest shortfall of house building ever. That is bollocks.",2017-04-15T12:09:11.000Z,"Growth @API3DAO
Delivering first-party oracle solutions to the decentralized web
▲▲▲",853218642477101056,Ken_Karvez,525,2382,15,5310,Ben_BlackWhite,False
51,1551016290,author_id: 1551016290,coversation_id: 920934823006490624,920934823006490624,2017-10-19T14:28:27.000Z,"[{'start': 0, 'end': 12, 'username': 'theresa_may', 'id': '747807250819981312'}]",921020224123559937,id: 921020224123559937,747807250819981312,und,0,0,0,0,"[{'type': 'replied_to', 'id': '920934823006490624'}]",everyone,Twitter for Android,@theresa_may https://t.co/5KG3it77dO,2013-06-27T16:51:11.000Z,"Liberal, pro-European, socialist, moaner. #EU #BREXIT #PROGRESSIVE #fbpe",1551016290,GiorginaS,81,90,0,7263,giorginaspark,False
52,37487291,author_id: 37487291,coversation_id: 920934823006490624,920934823006490624,2017-10-19T14:26:59.000Z,"[{'start': 0, 'end': 12, 'username': 'theresa_may', 'id': '747807250819981312'}]",921019855783858177,id: 921019855783858177,747807250819981312,en,0,0,0,0,"[{'type': 'replied_to', 'id': '920934823006490624'}]",everyone,Twitter for Android,@theresa_may why not offer special citizenship to US citizens?  offset the drop in EU citizens and draw these two together economically!,2009-05-03T19:55:55.000Z,"They defy the God of Israel- jihadists, godless liberals, prochoice  feminist with no moral absolutes: Dorsey, Hollywood, CNN, NPR, BBC, FB.  He will judge U 😉",37487291,Ino Hoo,0,41,0,1392,inohoo,False
53,421094855,author_id: 421094855,coversation_id: 920934823006490624,920934823006490624,2017-10-19T14:22:34.000Z,"[{'start': 0, 'end': 12, 'username': 'theresa_may', 'id': '747807250819981312'}, {'start': 13, 'end': 23, 'username': 'CCHQPress', 'id': '56679400'}]",921018743966371840,id: 921018743966371840,747807250819981312,en,0,0,0,0,"[{'type': 'replied_to', 'id': '920934823006490624'}]",everyone,Twitter Web App,"@theresa_may @CCHQPress We're in court in February, how about putting us 2nd and allow us to live a happy married life? Forbidden work or benefits since 2005 💓 Mary",2011-11-25T14:01:45.000Z,News Stories Bollywood Hollywood Music Sports & HumanRights. Indigenous Brit. RTs ≠ endorsements 🇬🇧 🇬🇭 🇺🇲 Journalist @NUJofficial W026487 Musician 🎸🎹,421094855,Breaking News 🇸🇴,46571,40756,115,149617,BNN_Breaking,False
54,485713890,author_id: 485713890,coversation_id: 920934823006490624,920934823006490624,2017-10-19T14:19:52.000Z,"[{'start': 0, 'end': 12, 'username': 'theresa_may', 'id': '747807250819981312'}]",921018061527879680,id: 921018061527879680,747807250819981312,en,0,0,0,0,"[{'type': 'replied_to', 'id': '920934823006490624'}]",everyone,Twitter for Android,@theresa_may I am afraid you have been anything but clear.,2012-02-07T14:07:01.000Z,"You cannot control how others act towards you; keep being nice and hopefully one day others will do the same to you.

#bloodcancerawareness #leukaemiaawareness",485713890,"I think, therefore I am.",417,330,11,9067,iamloveable2020,False
55,47075166,author_id: 47075166,coversation_id: 920934823006490624,920934823006490624,2017-10-19T14:17:38.000Z,"[{'start': 0, 'end': 12, 'username': 'theresa_may', 'id': '747807250819981312'}]",921017502246817792,id: 921017502246817792,747807250819981312,en,0,0,0,0,"[{'type': 'replied_to', 'id': '920934823006490624'}]",everyone,Twitter for Android,@theresa_may All mouth and no visible trousers.,2009-06-14T11:15:25.000Z,Hate injustice & inequity. 'It always seems impossible until it's done.' ~ MLK #IStandWithChrisWilliamson #AA #MentalHealthMattersIfYourMoodFits,47075166,Beccy Flack,851,344,0,13482,beccy1988,False
56,379811714,author_id: 379811714,coversation_id: 920934823006490624,920934823006490624,2017-10-19T14:14:56.000Z,"[{'start': 0, 'end': 12, 'username': 'theresa_may', 'id': '747807250819981312'}]",921016821008031744,id: 921016821008031744,747807250819981312,en,0,0,0,0,"[{'type': 'replied_to', 'id': '920934823006490624'}]",everyone,Twitter for iPhone,@theresa_may Lies lies lies,2011-09-25T16:10:58.000Z,WTF?,379811714,ali salmon💙,468,983,13,15701,hatchaaaa,False
57,759563700,author_id: 759563700,coversation_id: 920934823006490624,920934823006490624,2017-10-19T13:53:16.000Z,"[{'start': 0, 'end': 12, 'username': 'theresa_may', 'id': '747807250819981312'}, {'start': 114, 'end': 123, 'username': 'guardian', 'id': '87818409'}, {'start': 124, 'end': 136, 'username': 'RCorbettMEP', 'id': '1224386012085989377'}, {'start': 137, 'end': 152, 'username': 'guyverhofstadt', 'id': '856010760'}]",921011367133503488,id: 921011367133503488,747807250819981312,en,3,0,0,0,"[{'type': 'replied_to', 'id': '920934823006490624'}]",everyone,Twitter Web App,@theresa_may Thanks 4 saying u won't b removing my rights after #Brexit - I wasn't planning on relinquishing them @guardian @RCorbettMEP @GuyVerhofstadt,2012-08-15T15:16:29.000Z,CEO of the International Federation of Musculoskeletal Research Societies @IFMRSGlobal  Founding Director @C4urselves All tweets my own.,759563700,Federico Moscogiuri,371,86,14,3345,MoscogiuriF,False
58,888813848635072512,author_id: 888813848635072512,coversation_id: 920934823006490624,920934823006490624,2017-10-19T13:51:24.000Z,"[{'start': 0, 'end': 12, 'username': 'theresa_may', 'id': '747807250819981312'}]",921010899967709184,id: 921010899967709184,747807250819981312,en,0,0,0,0,"[{'type': 'replied_to', 'id': '920934823006490624'}]",everyone,Twitter for iPhone,@theresa_may Theresa May is Clueless. Weak &amp; Creaking!,2017-07-22T17:31:49.000Z,Studied at Cambridge University. Acceptance of Information Without CRITICAL Thought is Hypnosis Media Perpetuates it Views My Own Follow Me/I Follow You,888813848635072512,Sean Michaels,99,590,6,9242,InstantMichaels,False
59,63589842,author_id: 63589842,coversation_id: 920934823006490624,920934823006490624,2017-10-19T13:45:39.000Z,"[{'start': 0, 'end': 12, 'username': 'theresa_may', 'id': '747807250819981312'}]",921009453469749249,id: 921009453469749249,747807250819981312,en,0,0,0,0,"[{'type': 'replied_to', 'id': '920934823006490624'}]",everyone,Twitter for iPhone,@theresa_may Why are so many foreign residents having so much trouble with your government?,2009-08-07T00:46:28.000Z,London resident - Retired tourism professional. Please don't add me to any groups without my prior consent.,63589842,Joe Farrugia 🇪🇺 🇲🇹 🇬🇧,150,135,0,3432,JoeFarrugia,False
60,339029998,author_id: 339029998,coversation_id: 920934823006490624,920934823006490624,2017-10-19T13:26:10.000Z,"[{'start': 0, 'end': 12, 'username': 'theresa_may', 'id': '747807250819981312'}]",921004547727921153,id: 921004547727921153,339029998,en,1,0,0,0,"[{'type': 'replied_to', 'id': '921004395462053888'}]",everyone,Twitter for Android,@theresa_may You can't be trusted Mrs May,2011-07-20T13:45:06.000Z,"Basic Income for all YESTERDAY.
Live and let Live.
War is never the answer, it's the innocent that suffer.",339029998,Luiza 💙🌍🌻,1138,1136,134,145742,luizap1,False
61,339029998,author_id: 339029998,coversation_id: 920934823006490624,920934823006490624,2017-10-19T13:25:33.000Z,"[{'start': 0, 'end': 12, 'username': 'theresa_may', 'id': '747807250819981312'}]",921004395462053888,id: 921004395462053888,747807250819981312,en,1,0,1,0,"[{'type': 'replied_to', 'id': '920934823006490624'}]",everyone,Twitter for Android,@theresa_may Wolf in sheeps clothing comes to mind. You csnt,2011-07-20T13:45:06.000Z,"Basic Income for all YESTERDAY.
Live and let Live.
War is never the answer, it's the innocent that suffer.",339029998,Luiza 💙🌍🌻,1138,1136,134,145742,luizap1,False
62,20809806,author_id: 20809806,coversation_id: 920934823006490624,920934823006490624,2017-10-19T13:25:40.000Z,"[{'start': 0, 'end': 12, 'username': 'theresa_may', 'id': '747807250819981312'}]",921004424071450624,id: 921004424071450624,747807250819981312,en,1,0,0,0,"[{'type': 'replied_to', 'id': '920934823006490624'}]",everyone,Twitter for iPad,"@theresa_may Have you considered putting your own people first? You remember, we are called British, and voted at the last election?",2009-02-13T21:43:26.000Z,every day thoughts of a Brereton man,20809806,brereton bruiser,137,106,3,8560,sensepolitics,False
63,84601057,author_id: 84601057,coversation_id: 920934823006490624,920934823006490624,2017-10-19T13:03:27.000Z,"[{'start': 0, 'end': 12, 'username': 'theresa_may', 'id': '747807250819981312'}]",920998830665019392,id: 920998830665019392,747807250819981312,en,2,0,0,0,"[{'type': 'replied_to', 'id': '920934823006490624'}]",everyone,Twitter for iPhone,@theresa_may Surely this tweet should have been sent on April 1st.,2009-10-23T14:15:38.000Z,"Married to the most amazing woman in the world. BMW E60. Dachshund owner  , controversia est, non immerito terribile erat quod defensores errorum",84601057,Keith & Wavelean,1484,2682,12,17150,wavekei,False
64,709120708622864389,author_id: 709120708622864389,coversation_id: 920934823006490624,920934823006490624,2017-10-19T13:00:25.000Z,"[{'start': 0, 'end': 12, 'username': 'theresa_may', 'id': '747807250819981312'}]",920998068639748097,id: 920998068639748097,747807250819981312,hi,0,0,0,0,"[{'type': 'replied_to', 'id': '920934823006490624'}]",everyone,Twitter for Android,@theresa_may Ha ha ha ha ha ha ha ha ha ha ha ha ha,2016-03-13T20:55:26.000Z,,709120708622864389,Angel,192,145,4,8134,xxjxangel,False
65,54853035,author_id: 54853035,coversation_id: 920934823006490624,920934823006490624,2017-10-19T12:57:47.000Z,"[{'start': 0, 'end': 12, 'username': 'theresa_may', 'id': '747807250819981312'}]",920997403980980224,id: 920997403980980224,747807250819981312,en,0,0,0,0,"[{'type': 'replied_to', 'id': '920934823006490624'}]",everyone,Twitter Web Client,@theresa_may further pathetic weakening on immigration..this wont go well with the public https://t.co/BWLmE8cdjp,2009-07-08T09:58:27.000Z,"politically homeless..anti mass immigration and open borders,, anti lying  career politicians.., boris is a immigration enabler,proud right winger",54853035,englands glory,3796,2427,29,150535,bestofbritish2,False
66,1465522244,author_id: 1465522244,coversation_id: 920934823006490624,920934823006490624,2017-10-19T12:46:24.000Z,"[{'start': 0, 'end': 14, 'username': 'Steven_Lanham', 'id': '532023520'}, {'start': 15, 'end': 27, 'username': 'theresa_may', 'id': '747807250819981312'}]",920994540928032770,id: 920994540928032770,532023520,en,0,0,0,0,"[{'type': 'replied_to', 'id': '920935330894761984'}]",everyone,Twitter for iPhone,@Steven_Lanham @theresa_may What evidence do you have to assert your claim?,2013-05-28T19:39:14.000Z,"Lover of life, nature and common sense. Abhors litter.",1465522244,🇬🇧 Rob Blyth,516,2049,3,8582,hardmancc,False
67,264236078,author_id: 264236078,coversation_id: 920934823006490624,920934823006490624,2017-10-19T12:43:16.000Z,"[{'start': 0, 'end': 12, 'username': 'theresa_may', 'id': '747807250819981312'}]",920993754026266626,id: 920993754026266626,747807250819981312,en,3,0,0,0,"[{'type': 'replied_to', 'id': '920934823006490624'}]",everyone,Twitter Web Client,"@theresa_may Unless you ring-fence citizens' rights, you cannot claim to be ""putting people first"". For shame.",2011-03-11T15:31:15.000Z,"Chartered Linguist (German)
Former citizens' rights campaigner @BritishInEurope 🇪🇺",264236078,Zoe Adams Green 🇪🇺,4619,5105,21,8706,ZAdamsGreen,False
68,822893312206131200,author_id: 822893312206131200,coversation_id: 920934823006490624,920934823006490624,2017-10-19T12:34:44.000Z,"[{'start': 0, 'end': 15, 'username': 'ProperDemocrat', 'id': '901443409650618369'}, {'start': 16, 'end': 28, 'username': 'theresa_may', 'id': '747807250819981312'}]",920991603665375232,id: 920991603665375232,901443409650618369,en,0,0,1,0,"[{'type': 'replied_to', 'id': '920954340734652416'}]",everyone,Twitter for Android,@ProperDemocrat @theresa_may A worsening economy due to Brexit will only make things worse not better.,2017-01-21T19:47:09.000Z,A Citizen of Yorkshire. Live Simply. Laugh Lots. Be Grateful. Give Love.,822893312206131200,Mark Derrick Pickup,52,245,0,1943,MDPCastleford,False
69,822893312206131200,author_id: 822893312206131200,coversation_id: 920934823006490624,920934823006490624,2017-10-19T12:33:36.000Z,"[{'start': 0, 'end': 15, 'username': 'ProperDemocrat', 'id': '901443409650618369'}, {'start': 16, 'end': 28, 'username': 'theresa_may', 'id': '747807250819981312'}]",920991319929114624,id: 920991319929114624,901443409650618369,en,0,0,0,0,"[{'type': 'replied_to', 'id': '920954340734652416'}]",everyone,Twitter for Android,@ProperDemocrat @theresa_may And what about those arriving from OUTSIDE the EU who have a perfectly legal right. Lack of investment by several govs is the problem,2017-01-21T19:47:09.000Z,A Citizen of Yorkshire. Live Simply. Laugh Lots. Be Grateful. Give Love.,822893312206131200,Mark Derrick Pickup,52,245,0,1943,MDPCastleford,False
70,46356451,author_id: 46356451,coversation_id: 920934823006490624,920934823006490624,2017-10-19T12:34:08.000Z,"[{'start': 0, 'end': 12, 'username': 'theresa_may', 'id': '747807250819981312'}, {'start': 13, 'end': 29, 'username': 'tweetsdistilled', 'id': '2463065714'}]",920991454285258752,id: 920991454285258752,747807250819981312,en,0,0,0,0,"[{'type': 'replied_to', 'id': '920934823006490624'}]",everyone,Twitter Web App,@theresa_may @tweetsdistilled The only good part of this letter is it pissed off some of the idiots as much as it disappointed the innocent,2009-06-11T10:00:53.000Z,"He/Him
Common-sense, practical centrist and moderate liberal.
Sorry if I forgot to take you out of a thread-reply",46356451,Balthazar H,451,1122,8,38120,BalthazarBlaze,False
71,46356451,author_id: 46356451,coversation_id: 920934823006490624,920934823006490624,2017-10-19T12:33:21.000Z,"[{'start': 0, 'end': 14, 'username': 'MckenzieMoll1', 'id': '913523407886700545'}, {'start': 15, 'end': 30, 'username': 'iMAM_MAHDi_313', 'id': '56235675'}, {'start': 31, 'end': 43, 'username': 'theresa_may', 'id': '747807250819981312'}]",920991256179863552,id: 920991256179863552,913523407886700545,en,0,0,0,0,"[{'type': 'replied_to', 'id': '920944093223636992'}]",everyone,Twitter Web App,"@MckenzieMoll1 @iMAM_MAHDi_313 @theresa_may Not due to immigration. Due to bungled reorganisation and cuts, and the economic cost of Brexit.",2009-06-11T10:00:53.000Z,"He/Him
Common-sense, practical centrist and moderate liberal.
Sorry if I forgot to take you out of a thread-reply",46356451,Balthazar H,451,1122,8,38120,BalthazarBlaze,False
72,2874745979,author_id: 2874745979,coversation_id: 920934823006490624,920934823006490624,2017-10-19T12:33:12.000Z,"[{'start': 0, 'end': 12, 'username': 'theresa_may', 'id': '747807250819981312'}]",920991219366449153,id: 920991219366449153,747807250819981312,en,0,0,0,0,"[{'type': 'replied_to', 'id': '920934823006490624'}]",everyone,Twitter for Android,@theresa_may But some more first than others.,2014-11-13T06:38:45.000Z,"A rolling stock engineer, living in Suffolk.",2874745979,Rich M,111,499,3,3072,royston_crow,False
73,3049272396,author_id: 3049272396,coversation_id: 920934823006490624,920934823006490624,2017-10-19T12:32:38.000Z,"[{'start': 0, 'end': 12, 'username': 'theresa_may', 'id': '747807250819981312'}]",920991075761876994,id: 920991075761876994,747807250819981312,und,0,0,0,0,"[{'type': 'replied_to', 'id': '920934823006490624'}]",everyone,Twitter for iPhone,@theresa_may  https://t.co/MgzQFWrZSn,2015-02-28T09:51:15.000Z,,3049272396,It's No Joke!,1037,597,28,54657,brianbarou,False
74,546239230,author_id: 546239230,coversation_id: 920934823006490624,920934823006490624,2017-10-19T12:28:16.000Z,"[{'start': 0, 'end': 14, 'username': 'MckenzieMoll1', 'id': '913523407886700545'}, {'start': 15, 'end': 30, 'username': 'iMAM_MAHDi_313', 'id': '56235675'}, {'start': 31, 'end': 43, 'username': 'theresa_may', 'id': '747807250819981312'}]",920989978959732737,id: 920989978959732737,913523407886700545,en,1,0,1,1,"[{'type': 'replied_to', 'id': '920944093223636992'}]",everyone,Twitter for Android,@MckenzieMoll1 @iMAM_MAHDi_313 @theresa_may EU citizens with 5 children in tow? Bullshit!,2012-04-05T19:51:06.000Z,"100% #TeamNicola SNP, Scotland, independence. 
We are the Ad for SNP and Independence. Let's convince people gently, politely and happily. Saosa! 🏴󠁧󠁢󠁳󠁣󠁴󠁿",546239230,Lachesis Esq. 🕷️🕸️🇮🇹🇰🇪🏴󠁧󠁢󠁳󠁣󠁴󠁿🇪🇺,3121,3435,113,188234,CaroleMagoha,False
75,546239230,author_id: 546239230,coversation_id: 920934823006490624,920934823006490624,2017-10-19T12:27:01.000Z,"[{'start': 0, 'end': 12, 'username': 'theresa_may', 'id': '747807250819981312'}]",920989661492858881,id: 920989661492858881,747807250819981312,en,0,0,0,0,"[{'type': 'replied_to', 'id': '920934823006490624'}]",everyone,Twitter for Android,"@theresa_may https://t.co/n54YeLW5cx
EU offered a great deal more to Brits in EU. It wld only be fair if they too watered down their offer.",2012-04-05T19:51:06.000Z,"100% #TeamNicola SNP, Scotland, independence. 
We are the Ad for SNP and Independence. Let's convince people gently, politely and happily. Saosa! 🏴󠁧󠁢󠁳󠁣󠁴󠁿",546239230,Lachesis Esq. 🕷️🕸️🇮🇹🇰🇪🏴󠁧󠁢󠁳󠁣󠁴󠁿🇪🇺,3121,3435,113,188234,CaroleMagoha,False
76,1294644751,author_id: 1294644751,coversation_id: 920934823006490624,920934823006490624,2017-10-19T12:21:59.000Z,"[{'start': 0, 'end': 12, 'username': 'theresa_may', 'id': '747807250819981312'}, {'start': 13, 'end': 26, 'username': 'GavinBarwell', 'id': '242943134'}]",920988395974905856,id: 920988395974905856,747807250819981312,en,0,0,0,0,"[{'type': 'replied_to', 'id': '920934823006490624'}]",everyone,Twitter for Android,"@theresa_may @GavinBarwell ""First"" would have been July 2016, not this protracted #InLimbo",2013-03-24T10:17:03.000Z,I'm an EU migrant vexed by the Brexit lies and the hatred it gave voice to (She/Her),1294644751,Cappuccino Corleone 💙 #FBPE,1835,2191,26,109817,InfoGirl875,False
77,234401080,author_id: 234401080,coversation_id: 920934823006490624,920934823006490624,2017-10-19T12:21:35.000Z,"[{'start': 0, 'end': 12, 'username': 'theresa_may', 'id': '747807250819981312'}]",920988296339251202,id: 920988296339251202,747807250819981312,en,0,0,0,0,"[{'type': 'replied_to', 'id': '920934823006490624'}]",everyone,Twitter for iPad,"@theresa_may You cut police numbers when Home Sec, maintained as PM, 
https://t.co/J1ZT7STc6B.    @AmberRuddHR any comment?",2011-01-05T15:32:31.000Z,"MUFC.(season ticket holder.sth stand) Amore Non Odit,,,I Dont buy the Sun. European citizen,,,Roman Catholic.#NHSLove… Justice for the 97. 🌹",234401080,Robert A,1365,2522,16,70690,newnameT,False
78,822227596641521664,author_id: 822227596641521664,coversation_id: 920934823006490624,920934823006490624,2017-10-19T12:11:07.000Z,"[{'start': 0, 'end': 12, 'username': 'theresa_may', 'id': '747807250819981312'}]",920985661573824513,id: 920985661573824513,747807250819981312,en,0,0,0,0,"[{'type': 'replied_to', 'id': '920934823006490624'}]",everyone,Twitter for Android,@theresa_may Not really what some of your Cabinet buddies said... https://t.co/hJYk5ajq2l,2017-01-19T23:41:50.000Z,Your Romanian neighbour. Campaigning for migrants’ rights since 2016. Research Consultant. @CambsCC Labour Councillor for Abbey. Co-founder @migrants4labour,822227596641521664,Dr Alex Bulat,30836,9625,124,25627,alexandrabulat,True
79,244509347,author_id: 244509347,coversation_id: 920934823006490624,920934823006490624,2017-10-19T12:10:58.000Z,"[{'start': 0, 'end': 12, 'username': 'theresa_may', 'id': '747807250819981312'}]",920985625154768896,id: 920985625154768896,747807250819981312,en,0,0,0,0,"[{'type': 'replied_to', 'id': '920934823006490624'}]",everyone,Echofon,"@theresa_may so why are you ignoring the wishes of those who voted remain, soft brexit#fraud",2011-01-29T13:33:39.000Z,Loyal Manchester United (LUHG)and Hendon FC fan also follows Middlesex CCC,244509347,Andrew goodrich,190,430,3,5075,Andrewgoodrich,False
80,2232142486,author_id: 2232142486,coversation_id: 920934823006490624,920934823006490624,2017-10-19T12:02:50.000Z,"[{'start': 0, 'end': 12, 'username': 'theresa_may', 'id': '747807250819981312'}]",920983575117299714,id: 920983575117299714,747807250819981312,en,0,0,0,0,"[{'type': 'replied_to', 'id': '920934823006490624'}]",everyone,Twitter for Android,@theresa_may &amp; you'll forever go down in history as the person  in charge when the UK delivered its own crippling blow.,2013-12-18T19:57:12.000Z,"Scottish Outdoor enthusiast
& prolific entrepreneur",2232142486,Captain Fantastic,773,1036,17,11821,Cptn__Fantastic,False
81,23616115,author_id: 23616115,coversation_id: 920934823006490624,920934823006490624,2017-10-19T11:57:06.000Z,"[{'start': 0, 'end': 14, 'username': 'MckenzieMoll1', 'id': '913523407886700545'}, {'start': 15, 'end': 30, 'username': 'iMAM_MAHDi_313', 'id': '56235675'}, {'start': 31, 'end': 43, 'username': 'theresa_may', 'id': '747807250819981312'}]",920982134076080128,id: 920982134076080128,913523407886700545,en,1,0,0,1,"[{'type': 'replied_to', 'id': '920944093223636992'}]",everyone,Twitter for Android,@MckenzieMoll1 @iMAM_MAHDi_313 @theresa_may A bit of a sweeping statement based on xenophobia and not fact.,2009-03-10T17:01:01.000Z,,23616115,Corinne Redonnet #FBPE,19,74,0,276,cocoredbrown,False
82,705131184,author_id: 705131184,coversation_id: 920934823006490624,920934823006490624,2017-10-19T11:55:30.000Z,"[{'start': 0, 'end': 12, 'username': 'theresa_may', 'id': '747807250819981312'}]",920981731360038914,id: 920981731360038914,747807250819981312,en,0,0,0,0,"[{'type': 'replied_to', 'id': '920934823006490624'}]",everyone,Twitter for iPhone,@theresa_may This is just embarrassing now. Give up on this hiding to nowhere please,2012-07-19T14:06:36.000Z,"The moon is a planet. No further questions.
Managed and represented by @biddledown. O positive",705131184,Michael Cleary,104,1101,0,14423,MagnificoCleary,False
83,48335338,author_id: 48335338,coversation_id: 920934823006490624,920934823006490624,2017-10-19T11:55:20.000Z,"[{'start': 0, 'end': 12, 'username': 'theresa_may', 'id': '747807250819981312'}, {'start': 87, 'end': 101, 'username': 'Conservatives', 'id': '14281853'}, {'start': 140, 'end': 155, 'username': 'guyverhofstadt', 'id': '856010760'}]",920981688364273664,id: 920981688364273664,747807250819981312,en,4,0,0,2,"[{'type': 'replied_to', 'id': '920934823006490624'}]",everyone,Twitter Web Client,@theresa_may Meaningless words from a useless PM who lost all credibility. You and the @Conservatives are the reason we need the #ECJ &amp; @GuyVerhofstadt,2009-06-18T12:37:16.000Z,Alive.,48335338,Toby Schuster,981,3081,57,13410,TobySchuster,False
84,865953415851016192,author_id: 865953415851016192,coversation_id: 920934823006490624,920934823006490624,2017-10-19T11:45:28.000Z,"[{'start': 0, 'end': 12, 'username': 'theresa_may', 'id': '747807250819981312'}]",920979206275780610,id: 920979206275780610,747807250819981312,en,0,0,0,0,"[{'type': 'replied_to', 'id': '920934823006490624'}]",everyone,Twitter for iPad,@theresa_may Yes you do don't you. Every one but the British you should be ashamed of your self we will not forget !,2017-05-20T15:32:37.000Z,,865953415851016192,James B.,18,29,0,13790,AdolfHi58493944,False
85,21236134,author_id: 21236134,coversation_id: 920934823006490624,920934823006490624,2017-10-19T11:44:06.000Z,"[{'start': 0, 'end': 12, 'username': 'theresa_may', 'id': '747807250819981312'}]",920978860778377216,id: 920978860778377216,747807250819981312,en,0,0,0,0,"[{'type': 'replied_to', 'id': '920934823006490624'}]",everyone,Twitter for iPhone,@theresa_may Can we be Facebook friends Mrs M?,2009-02-18T20:18:00.000Z,working for a large waste management company. Trade Unionist and Workplace Rep. Not A Furry. He/Him 31,21236134,inept borzoi wizard,179,1155,0,29924,platypusbanker,False
86,593103675,author_id: 593103675,coversation_id: 920934823006490624,920934823006490624,2017-10-19T11:41:29.000Z,"[{'start': 0, 'end': 12, 'username': 'theresa_may', 'id': '747807250819981312'}]",920978203216433153,id: 920978203216433153,747807250819981312,en,5,0,0,0,"[{'type': 'replied_to', 'id': '920934823006490624'}]",everyone,Twitter for Android,"@theresa_may Yeah right coz your putting people first, that's why your bringing in universal credit that's putting people in debt and homeless.",2012-05-28T20:05:20.000Z,"Hartlepool United supporter, and father of 3  and  1 beautiful grandson.",593103675,poolieboy1🇬🇧💙,97,427,1,7922,Poolieboy1Les1,False
