,author_id,author_id_new,conv_id_new,conversation_id,created_at,entities.mentions,id,id_new,in_reply_to_user_id,lang,public_metrics.like_count,public_metrics.quote_count,public_metrics.reply_count,public_metrics.retweet_count,referenced_tweets,reply_settings,source,text,users.created_at,users.description,users.id,users.name,users.public_metrics.followers_count,users.public_metrics.following_count,users.public_metrics.listed_count,users.public_metrics.tweet_count,users.username,users.verified
0,235133507,author_id: 235133507,coversation_id: 969560296279994369,969560296279994369,2018-03-03T06:21:07.000Z,"[{'start': 0, 'end': 8, 'username': 'MinPres', 'id': '155507136'}]",969819941972176896,id: 969819941972176896,155507136,en,0,0,0,0,"[{'type': 'replied_to', 'id': '969560296279994369'}]",everyone,Twitter for Android,@MinPres #FoodForThought. great ideas. Iets add a #UBI #BasicIncome as number 10 to the list,2011-01-07T12:50:34.000Z,Let's shake some dust.,235133507,Dimitri Op de Beeck,459,1291,28,3158,Dimitri_OdB,False
1,81065175,author_id: 81065175,coversation_id: 969560296279994369,969560296279994369,2018-03-02T14:02:11.000Z,"[{'start': 0, 'end': 8, 'username': 'MinPres', 'id': '155507136'}]",969573587186315264,id: 969573587186315264,155507136,en,0,0,0,0,"[{'type': 'replied_to', 'id': '969560296279994369'}]",everyone,Twitter Web Client,@MinPres Excellent foot stamps.,2009-10-09T08:53:30.000Z,"International sounding board for Justice.
Nederlands-English-Deutsch-Français-Español",81065175,Leo Vriends,199,843,4,33850,LeoVriends,False
2,469187689,author_id: 469187689,coversation_id: 969560296279994369,969560296279994369,2018-03-02T13:52:48.000Z,"[{'start': 0, 'end': 8, 'username': 'MinPres', 'id': '155507136'}]",969571224824221696,id: 969571224824221696,155507136,nl,0,0,0,0,"[{'type': 'replied_to', 'id': '969560296279994369'}]",everyone,Twitter Web Client,"@MinPres Bedoelt de premier hier ""regulated professions""? (tja, protected klinkt natuurlijk verwerpelijker...) Dat zijn gem. 200 beroepen per land waarvan het niet zo onlogisch lijkt dat er 'gereguleerde' eisen voor zijn, zoals arts of advocaat. In NL deze 145: https://t.co/eZo0aGbRQe",2012-01-20T10:06:09.000Z,010 - hoger onderwijs & onderzoek met impact - “Play is the highest form of Research” (A.Einstein) - econometrie - scheepvaart - tweets op eigen titel - hij/hem,469187689,Cornelis Geldof,217,466,3,1869,cornelisgeldof,False
3,2934245026,author_id: 2934245026,coversation_id: 969560296279994369,969560296279994369,2018-03-02T13:14:54.000Z,"[{'start': 0, 'end': 8, 'username': 'MinPres', 'id': '155507136'}]",969561687035703297,id: 969561687035703297,155507136,nl,0,0,0,0,"[{'type': 'replied_to', 'id': '969560296279994369'}]",everyone,Twitter Web Client,"@MinPres ""All our countries"" daar hoort het Turkije🕌🔥 van Erdogan👹 ook bij mensen, let maar op. https://t.co/6O8lJ7u16F",2014-12-20T20:59:12.000Z,"Wageningen Universiteit - Ondernemer MKB - Christen - mist Trump - When governments make wicked laws, the righteous become outlaws.",2934245026,Sander,572,135,2,11527,sander_voortman,False
4,1418679690,author_id: 1418679690,coversation_id: 969560296279994369,969560296279994369,2018-03-02T13:12:00.000Z,"[{'start': 0, 'end': 8, 'username': 'MinPres', 'id': '155507136'}]",969560957251760134,id: 969560957251760134,155507136,de,0,0,0,0,"[{'type': 'replied_to', 'id': '969560296279994369'}]",everyone,Twitter Web Client,"@MinPres WELTERUSTEN MINISTER-PRESIDENT, Pattiwael &amp; Nanuru 
https://t.co/ZpFmOsrmSS
Earthquakes Groningen, the Netherlands.

Auch du, auch du hast es gewusst.......
Rampenwet(oud) Noodtoestand, Staat van Beleg, Wet Veiligheidsregio's.
https://t.co/0JhQWZ5ZFK",2013-05-10T17:50:46.000Z,"Earthquakes. We zijn het zat! Voor alle inwoners die leven in de gaswinningsgebieden van de provincie Groningen. We zijn het wachten beu, eisen onze rechten op.",1418679690,Schokkend Groningen,3076,288,51,30296,SchokkendGronin,False
5,2424864585,author_id: 2424864585,coversation_id: 969560296279994369,969560296279994369,2018-03-02T13:10:33.000Z,"[{'start': 0, 'end': 8, 'username': 'MinPres', 'id': '155507136'}]",969560592351662081,id: 969560592351662081,155507136,und,0,0,0,0,"[{'type': 'replied_to', 'id': '969560296279994369'}]",everyone,Twitter Web Client,@MinPres  https://t.co/fSc6Kx93TD,2014-03-20T14:57:35.000Z,Woordkunstenaar en huiskamercabaretier.,2424864585,**Hagenees**,173,201,1,14260,mpscholten,False
