,author_id,author_id_new,conv_id_new,conversation_id,created_at,entities.mentions,id,id_new,in_reply_to_user_id,lang,public_metrics.like_count,public_metrics.quote_count,public_metrics.reply_count,public_metrics.retweet_count,referenced_tweets,reply_settings,source,text,users.created_at,users.description,users.id,users.name,users.public_metrics.followers_count,users.public_metrics.following_count,users.public_metrics.listed_count,users.public_metrics.tweet_count,users.username,users.verified
0,14496536,author_id: 14496536,coversation_id: 1022542040792555521,1022542040792555521,2018-09-19T12:15:32.000Z,"[{'start': 0, 'end': 12, 'username': 'DominicRaab', 'id': '4764882552'}, {'start': 13, 'end': 27, 'username': 'MichelBarnier', 'id': '17487476'}]",1042386706773803008,id: 1042386706773803008,4764882552,en,0,0,0,0,"[{'type': 'replied_to', 'id': '1022542040792555521'}]",everyone,Twitter for Android,@DominicRaab @MichelBarnier Exageration. Exagerration. Exagerration. Not quite true what you have written.,2008-04-23T16:32:38.000Z,"The Girl in the Golden Masque
Passionate about contemporary dance.
The full #remain",14496536,Madam X Dance,4846,5044,33,375385,jazzaoxon,False
1,3377406406,author_id: 3377406406,coversation_id: 1022542040792555521,1022542040792555521,2018-08-10T11:14:53.000Z,"[{'start': 0, 'end': 12, 'username': 'DominicRaab', 'id': '4764882552'}, {'start': 13, 'end': 27, 'username': 'MichelBarnier', 'id': '17487476'}]",1027875929211711499,id: 1027875929211711499,4764882552,en,2,0,0,1,"[{'type': 'replied_to', 'id': '1022542040792555521'}]",everyone,Twitter for Android,"@DominicRaab @MichelBarnier YOU KNOW"" ABOUT WTO..STOP ✋ TRYING TO MURDER THIS COUNTRY... https://t.co/C2SLykKal6",2015-07-15T14:07:47.000Z,,3377406406,clive williams,2732,4974,73,467136,vespasian91,False
2,38168593,author_id: 38168593,coversation_id: 1022542040792555521,1022542040792555521,2018-08-02T05:37:27.000Z,"[{'start': 0, 'end': 12, 'username': 'DominicRaab', 'id': '4764882552'}]",1024891908978561024,id: 1024891908978561024,4764882552,en,0,0,0,0,"[{'type': 'replied_to', 'id': '1022542040792555521'}]",everyone,Twitter for iPad,@DominicRaab you could perhaps entice the eu more if you point out when we leave they will have more room for another mug,2009-05-06T12:39:36.000Z,,38168593,melvin,84,239,0,1563,melthebuilder,False
3,25479341,author_id: 25479341,coversation_id: 1022542040792555521,1022542040792555521,2018-08-01T17:17:00.000Z,"[{'start': 0, 'end': 12, 'username': 'DominicRaab', 'id': '4764882552'}, {'start': 13, 'end': 27, 'username': 'MichelBarnier', 'id': '17487476'}]",1024705570773913600,id: 1024705570773913600,4764882552,und,0,0,0,0,"[{'type': 'replied_to', 'id': '1022542040792555521'}]",everyone,Twitter for iPad,@DominicRaab @MichelBarnier  https://t.co/wbbNhcu4l8,2009-03-20T08:34:55.000Z,Opposing Marxism & political violence. Down with the SNP. Follows retweets & likes not endorsements. FU Biden.IFBAP,25479341,John,2035,3140,7,31507,Inspireman,False
4,25479341,author_id: 25479341,coversation_id: 1022542040792555521,1022542040792555521,2018-08-01T17:16:47.000Z,"[{'start': 0, 'end': 12, 'username': 'DominicRaab', 'id': '4764882552'}, {'start': 13, 'end': 27, 'username': 'MichelBarnier', 'id': '17487476'}]",1024705513806864386,id: 1024705513806864386,4764882552,en,0,0,0,0,"[{'type': 'replied_to', 'id': '1022542040792555521'}]",everyone,Twitter for iPad,@DominicRaab @MichelBarnier Get us out https://t.co/4qtonkjFzQ,2009-03-20T08:34:55.000Z,Opposing Marxism & political violence. Down with the SNP. Follows retweets & likes not endorsements. FU Biden.IFBAP,25479341,John,2035,3140,7,31507,Inspireman,False
5,852928151579656194,author_id: 852928151579656194,coversation_id: 1022542040792555521,1022542040792555521,2018-08-01T12:33:10.000Z,"[{'start': 0, 'end': 12, 'username': 'DominicRaab', 'id': '4764882552'}, {'start': 13, 'end': 27, 'username': 'MichelBarnier', 'id': '17487476'}]",1024634140665278465,id: 1024634140665278465,4764882552,und,0,0,0,0,"[{'type': 'replied_to', 'id': '1022542040792555521'}]",everyone,Twitter Web Client,@DominicRaab @MichelBarnier https://t.co/Ynd11xvx9o,2017-04-14T16:54:52.000Z,Brexit was a manifestation that our political system is unfit for purpose.  Radical electoral reforms are needed to oust a corrupt Government. Then rejoin EU.,852928151579656194,DemocracyFightsBack 3.5% #FBPE,5227,5847,18,121658,back_fights,False
6,852928151579656194,author_id: 852928151579656194,coversation_id: 1022542040792555521,1022542040792555521,2018-07-27T15:32:17.000Z,"[{'start': 0, 'end': 12, 'username': 'DominicRaab', 'id': '4764882552'}, {'start': 13, 'end': 27, 'username': 'MichelBarnier', 'id': '17487476'}]",1022867278243815426,id: 1022867278243815426,4764882552,und,0,0,0,0,"[{'type': 'replied_to', 'id': '1022542040792555521'}]",everyone,Twitter Web Client,@DominicRaab @MichelBarnier https://t.co/TTv8gVgRRJ,2017-04-14T16:54:52.000Z,Brexit was a manifestation that our political system is unfit for purpose.  Radical electoral reforms are needed to oust a corrupt Government. Then rejoin EU.,852928151579656194,DemocracyFightsBack 3.5% #FBPE,5227,5847,18,121658,back_fights,False
7,2837693142,author_id: 2837693142,coversation_id: 1022542040792555521,1022542040792555521,2018-07-30T12:10:30.000Z,"[{'start': 0, 'end': 12, 'username': 'DominicRaab', 'id': '4764882552'}, {'start': 13, 'end': 27, 'username': 'MichelBarnier', 'id': '17487476'}]",1023903659862577152,id: 1023903659862577152,4764882552,en,0,0,0,0,"[{'type': 'replied_to', 'id': '1022542040792555521'}]",everyone,Twitter for iPhone,"@DominicRaab @MichelBarnier When does the British public get to know the full, unedited WA and the details of the “FR”...? When will the EU send us their part of the plan and the ‘deal’? After all - as per your article - it’s no good if only one side is offering anything. So far the EU has offered: NOTHING.",2014-10-02T08:05:33.000Z,"Quid vult dicere, quod vult dicere",2837693142,30 January 1649,85,128,1,4337,oc1649,False
8,2837693142,author_id: 2837693142,coversation_id: 1022542040792555521,1022542040792555521,2018-07-30T12:03:34.000Z,"[{'start': 0, 'end': 12, 'username': 'DominicRaab', 'id': '4764882552'}, {'start': 13, 'end': 27, 'username': 'MichelBarnier', 'id': '17487476'}]",1023901914059091973,id: 1023901914059091973,4764882552,en,0,0,0,0,"[{'type': 'replied_to', 'id': '1022542040792555521'}]",everyone,Twitter for iPhone,"@DominicRaab @MichelBarnier So, by “...I committed to removing obstacles...” do you not mean “total UK surrender”?Are you caving in to all the EU demands and you’re simply dressing it up as ‘negotiations’?? Tell us then, what is the EU offering in return...especially as the White Paper has been rejected..?",2014-10-02T08:05:33.000Z,"Quid vult dicere, quod vult dicere",2837693142,30 January 1649,85,128,1,4337,oc1649,False
9,2837693142,author_id: 2837693142,coversation_id: 1022542040792555521,1022542040792555521,2018-07-29T17:35:47.000Z,"[{'start': 0, 'end': 12, 'username': 'DominicRaab', 'id': '4764882552'}, {'start': 13, 'end': 27, 'username': 'MichelBarnier', 'id': '17487476'}]",1023623130680516608,id: 1023623130680516608,4764882552,en,0,0,0,0,"[{'type': 'replied_to', 'id': '1022542040792555521'}]",everyone,Twitter for iPhone,@DominicRaab @MichelBarnier What obstacles are you thinking of...? One of those wouldn’t happen to be paying attention to 17.4 Million votes for BREXIT by any chance perhaps?? So effectively you are now ignoring the referendum result and British democracy...?,2014-10-02T08:05:33.000Z,"Quid vult dicere, quod vult dicere",2837693142,30 January 1649,85,128,1,4337,oc1649,False
10,2837693142,author_id: 2837693142,coversation_id: 1022542040792555521,1022542040792555521,2018-07-29T17:28:19.000Z,"[{'start': 0, 'end': 12, 'username': 'DominicRaab', 'id': '4764882552'}, {'start': 13, 'end': 27, 'username': 'MichelBarnier', 'id': '17487476'}]",1023621253658112002,id: 1023621253658112002,4764882552,en,0,0,0,0,"[{'type': 'replied_to', 'id': '1022542040792555521'}]",everyone,Twitter for iPhone,"@DominicRaab @MichelBarnier Since the White Paper-the plan for the future relationship between the UK and EU-has been rejected by the very person you are supposedly having a “good second trip” meeting, what are you talking about? Are you drawing up your terms of surrender or reminding them about “No Deal”?",2014-10-02T08:05:33.000Z,"Quid vult dicere, quod vult dicere",2837693142,30 January 1649,85,128,1,4337,oc1649,False
11,15017064,author_id: 15017064,coversation_id: 1022542040792555521,1022542040792555521,2018-07-29T23:10:35.000Z,"[{'start': 0, 'end': 12, 'username': 'DominicRaab', 'id': '4764882552'}, {'start': 13, 'end': 27, 'username': 'MichelBarnier', 'id': '17487476'}]",1023707389676146689,id: 1023707389676146689,4764882552,en,0,0,0,0,"[{'type': 'replied_to', 'id': '1022542040792555521'}]",everyone,Twitter for Android,@DominicRaab @MichelBarnier Here you'll need this Dom... https://t.co/tGiUfPOkCp,2008-06-05T12:34:03.000Z,"Atheist, digamist.... ex Royal Signals, highly qualified know it all, so save time and see it my way....Linux, Unix, MS and Network God for money.",15017064,Derek Brabrook,2025,2725,4,55103,DJBrabrook,False
12,141141836,author_id: 141141836,coversation_id: 1022542040792555521,1022542040792555521,2018-07-29T19:59:32.000Z,"[{'start': 0, 'end': 12, 'username': 'DominicRaab', 'id': '4764882552'}, {'start': 13, 'end': 22, 'username': 'DExEUgov', 'id': '771031567443591168'}, {'start': 23, 'end': 37, 'username': 'MichelBarnier', 'id': '17487476'}]",1023659309065031685,id: 1023659309065031685,4764882552,en,2,1,0,0,"[{'type': 'replied_to', 'id': '1022542040792555521'}]",everyone,Twitter Web Client,"@DominicRaab @DExEUgov @MichelBarnier #RoadToBrexit = #RoadToHardship
Shame on you for not being transparent about #Brexit risks &amp; treating the public with contempt by withdrawing the 'no deal' preparation notes. Don't think that by releasing them en masse you'll be able to hide them behind a bigger news item. https://t.co/pv6b2pFAwF",2010-05-07T08:32:07.000Z,"Spanglish screenwriter, playwright & reluctant political activist, with a fetish for shoes. FD BigBreak & Roadmap Wise Words Winner. Brefugee in Paris 🇪🇺",141141836,💙KT *pro-PR* PARKER 🇫🇷🇬🇧🇪🇸🇺🇦🌻,14741,11674,212,320939,lunaperla,False
13,18214883,author_id: 18214883,coversation_id: 1022542040792555521,1022542040792555521,2018-07-29T19:35:28.000Z,"[{'start': 0, 'end': 12, 'username': 'DominicRaab', 'id': '4764882552'}, {'start': 13, 'end': 27, 'username': 'MichelBarnier', 'id': '17487476'}]",1023653250401296384,id: 1023653250401296384,4764882552,en,0,0,0,0,"[{'type': 'replied_to', 'id': '1022542040792555521'}]",everyone,Twitter for iPhone,"@DominicRaab @MichelBarnier Except it won't be you, because you lasted 2 weeks before getting demoted to Brexit Tea Boy. Pass the Rich Teas and scuttle on, there's a good boy.",2008-12-18T13:53:28.000Z,"Not normal. husband, father, music/film, Gooner, Co. Director w/ conscience, #HardRemain Sepsis Survivor psnl acct., views mine, vegan woke AF 🌱 〓〓 🇺🇦",18214883,dorians,559,558,1,11460,dorians,False
14,294607130,author_id: 294607130,coversation_id: 1022542040792555521,1022542040792555521,2018-07-29T19:18:42.000Z,"[{'start': 0, 'end': 12, 'username': 'DominicRaab', 'id': '4764882552'}, {'start': 13, 'end': 27, 'username': 'MichelBarnier', 'id': '17487476'}]",1023649033015975938,id: 1023649033015975938,4764882552,en,1,0,0,0,"[{'type': 'replied_to', 'id': '1022542040792555521'}]",everyone,Twitter for iPhone,"@DominicRaab @MichelBarnier People are shitting themselves, want an election and the Tories will never govern again #StopBrexit",2011-05-07T13:06:43.000Z,just swap the word ‘Brexit’ for ‘Russian propaganda’ and it all makes much more sense,294607130,Brexit is a Weapon 🟥🟨💚,2737,5002,41,342841,PhotoLawn,False
15,26824158,author_id: 26824158,coversation_id: 1022542040792555521,1022542040792555521,2018-07-29T13:21:59.000Z,"[{'start': 0, 'end': 12, 'username': 'DominicRaab', 'id': '4764882552'}, {'start': 13, 'end': 27, 'username': 'MichelBarnier', 'id': '17487476'}]",1023559260519780353,id: 1023559260519780353,4764882552,en,0,0,0,0,"[{'type': 'replied_to', 'id': '1022542040792555521'}]",everyone,Twitter for iPhone,"@DominicRaab @MichelBarnier Why should someone like you, decide what’s right for the public. You know nothing of how ordinary people live! God forbid you ever became PM we would all go back to the Victorian times!! Get real !! Or get out and take scummy May with you😡",2009-03-26T19:17:27.000Z,❤⚘👄🎀🌻🥂,26824158,⚘Riv⚘,962,1070,8,5536,cazarell,False
16,358677759,author_id: 358677759,coversation_id: 1022542040792555521,1022542040792555521,2018-07-29T10:56:31.000Z,"[{'start': 0, 'end': 12, 'username': 'DominicRaab', 'id': '4764882552'}, {'start': 13, 'end': 27, 'username': 'MichelBarnier', 'id': '17487476'}]",1023522652626010113,id: 1023522652626010113,4764882552,en,2,0,0,0,"[{'type': 'quoted', 'id': '1023092023052705792'}, {'type': 'replied_to', 'id': '1022542040792555521'}]",everyone,Twitter Web Client,@DominicRaab @MichelBarnier Has Juncker given you any brightly coloured flash cards yet?https://t.co/wEnMN7m9lV,2011-08-20T09:27:06.000Z,Anything sighthound related. Trying to be forensic as it makes for a better world #DogsofTwitter,358677759,Ian Young,1877,4986,29,66233,youngian67,False
17,923366138,author_id: 923366138,coversation_id: 1022542040792555521,1022542040792555521,2018-07-28T23:01:06.000Z,"[{'start': 0, 'end': 12, 'username': 'DominicRaab', 'id': '4764882552'}, {'start': 13, 'end': 27, 'username': 'MichelBarnier', 'id': '17487476'}]",1023342614370824192,id: 1023342614370824192,4764882552,und,1,0,0,0,"[{'type': 'replied_to', 'id': '1022542040792555521'}]",everyone,Twitter for iPhone,@DominicRaab @MichelBarnier  https://t.co/zCL94Ujep5,2012-11-03T14:49:18.000Z,‘As avaricious for knowledge as an Ichneumon for crocodile eggs’ https://t.co/cEFaqc5qio,923366138,DickleDockle 3.5% 💙#FBPE #StillEuropean🇺🇦,3195,5001,8,24819,DickleDockle,False
18,1010282734206574592,author_id: 1010282734206574592,coversation_id: 1022542040792555521,1022542040792555521,2018-07-28T14:38:34.000Z,"[{'start': 0, 'end': 12, 'username': 'DominicRaab', 'id': '4764882552'}, {'start': 13, 'end': 27, 'username': 'MichelBarnier', 'id': '17487476'}]",1023216147842445312,id: 1023216147842445312,4764882552,en,0,0,0,0,"[{'type': 'replied_to', 'id': '1022542040792555521'}]",everyone,Twitter for Android,@DominicRaab @MichelBarnier traitor!! You have made yourself a spineless paid puppet of May and the EU. it wont be forgotton when the next election comes.,2018-06-22T22:05:48.000Z,Northern Ireland,1010282734206574592,Zack 🇬🇧,548,704,0,8911,Zackj_uk,False
19,2609338760,author_id: 2609338760,coversation_id: 1022542040792555521,1022542040792555521,2018-07-28T10:42:35.000Z,"[{'start': 0, 'end': 12, 'username': 'DominicRaab', 'id': '4764882552'}, {'start': 13, 'end': 27, 'username': 'MichelBarnier', 'id': '17487476'}]",1023156761346404352,id: 1023156761346404352,4764882552,en,0,0,0,0,"[{'type': 'replied_to', 'id': '1022542040792555521'}]",everyone,Twitter Web App,@DominicRaab @MichelBarnier For goodness sake stand by the principles of brexit.,2014-07-07T10:07:21.000Z,"Love my family, love my dog, love life! Follow me and I will follow you right back 😊 No messaging please.",2609338760,Netty 🌸,2311,2302,2,8380,NettyMilo,False
20,2609338760,author_id: 2609338760,coversation_id: 1022542040792555521,1022542040792555521,2018-07-28T10:40:21.000Z,"[{'start': 0, 'end': 12, 'username': 'DominicRaab', 'id': '4764882552'}, {'start': 13, 'end': 27, 'username': 'MichelBarnier', 'id': '17487476'}]",1023156196692381696,id: 1023156196692381696,4764882552,und,0,0,0,0,"[{'type': 'replied_to', 'id': '1022542040792555521'}]",everyone,Twitter Web App,@DominicRaab @MichelBarnier ...,2014-07-07T10:07:21.000Z,"Love my family, love my dog, love life! Follow me and I will follow you right back 😊 No messaging please.",2609338760,Netty 🌸,2311,2302,2,8380,NettyMilo,False
21,21218870,author_id: 21218870,coversation_id: 1022542040792555521,1022542040792555521,2018-07-28T08:45:43.000Z,"[{'start': 0, 'end': 12, 'username': 'DominicRaab', 'id': '4764882552'}, {'start': 13, 'end': 27, 'username': 'MichelBarnier', 'id': '17487476'}]",1023127348567265281,id: 1023127348567265281,4764882552,en,0,0,0,0,"[{'type': 'replied_to', 'id': '1022542040792555521'}]",everyone,Twitter for Android,"@DominicRaab @MichelBarnier Hope you're right...

Would be a complete change of face &amp; heart from the EU side.

#ButLetsHopeTheySeeSense",2009-02-18T17:42:13.000Z,"Living the dream. Enjoying the game. Having some fun. Strategic Global Growth. #ScaleUp #EmergeUp

#LiveAsOne",21218870,MikeB,561,1655,14,17616,SanityChecker,False
22,872527375128551425,author_id: 872527375128551425,coversation_id: 1022542040792555521,1022542040792555521,2018-07-28T08:25:57.000Z,"[{'start': 0, 'end': 12, 'username': 'DominicRaab', 'id': '4764882552'}, {'start': 13, 'end': 27, 'username': 'MichelBarnier', 'id': '17487476'}]",1023122373636235265,id: 1023122373636235265,4764882552,en,0,0,0,0,"[{'type': 'replied_to', 'id': '1022542040792555521'}]",everyone,Twitter for iPad,"@DominicRaab @MichelBarnier I guess Olly told you all about the meeting on the way home. By the way, we have no interest in ‘your’ deal, it’s not ours as you will find out at the next GE.",2017-06-07T18:55:11.000Z,"Director, engineering, automotive, marine & defence manufacturing industry.",872527375128551425,Graham Scarsbrook💜,389,373,2,49919,Scarsbrook_G,False
23,222462505,author_id: 222462505,coversation_id: 1022542040792555521,1022542040792555521,2018-07-28T08:19:29.000Z,"[{'start': 0, 'end': 12, 'username': 'DominicRaab', 'id': '4764882552'}, {'start': 13, 'end': 27, 'username': 'MichelBarnier', 'id': '17487476'}]",1023120747458428929,id: 1023120747458428929,4764882552,en,0,0,0,0,"[{'type': 'replied_to', 'id': '1022542040792555521'}]",everyone,Twitter for iPhone,@DominicRaab @MichelBarnier Stop Brexit,2010-12-03T13:59:47.000Z,"Choir director, composer, grandfather, retired teacher/ lecturer, learning German and gardening, pro-EU marcher #FBPE",222462505,"Andrew, 💙 Count of Kent",546,1477,2,20077,AndrewLarner,False
24,222462505,author_id: 222462505,coversation_id: 1022542040792555521,1022542040792555521,2018-07-27T18:44:31.000Z,"[{'start': 0, 'end': 12, 'username': 'DominicRaab', 'id': '4764882552'}, {'start': 13, 'end': 27, 'username': 'MichelBarnier', 'id': '17487476'}]",1022915655669088257,id: 1022915655669088257,4764882552,en,0,0,0,0,"[{'type': 'replied_to', 'id': '1022542040792555521'}]",everyone,Twitter for iPad,@DominicRaab @MichelBarnier Stop Brexit,2010-12-03T13:59:47.000Z,"Choir director, composer, grandfather, retired teacher/ lecturer, learning German and gardening, pro-EU marcher #FBPE",222462505,"Andrew, 💙 Count of Kent",546,1477,2,20077,AndrewLarner,False
25,1134472663,author_id: 1134472663,coversation_id: 1022542040792555521,1022542040792555521,2018-07-28T05:32:45.000Z,"[{'start': 0, 'end': 12, 'username': 'DominicRaab', 'id': '4764882552'}, {'start': 13, 'end': 27, 'username': 'MichelBarnier', 'id': '17487476'}]",1023078788631015424,id: 1023078788631015424,4764882552,en,0,0,0,0,"[{'type': 'replied_to', 'id': '1022542040792555521'}]",everyone,Twitter for iPhone,@DominicRaab @MichelBarnier Dominic Raab ...... another comical MP ..... 😐,2013-01-30T15:56:34.000Z,,1134472663,Peter Henry,1404,2030,5,8332,peterjphenry,False
26,2304350554,author_id: 2304350554,coversation_id: 1022542040792555521,1022542040792555521,2018-07-27T23:28:01.000Z,"[{'start': 0, 'end': 16, 'username': 'RoastedSnowball', 'id': '1369593629543718913'}]",1022986998989185024,id: 1022986998989185024,930534752595185664,en,1,0,0,0,"[{'type': 'replied_to', 'id': '1022986148900155392'}]",everyone,Twitter for Android,@RoastedSnowball @hoongwaicheah What a bitter horrible gimp that remoaner is. Well done  @hoongwaicheah for closing him.,2014-01-25T21:35:36.000Z,England's green and pleasant land.,2304350554,Danny,1224,1914,13,45089,Dkaye1966,False
27,346501227,author_id: 346501227,coversation_id: 1022542040792555521,1022542040792555521,2018-07-27T23:18:19.000Z,"[{'start': 0, 'end': 16, 'username': 'RoastedSnowball', 'id': '1369593629543718913'}]",1022984556528508928,id: 1022984556528508928,930534752595185664,en,0,0,0,0,"[{'type': 'replied_to', 'id': '1022983015834767361'}]",everyone,Twitter for Android,@RoastedSnowball Thank you for the encouragement. It is appreciated!,2011-08-01T11:05:55.000Z,"A fool takes no pleasure in understanding, but only in expressing his opinion. -Proverbs 18v2",346501227,谢鸿威,742,1395,7,17903,xiehongwei1984,False
28,346501227,author_id: 346501227,coversation_id: 1022542040792555521,1022542040792555521,2018-07-27T22:43:43.000Z,"[{'start': 0, 'end': 15, 'username': 'proud_remoaner', 'id': '814550879332368384'}]",1022975849358925824,id: 1022975849358925824,814550879332368384,en,1,0,0,0,"[{'type': 'replied_to', 'id': '1022975477869371392'}]",everyone,Twitter Web Client,@proud_remoaner Are you unable to answer the question? Can't stand having your prejudices challenged?,2011-08-01T11:05:55.000Z,"A fool takes no pleasure in understanding, but only in expressing his opinion. -Proverbs 18v2",346501227,谢鸿威,742,1395,7,17903,xiehongwei1984,False
29,346501227,author_id: 346501227,coversation_id: 1022542040792555521,1022542040792555521,2018-07-27T22:39:51.000Z,"[{'start': 0, 'end': 15, 'username': 'proud_remoaner', 'id': '814550879332368384'}]",1022974875823165441,id: 1022974875823165441,814550879332368384,en,0,0,0,0,"[{'type': 'replied_to', 'id': '1022959684809052160'}]",everyone,Twitter Web Client,@proud_remoaner Can you just please answer the question?,2011-08-01T11:05:55.000Z,"A fool takes no pleasure in understanding, but only in expressing his opinion. -Proverbs 18v2",346501227,谢鸿威,742,1395,7,17903,xiehongwei1984,False
30,346501227,author_id: 346501227,coversation_id: 1022542040792555521,1022542040792555521,2018-07-27T21:16:55.000Z,"[{'start': 0, 'end': 15, 'username': 'proud_remoaner', 'id': '814550879332368384'}]",1022954006400958469,id: 1022954006400958469,814550879332368384,en,0,0,0,0,"[{'type': 'replied_to', 'id': '1022949160520220674'}]",everyone,Twitter Web Client,"@proud_remoaner Again you don't follow context. Gove was not dismissing experts. Listen to the full context instead of your butt hurt. 

I ask again: What is far right about libertarianism? What has Gerard Batten ever said about any adherent of any religion?",2011-08-01T11:05:55.000Z,"A fool takes no pleasure in understanding, but only in expressing his opinion. -Proverbs 18v2",346501227,谢鸿威,742,1395,7,17903,xiehongwei1984,False
31,346501227,author_id: 346501227,coversation_id: 1022542040792555521,1022542040792555521,2018-07-27T20:53:55.000Z,"[{'start': 0, 'end': 15, 'username': 'proud_remoaner', 'id': '814550879332368384'}]",1022948218508910593,id: 1022948218508910593,814550879332368384,en,0,0,0,0,"[{'type': 'replied_to', 'id': '1022935745005330433'}]",everyone,Twitter Web Client,"@proud_remoaner You can't seem to tell the difference between condemning an ideology and condemning its adherents. I think Communists are totalitarians, but that doesn't mean I want to put anyone into a gas chamber. Are you an expert on religions?",2011-08-01T11:05:55.000Z,"A fool takes no pleasure in understanding, but only in expressing his opinion. -Proverbs 18v2",346501227,谢鸿威,742,1395,7,17903,xiehongwei1984,False
32,346501227,author_id: 346501227,coversation_id: 1022542040792555521,1022542040792555521,2018-07-27T19:51:04.000Z,"[{'start': 0, 'end': 15, 'username': 'proud_remoaner', 'id': '814550879332368384'}]",1022932402358943744,id: 1022932402358943744,814550879332368384,en,0,0,0,0,"[{'type': 'replied_to', 'id': '1022921984987090944'}]",everyone,Twitter for Android,"@proud_remoaner UKIP's leader is a libertarian. 

So answer my question. What is far right about believing in liberty?",2011-08-01T11:05:55.000Z,"A fool takes no pleasure in understanding, but only in expressing his opinion. -Proverbs 18v2",346501227,谢鸿威,742,1395,7,17903,xiehongwei1984,False
33,346501227,author_id: 346501227,coversation_id: 1022542040792555521,1022542040792555521,2018-07-27T19:00:59.000Z,"[{'start': 0, 'end': 15, 'username': 'proud_remoaner', 'id': '814550879332368384'}]",1022919799414960128,id: 1022919799414960128,814550879332368384,en,0,0,0,0,"[{'type': 'replied_to', 'id': '1022888193312661504'}]",everyone,Twitter for Android,"@proud_remoaner Libertarianism is ""far right"" now?

I said it before, I'll say it again: you've lost the plot!",2011-08-01T11:05:55.000Z,"A fool takes no pleasure in understanding, but only in expressing his opinion. -Proverbs 18v2",346501227,谢鸿威,742,1395,7,17903,xiehongwei1984,False
34,346501227,author_id: 346501227,coversation_id: 1022542040792555521,1022542040792555521,2018-07-27T16:41:15.000Z,"[{'start': 0, 'end': 15, 'username': 'proud_remoaner', 'id': '814550879332368384'}]",1022884634277892097,id: 1022884634277892097,814550879332368384,en,0,0,0,0,"[{'type': 'replied_to', 'id': '1022872364718145536'}]",everyone,Twitter Web Client,"@proud_remoaner You too mate, keep cheering on the worst of both worlds arrangement. Cutting off your nose to spite your face. You just see watch out how the political landscape turns out. You'll get either Corbyn National Socialism, or UKIP's libertarianism. Let's see who you pick! ;)",2011-08-01T11:05:55.000Z,"A fool takes no pleasure in understanding, but only in expressing his opinion. -Proverbs 18v2",346501227,谢鸿威,742,1395,7,17903,xiehongwei1984,False
