,author_id,author_id_new,conv_id_new,conversation_id,created_at,entities.mentions,id,id_new,in_reply_to_user_id,lang,public_metrics.like_count,public_metrics.quote_count,public_metrics.reply_count,public_metrics.retweet_count,referenced_tweets,reply_settings,source,text,users.created_at,users.description,users.id,users.name,users.public_metrics.followers_count,users.public_metrics.following_count,users.public_metrics.listed_count,users.public_metrics.tweet_count,users.username,users.verified
62,799536494511816704,author_id: 799536494511816704,coversation_id: 1022542040792555521,1022542040792555521,2018-07-27T12:44:19.000Z,"[{'start': 0, 'end': 9, 'username': 'janet_65', 'id': '48508697'}, {'start': 10, 'end': 22, 'username': 'DominicRaab', 'id': '4764882552'}, {'start': 23, 'end': 37, 'username': 'MichelBarnier', 'id': '17487476'}]",1022825005393084416,id: 1022825005393084416,48508697,en,0,0,0,0,"[{'type': 'replied_to', 'id': '1022823613081296897'}]",everyone,Twitter Web App,@janet_65 @DominicRaab @MichelBarnier Hey Dom. I appreciate you are Dippy Davis' prodigy so probably are not very competent. So a tip: businesses need Customs Union and access to SM. that is the only way you will get a deal with exact same benefits as you and the other shyster brexiters promised.,2016-11-18T08:55:29.000Z,"Lee begins at th' lip o` yer comfort zone. Student o' hee haw nada, licensed haggis hunter. Answers to Hoi/You. Wants Scotland to be equal with other nations.👇",799536494511816704,🏴‍☠️ Callum 🤪🏴󠁧󠁢󠁳󠁣󠁴󠁿 🇪🇺 🇮🇪,4422,4999,14,80491,ComradePangloss,False
63,48508697,author_id: 48508697,coversation_id: 1022542040792555521,1022542040792555521,2018-07-27T12:38:47.000Z,"[{'start': 0, 'end': 12, 'username': 'DominicRaab', 'id': '4764882552'}, {'start': 13, 'end': 27, 'username': 'MichelBarnier', 'id': '17487476'}]",1022823613081296897,id: 1022823613081296897,4764882552,en,1,0,1,0,"[{'type': 'replied_to', 'id': '1022542040792555521'}]",everyone,Twitter for Android,@DominicRaab @MichelBarnier More like #RoadToNowhere,2009-06-18T22:07:50.000Z,"Birth mum, adoptive mum, passionate Remainer who isn't going to shut up about it",48508697,Janet 3.5% 🇺🇦,371,644,3,4471,janet_65,False
64,868376846,author_id: 868376846,coversation_id: 1022542040792555521,1022542040792555521,2018-07-27T11:55:50.000Z,"[{'start': 0, 'end': 12, 'username': 'DominicRaab', 'id': '4764882552'}, {'start': 13, 'end': 27, 'username': 'foreignoffice', 'id': '1300912573739663361'}, {'start': 28, 'end': 42, 'username': 'MichelBarnier', 'id': '17487476'}]",1022812804368269312,id: 1022812804368269312,4764882552,en,0,0,0,0,"[{'type': 'replied_to', 'id': '1022542040792555521'}]",everyone,Twitter for Android,@DominicRaab @foreignoffice @MichelBarnier #RoadtoNowhere more like,2012-10-08T17:35:40.000Z,"architect who loves cats, gardens, art and travel",868376846,Cathy A 🇺🇦,401,384,12,30630,scots_cat,False
65,994631379571879936,author_id: 994631379571879936,coversation_id: 1022542040792555521,1022542040792555521,2018-07-27T11:53:02.000Z,"[{'start': 0, 'end': 12, 'username': 'DominicRaab', 'id': '4764882552'}, {'start': 13, 'end': 27, 'username': 'MichelBarnier', 'id': '17487476'}, {'start': 45, 'end': 61, 'username': 'realDonaldTrump', 'id': '25073877'}]",1022812099356098562,id: 1022812099356098562,4764882552,en,0,0,0,0,"[{'type': 'replied_to', 'id': '1022542040792555521'}]",everyone,Twitter for Android,@DominicRaab @MichelBarnier Why does it take @realDonaldTrump 24hrs to deal with the EU and 2 years of negotiations  for you fucking dick heads and still no further along. Conservative in name not values,2018-05-10T17:32:55.000Z,"Conservative Woman. proud to be English. love surfing, heavy metal, supporter of Military, Brexit, Trump, Free speech, 2A, Israel",994631379571879936,Aurora 🏴󠁧󠁢󠁥󠁮󠁧󠁿🇬🇧🇺🇸,81,208,1,915,Aurora1fspeech,False
66,42232124,author_id: 42232124,coversation_id: 1022542040792555521,1022542040792555521,2018-07-27T10:48:13.000Z,"[{'start': 0, 'end': 12, 'username': 'DominicRaab', 'id': '4764882552'}, {'start': 13, 'end': 22, 'username': 'DExEUgov', 'id': '771031567443591168'}, {'start': 23, 'end': 37, 'username': 'MichelBarnier', 'id': '17487476'}]",1022795787619782656,id: 1022795787619782656,4764882552,en,0,0,0,0,"[{'type': 'replied_to', 'id': '1022542040792555521'}]",everyone,Twitter for Android,@DominicRaab @DExEUgov @MichelBarnier And if you fail to remove the obstacles by October . . . will you resign?,2009-05-24T15:56:21.000Z,"immigrant: American by birth, British by naturalisation, EU resident by choice",42232124,KeplerNiko,159,78,4,46145,keplerniko,False
67,2194734056,author_id: 2194734056,coversation_id: 1022542040792555521,1022542040792555521,2018-07-27T10:11:33.000Z,"[{'start': 0, 'end': 12, 'username': 'DominicRaab', 'id': '4764882552'}, {'start': 13, 'end': 23, 'username': 'ukinspain', 'id': '16883794'}, {'start': 24, 'end': 38, 'username': 'MichelBarnier', 'id': '17487476'}]",1022786563565125632,id: 1022786563565125632,4764882552,en,0,0,0,0,"[{'type': 'replied_to', 'id': '1022542040792555521'}]",everyone,Twitter for iPad,@DominicRaab @ukinspain @MichelBarnier Deluded.....,2013-11-14T19:20:58.000Z,Retired runner. Arsenal. Family includes one Yorkie and one Brittany. #FBPE,2194734056,David Dunn,906,1929,5,14976,DavidDunn48,False
68,2505174371,author_id: 2505174371,coversation_id: 1022542040792555521,1022542040792555521,2018-07-27T09:50:20.000Z,"[{'start': 0, 'end': 12, 'username': 'DominicRaab', 'id': '4764882552'}, {'start': 13, 'end': 27, 'username': 'MichelBarnier', 'id': '17487476'}, {'start': 72, 'end': 84, 'username': 'theresa_may', 'id': '747807250819981312'}]",1022781223721213952,id: 1022781223721213952,4764882552,en,0,0,0,0,"[{'type': 'replied_to', 'id': '1022542040792555521'}]",everyone,Twitter for iPhone,"@DominicRaab @MichelBarnier Won’t make any difference your line manager @theresa_may wants to stay in the Eu &amp; will do anything she can to stay
Despite what her employers ( THE VOTERS &amp; TAXPAYERS) voted leave",2014-04-24T01:28:38.000Z,"#alllivesmatter, I don’t trust politicians, respect free speech anti woke",2505174371,Pat_man 🇬🇧,181,290,1,18657,pxk211,False
69,3043890163,author_id: 3043890163,coversation_id: 1022542040792555521,1022542040792555521,2018-07-27T09:32:46.000Z,"[{'start': 16, 'end': 29, 'username': 'JoostVanWell', 'id': '570712896'}, {'start': 30, 'end': 46, 'username': 'AlanGeraldWard2', 'id': '802087155430522880'}, {'start': 47, 'end': 59, 'username': 'DominicRaab', 'id': '4764882552'}, {'start': 60, 'end': 74, 'username': 'MichelBarnier', 'id': '17487476'}]",1022776801616113664,id: 1022776801616113664,759005274837442562,en,0,0,0,0,"[{'type': 'replied_to', 'id': '1022714984349003776'}]",everyone,Twitter for iPad,@resurgentsheep @JoostVanWell @AlanGeraldWard2 @DominicRaab @MichelBarnier And another 🤖🤖🤖,2015-02-26T15:33:24.000Z,"Northern Irish, European, #Think32 #NeverTrustATory",3043890163,Taureau 💉💉💉,5141,5661,1,28454,7691Toro,False
70,3043890163,author_id: 3043890163,coversation_id: 1022542040792555521,1022542040792555521,2018-07-27T09:30:06.000Z,"[{'start': 0, 'end': 11, 'username': 'garyan1812', 'id': '886978005679181824'}, {'start': 12, 'end': 25, 'username': 'JoostVanWell', 'id': '570712896'}, {'start': 26, 'end': 42, 'username': 'AlanGeraldWard2', 'id': '802087155430522880'}, {'start': 43, 'end': 55, 'username': 'DominicRaab', 'id': '4764882552'}, {'start': 56, 'end': 70, 'username': 'MichelBarnier', 'id': '17487476'}]",1022776129315319808,id: 1022776129315319808,886978005679181824,und,0,0,0,0,"[{'type': 'replied_to', 'id': '1022768938856468480'}]",everyone,Twitter for iPad,@garyan1812 @JoostVanWell @AlanGeraldWard2 @DominicRaab @MichelBarnier 🤖🤖🤖,2015-02-26T15:33:24.000Z,"Northern Irish, European, #Think32 #NeverTrustATory",3043890163,Taureau 💉💉💉,5141,5661,1,28454,7691Toro,False
71,179673366,author_id: 179673366,coversation_id: 1022542040792555521,1022542040792555521,2018-07-27T09:27:10.000Z,"[{'start': 0, 'end': 8, 'username': 'Fwoggie', 'id': '47681995'}, {'start': 9, 'end': 21, 'username': 'DominicRaab', 'id': '4764882552'}]",1022775391876984832,id: 1022775391876984832,47681995,en,0,0,0,0,"[{'type': 'replied_to', 'id': '1022727862045036544'}]",everyone,Tweetbot for iΟS,@Fwoggie @DominicRaab Surely better than Brexit in name only and still beholden to the EU with no seat at the table.,2010-08-17T21:34:03.000Z,"Personal Assistant, Music Industry, Law, Pharma(AstraZeneca) - now retired. Mother. Worked for The Beatles Management, now those were the days!!! COYS",179673366,Viv Jones,2283,262,41,183143,vivjones10,False
72,1016328493804806144,author_id: 1016328493804806144,coversation_id: 1022542040792555521,1022542040792555521,2018-07-27T09:22:52.000Z,"[{'start': 0, 'end': 12, 'username': 'DominicRaab', 'id': '4764882552'}, {'start': 13, 'end': 27, 'username': 'MichelBarnier', 'id': '17487476'}]",1022774310807715843,id: 1022774310807715843,4764882552,en,0,0,0,0,"[{'type': 'replied_to', 'id': '1022542040792555521'}]",everyone,Twitter Web Client,@DominicRaab @MichelBarnier No Barnier will have you for breakfast matey His comments today shows how unwilling he is to move on his RED LINES. Walk away NOW NO DEAL,2018-07-09T14:29:30.000Z,born England indigenous DNA tested white male. Happy we are now rid of the EU.,1016328493804806144,Spence,137,139,1,9363,romlad43,False
73,2170986966,author_id: 2170986966,coversation_id: 1022542040792555521,1022542040792555521,2018-07-27T09:16:04.000Z,"[{'start': 0, 'end': 12, 'username': 'DominicRaab', 'id': '4764882552'}, {'start': 13, 'end': 28, 'username': 'MonteithRichie', 'id': '2972930770'}, {'start': 29, 'end': 43, 'username': 'MichelBarnier', 'id': '17487476'}]",1022772599489785856,id: 1022772599489785856,4764882552,en,0,0,0,1,"[{'type': 'replied_to', 'id': '1022542040792555521'}]",everyone,Twitter for iPhone,"@DominicRaab @MonteithRichie @MichelBarnier “committed to removing obstacles”

Tell me how do you remove an obstacle called Robbins??",2013-11-02T21:42:43.000Z,Brexiteer. Animal lover. Where did that opinion come from..make the media accountable. I try & reply to all but No Dms pls I don’t read them.,2170986966,sandieshoes 🇬🇧🇺🇸,27073,25640,56,163038,sandieshoes,False
74,869295591301537792,author_id: 869295591301537792,coversation_id: 1022542040792555521,1022542040792555521,2018-07-27T09:15:34.000Z,"[{'start': 0, 'end': 12, 'username': 'DominicRaab', 'id': '4764882552'}, {'start': 13, 'end': 27, 'username': 'foreignoffice', 'id': '1300912573739663361'}, {'start': 28, 'end': 42, 'username': 'MichelBarnier', 'id': '17487476'}]",1022772472628871168,id: 1022772472628871168,4764882552,en,0,0,0,0,"[{'type': 'replied_to', 'id': '1022542040792555521'}]",everyone,Twitter for iPad,"@DominicRaab @foreignoffice @MichelBarnier The picture says it all! A fest of administrative jollies, employing 100’s and achieving bugger all. And so it goes on, and on and on... Barnier and his EU political thugs have rejected ‘Chequers’. For pity sake Mr Raab, don’t you know when it is time to stop and walk away?",2017-05-29T20:53:14.000Z,Just an ordinary Brit. Proud of my country and grateful for growing up in a unique society that so many people gave so much to create and protect.,869295591301537792,OldTory,801,827,3,65902,old_tory,False
75,3050293329,author_id: 3050293329,coversation_id: 1022542040792555521,1022542040792555521,2018-07-27T09:06:02.000Z,"[{'start': 0, 'end': 12, 'username': 'DominicRaab', 'id': '4764882552'}, {'start': 13, 'end': 27, 'username': 'foreignoffice', 'id': '1300912573739663361'}, {'start': 28, 'end': 42, 'username': 'MichelBarnier', 'id': '17487476'}]",1022770074757877761,id: 1022770074757877761,4764882552,en,0,0,0,0,"[{'type': 'replied_to', 'id': '1022542040792555521'}]",everyone,Twitter Web Client,"@DominicRaab @foreignoffice @MichelBarnier As Ollie drip in charge, you have a battle.  Just resign and campaign to leave with no strings.  WTO is most appealing, and freedom.  Visit Heathrow Cargo, it's near you. See how much comes in by air, including fresh food and see how quickly it clears customs and is collected.",2015-02-21T18:21:11.000Z,,3050293329,Colin Crookhunter,27,289,1,6545,Crookhunters,False
76,886978005679181824,author_id: 886978005679181824,coversation_id: 1022542040792555521,1022542040792555521,2018-07-27T09:01:31.000Z,"[{'start': 0, 'end': 13, 'username': 'JoostVanWell', 'id': '570712896'}, {'start': 14, 'end': 30, 'username': 'AlanGeraldWard2', 'id': '802087155430522880'}, {'start': 31, 'end': 43, 'username': 'DominicRaab', 'id': '4764882552'}, {'start': 44, 'end': 58, 'username': 'MichelBarnier', 'id': '17487476'}]",1022768938856468480,id: 1022768938856468480,570712896,en,1,0,1,0,"[{'type': 'replied_to', 'id': '1022567351043153920'}]",everyone,Twitter Web App,@JoostVanWell @AlanGeraldWard2 @DominicRaab @MichelBarnier How long have you been able to see into the future .when people voted they didn't care what happened in the short term .its the long term that matters,2017-07-17T15:56:50.000Z,,886978005679181824,Gary barnes,285,659,2,15297,garyan1812,False
77,886978005679181824,author_id: 886978005679181824,coversation_id: 1022542040792555521,1022542040792555521,2018-07-27T08:57:42.000Z,"[{'start': 0, 'end': 12, 'username': 'DominicRaab', 'id': '4764882552'}, {'start': 13, 'end': 27, 'username': 'foreignoffice', 'id': '1300912573739663361'}, {'start': 28, 'end': 42, 'username': 'MichelBarnier', 'id': '17487476'}]",1022767978985730053,id: 1022767978985730053,4764882552,en,0,0,0,0,"[{'type': 'replied_to', 'id': '1022542040792555521'}]",everyone,Twitter Web App,"@DominicRaab @foreignoffice @MichelBarnier ""YOU"" are selling yourself out ,and the UK .#GROWAPAIR",2017-07-17T15:56:50.000Z,,886978005679181824,Gary barnes,285,659,2,15297,garyan1812,False
78,236833009,author_id: 236833009,coversation_id: 1022542040792555521,1022542040792555521,2018-07-27T08:59:03.000Z,"[{'start': 0, 'end': 12, 'username': 'DominicRaab', 'id': '4764882552'}, {'start': 13, 'end': 27, 'username': 'foreignoffice', 'id': '1300912573739663361'}, {'start': 28, 'end': 42, 'username': 'MichelBarnier', 'id': '17487476'}]",1022768318804094977,id: 1022768318804094977,4764882552,en,0,0,0,0,"[{'type': 'replied_to', 'id': '1022542040792555521'}]",everyone,Twitter for iPad,@DominicRaab @foreignoffice @MichelBarnier At least you are making a better effort than your predecessor.,2011-01-11T13:36:11.000Z,,236833009,Sharon Begley,220,1630,13,30133,shannongirl_4,False
79,351828672,author_id: 351828672,coversation_id: 1022542040792555521,1022542040792555521,2018-07-27T08:57:22.000Z,"[{'start': 0, 'end': 12, 'username': 'DominicRaab', 'id': '4764882552'}, {'start': 13, 'end': 27, 'username': 'foreignoffice', 'id': '1300912573739663361'}, {'start': 28, 'end': 42, 'username': 'MichelBarnier', 'id': '17487476'}]",1022767892771815424,id: 1022767892771815424,4764882552,en,0,0,0,0,"[{'type': 'replied_to', 'id': '1022542040792555521'}]",everyone,Twitter for iPhone,@DominicRaab @foreignoffice @MichelBarnier You seem that you are doing much more than what DD did for the last 2 years . I hope that all works for everyone . Good luck,2011-08-09T19:52:19.000Z,,351828672,JAw,9,165,0,1906,jihad_aw,False
80,20160626,author_id: 20160626,coversation_id: 1022542040792555521,1022542040792555521,2018-07-27T08:56:30.000Z,"[{'start': 0, 'end': 12, 'username': 'DominicRaab', 'id': '4764882552'}, {'start': 13, 'end': 27, 'username': 'MichelBarnier', 'id': '17487476'}]",1022767674676453377,id: 1022767674676453377,4764882552,en,0,0,0,0,"[{'type': 'replied_to', 'id': '1022542040792555521'}]",everyone,Twitter for iPhone,@DominicRaab @MichelBarnier Selling us out and putting the Tories on the scrapheap..,2009-02-05T16:19:43.000Z,"Politically homeless, not easily bribed and will fight, and protect those around me, to the death",20160626,Charlie,2081,1788,12,26547,HawkeyeKnows,False
81,771472983634350080,author_id: 771472983634350080,coversation_id: 1022542040792555521,1022542040792555521,2018-07-27T08:19:07.000Z,"[{'start': 0, 'end': 12, 'username': 'DominicRaab', 'id': '4764882552'}, {'start': 13, 'end': 27, 'username': 'MichelBarnier', 'id': '17487476'}]",1022758267649503235,id: 1022758267649503235,4764882552,en,0,0,0,0,"[{'type': 'replied_to', 'id': '1022542040792555521'}]",everyone,Twitter Web Client,"@DominicRaab @MichelBarnier If that was a good trip, with Barnier telling you to go home and stop being so silly, what would a bad trip look like?",2016-09-01T22:21:07.000Z,,771472983634350080,Jim Blythe,1,3,0,282,blythe_jw,False
82,771472983634350080,author_id: 771472983634350080,coversation_id: 1022542040792555521,1022542040792555521,2018-07-27T08:18:26.000Z,"[{'start': 0, 'end': 8, 'username': 'ChobDux', 'id': '1342082028586545152'}, {'start': 9, 'end': 21, 'username': 'DominicRaab', 'id': '4764882552'}, {'start': 22, 'end': 36, 'username': 'MichelBarnier', 'id': '17487476'}]",1022758094433071104,id: 1022758094433071104,161400548,en,0,0,0,0,"[{'type': 'replied_to', 'id': '1022558487900028928'}]",everyone,Twitter Web Client,@ChobDux @DominicRaab @MichelBarnier No government will take us out without a deal.,2016-09-01T22:21:07.000Z,,771472983634350080,Jim Blythe,1,3,0,282,blythe_jw,False
83,865953415851016192,author_id: 865953415851016192,coversation_id: 1022542040792555521,1022542040792555521,2018-07-27T08:11:35.000Z,"[{'start': 0, 'end': 12, 'username': 'DominicRaab', 'id': '4764882552'}, {'start': 13, 'end': 27, 'username': 'MichelBarnier', 'id': '17487476'}]",1022756371404603397,id: 1022756371404603397,4764882552,en,0,0,0,0,"[{'type': 'replied_to', 'id': '1022542040792555521'}]",everyone,Twitter for iPad,@DominicRaab @MichelBarnier This is a 100% Tory mess Cameron strarted it then walked away now May just finished it off putting Britain at the bottom of the pile ... Britain now is finished the Torys did what Hitler couldnt  brake it !!,2017-05-20T15:32:37.000Z,,865953415851016192,James B.,18,29,0,13790,AdolfHi58493944,False
84,906947382553796609,author_id: 906947382553796609,coversation_id: 1022542040792555521,1022542040792555521,2018-07-27T08:11:20.000Z,"[{'start': 0, 'end': 12, 'username': 'DominicRaab', 'id': '4764882552'}, {'start': 13, 'end': 27, 'username': 'MichelBarnier', 'id': '17487476'}]",1022756309425446912,id: 1022756309425446912,4764882552,en,0,0,0,0,"[{'type': 'quoted', 'id': '1022752615447375872'}, {'type': 'replied_to', 'id': '1022542040792555521'}]",everyone,Twitter for iPhone,@DominicRaab @MichelBarnier How do you feel about this? https://t.co/kcxOAsEnyY,2017-09-10T18:28:01.000Z,"🌍🇬🇧🇪🇺🏳️‍🌈 Just wanting a better, fairer and more humane world. doesn’t feel unreasonable but seems to be very controversial! #Manga Fan",906947382553796609,@BritRejoin,5821,6404,14,24287,BritRejoin,False
85,67584573,author_id: 67584573,coversation_id: 1022542040792555521,1022542040792555521,2018-07-27T08:10:03.000Z,"[{'start': 0, 'end': 12, 'username': 'DominicRaab', 'id': '4764882552'}, {'start': 13, 'end': 27, 'username': 'MichelBarnier', 'id': '17487476'}]",1022755987214815232,id: 1022755987214815232,4764882552,en,0,0,0,0,"[{'type': 'replied_to', 'id': '1022542040792555521'}]",everyone,Twitter Web Client,"@DominicRaab @MichelBarnier Bin the Chequers plan and revert to CETA++. British public won't accept the former as it stands; EU won't either without further concessions, which public won't wear. CETA++ works with ongoing pragmatism over Irish border",2009-08-21T11:32:58.000Z,,67584573,MB,1219,320,28,192900,markbishopuk,False
86,753632236403122176,author_id: 753632236403122176,coversation_id: 1022542040792555521,1022542040792555521,2018-07-27T07:49:22.000Z,"[{'start': 0, 'end': 12, 'username': 'DominicRaab', 'id': '4764882552'}, {'start': 13, 'end': 27, 'username': 'MichelBarnier', 'id': '17487476'}]",1022750779806048256,id: 1022750779806048256,4764882552,en,1,0,0,0,"[{'type': 'replied_to', 'id': '1022542040792555521'}]",everyone,Twitter for iPhone,"@DominicRaab @MichelBarnier As Barnier said: “This includes the very important issue of citizens' rights, which has been our priority since the beginning of this negotiation, as well as the priority of the European Parliament. It continues to be our priority.” We need our free movement rights saving, pronto",2016-07-14T16:48:22.000Z,I joined originally for my volunteering with Mobile Info Team. Now interested in the Russian war against Europe. Language nerd,753632236403122176,Owen Brown,218,540,4,1766,OwenMobileInfo,False
87,269345571,author_id: 269345571,coversation_id: 1022542040792555521,1022542040792555521,2018-07-27T07:45:04.000Z,"[{'start': 0, 'end': 12, 'username': 'DominicRaab', 'id': '4764882552'}, {'start': 13, 'end': 27, 'username': 'MichelBarnier', 'id': '17487476'}]",1022749699424571393,id: 1022749699424571393,4764882552,en,0,0,0,0,"[{'type': 'replied_to', 'id': '1022542040792555521'}]",everyone,Twitter Web App,"@DominicRaab @MichelBarnier It looks to me like the EU does not want to negotiate with us and will say no, no, no until we leave. They want to set an example that you if you leave, you become weak. So I do expect a No deal. It’s been an EU strategy from day 1. We won’t be weak.",2011-03-20T15:53:10.000Z,"Father to two Amazing Kids, wearer of shorts, Environmental Engineer, Cartoonist, Believer, and keen Campaigner on the rights of Children.",269345571,Edward Salter,103,230,2,2188,zdrojkowski_ed,False
88,753549539919953921,author_id: 753549539919953921,coversation_id: 1022542040792555521,1022542040792555521,2018-07-27T07:33:12.000Z,"[{'start': 0, 'end': 13, 'username': 'Juderobinson', 'id': '18223202'}, {'start': 14, 'end': 26, 'username': 'DominicRaab', 'id': '4764882552'}, {'start': 27, 'end': 41, 'username': 'MichelBarnier', 'id': '17487476'}]",1022746711964438528,id: 1022746711964438528,18223202,en,0,0,0,0,"[{'type': 'replied_to', 'id': '1022744441604501505'}]",everyone,Twitter for iPad,@Juderobinson @DominicRaab @MichelBarnier Only the knuckle draggers who have had their toxic beliefs legitimised by this crowd of cockwombles.,2016-07-14T11:19:45.000Z,"Cornish born Asturiana. EU 🇪🇺 I block ignorance, intolerance, stupidity and uninvited DMs.",753549539919953921,LilyG 💙🖖 🐾 🇪🇺,2018,2640,3,48694,IamLilyG,False
89,910493972325335045,author_id: 910493972325335045,coversation_id: 1022542040792555521,1022542040792555521,2018-07-27T07:32:43.000Z,"[{'start': 0, 'end': 12, 'username': 'DominicRaab', 'id': '4764882552'}, {'start': 13, 'end': 27, 'username': 'MichelBarnier', 'id': '17487476'}]",1022746589624971264,id: 1022746589624971264,4764882552,en,0,0,0,0,"[{'type': 'replied_to', 'id': '1022542040792555521'}]",everyone,Twitter for Android,@DominicRaab @MichelBarnier It amazes me that TM never learns from her mistakes. She ignores opinions of her ministers she doesn't agree with. She should now take seriously the work that was done on the alternative white paper. Olly should go.,2017-09-20T13:20:53.000Z,,910493972325335045,Ann Edmond,1,14,0,242,AnnEdmond3,False
90,941269007973351424,author_id: 941269007973351424,coversation_id: 1022542040792555521,1022542040792555521,2018-07-27T07:32:17.000Z,"[{'start': 0, 'end': 12, 'username': 'DominicRaab', 'id': '4764882552'}, {'start': 13, 'end': 27, 'username': 'MichelBarnier', 'id': '17487476'}]",1022746481869185029,id: 1022746481869185029,4764882552,en,0,0,0,0,"[{'type': 'replied_to', 'id': '1022542040792555521'}]",everyone,Twitter for iPhone,@DominicRaab @MichelBarnier That means more concessions then. What a complete and utter waste of time and money as we’re going to end up staying in in all but name. Why were we given the referendum if we were never going to abide by the outcome? Beginning of the end for the Conservatives.,2017-12-14T11:29:54.000Z,I prefer porridge!,941269007973351424,Special K,111,97,0,9091,Zak2096,False
91,874372370777112576,author_id: 874372370777112576,coversation_id: 1022542040792555521,1022542040792555521,2018-07-27T07:25:43.000Z,"[{'start': 0, 'end': 12, 'username': 'DominicRaab', 'id': '4764882552'}, {'start': 13, 'end': 27, 'username': 'MichelBarnier', 'id': '17487476'}]",1022744830131281920,id: 1022744830131281920,4764882552,en,1,0,0,0,"[{'type': 'replied_to', 'id': '1022542040792555521'}]",everyone,Twitter Web App,@DominicRaab @MichelBarnier This is just Tory spin. We all heard what Barnier said.,2017-06-12T21:06:33.000Z,The opinion poll of 23/6/16 was a farce|citizen of nowhere|metropolitan elite|enemy of the people|brexiters = racists|rejoiner|ashamed to be British|#FBPE|#GTTO,874372370777112576,Proud Saboteur 🇪🇺 🇺🇦,7574,7502,10,13554,ProudSaboteur,False
92,18223202,author_id: 18223202,coversation_id: 1022542040792555521,1022542040792555521,2018-07-27T07:24:11.000Z,"[{'start': 0, 'end': 12, 'username': 'DominicRaab', 'id': '4764882552'}, {'start': 13, 'end': 27, 'username': 'MichelBarnier', 'id': '17487476'}]",1022744441604501505,id: 1022744441604501505,4764882552,en,0,0,1,0,"[{'type': 'replied_to', 'id': '1022542040792555521'}]",everyone,Twitter for iPhone,@DominicRaab @MichelBarnier Does anyone believe this crap?,2008-12-18T19:51:49.000Z,From Hull to Cornwall. Never far from the sea. Love walking my dog.,18223202,Juderobinson,2238,2772,82,22073,Juderobinson,False
