,author_id,author_id_new,conv_id_new,conversation_id,created_at,entities.mentions,id,id_new,in_reply_to_user_id,lang,public_metrics.like_count,public_metrics.quote_count,public_metrics.reply_count,public_metrics.retweet_count,referenced_tweets,reply_settings,source,text,users.created_at,users.description,users.id,users.name,users.public_metrics.followers_count,users.public_metrics.following_count,users.public_metrics.listed_count,users.public_metrics.tweet_count,users.username,users.verified
0,922876984140673024,author_id: 922876984140673024,coversation_id: 935060150855131137,935060150855131137,2017-11-27T10:41:28.000Z,"[{'start': 0, 'end': 12, 'username': 'DominicRaab', 'id': '4764882552'}]",935096226504237056,id: 935096226504237056,4764882552,en,0,0,0,0,"[{'type': 'replied_to', 'id': '935060150855131137'}]",everyone,Twitter for iPhone,@DominicRaab The last positive sting of a dying wasp.,2017-10-24T17:26:34.000Z,"Spending some time on planet Earth.

Slava Ukraini",922876984140673024,Robert Dowling,267,1068,2,7737,DunlaingRob,False
1,228581274,author_id: 228581274,coversation_id: 935060150855131137,935060150855131137,2017-11-27T09:30:07.000Z,"[{'start': 0, 'end': 12, 'username': 'DominicRaab', 'id': '4764882552'}]",935078271406002176,id: 935078271406002176,4764882552,en,0,0,0,0,"[{'type': 'replied_to', 'id': '935060150855131137'}]",everyone,Twitter for Android,@DominicRaab #Brexit is the most beautiful thing happening to this country in a long time,2010-12-20T03:53:52.000Z,"MSc Maths, Tory since 2007. My schedule is rigid and I write a book. PhD in progress.",228581274,Miss Penny Longstocking ❤ Boris,2242,560,24,197900,pennylongstckng,False
2,234454458,author_id: 234454458,coversation_id: 935060150855131137,935060150855131137,2017-11-27T09:15:18.000Z,"[{'start': 0, 'end': 12, 'username': 'DominicRaab', 'id': '4764882552'}, {'start': 13, 'end': 26, 'username': 'SteveBakerHW', 'id': '15157283'}]",935074544456536065,id: 935074544456536065,4764882552,en,1,0,0,0,"[{'type': 'replied_to', 'id': '935060150855131137'}]",everyone,Twitter for iPhone,@DominicRaab @SteveBakerHW Good news. I hope the loss of Single Market Passport &amp; the absence of a countervailing reg equivalence framework (as a no-deal scenario suggests) will not deliver the polar opposite.,2011-01-05T18:07:33.000Z,"PHD from @CityLawSchool, Snr Lecturer @LJMU, #Sovereignet Affiliate. Interested in #SWFs, Int'l Economic Law, Corp Gov, CSR & Financial Reg. Views my own.",234454458,Chijioke .O.,920,4160,50,20049,ChijiokeJack,False
3,1708562239,author_id: 1708562239,coversation_id: 935060150855131137,935060150855131137,2017-11-27T08:55:35.000Z,"[{'start': 0, 'end': 12, 'username': 'DominicRaab', 'id': '4764882552'}]",935069582229954560,id: 935069582229954560,4764882552,en,0,0,0,0,"[{'type': 'replied_to', 'id': '935060150855131137'}]",everyone,Twitter Web Client,@DominicRaab A shame that after #Brexshit we will see a lot of our finance firms move to EU,2013-08-28T23:34:37.000Z,"For Lovers Ravers Rockers and Sinners 
#dontbuythesun #ToryCorruption #GTTO #ScottishIndependence",1708562239,#ILovetoBoogie,3064,4726,9,94567,trexfan2,False
4,20549706,author_id: 20549706,coversation_id: 935060150855131137,935060150855131137,2017-11-27T08:50:04.000Z,"[{'start': 0, 'end': 12, 'username': 'DominicRaab', 'id': '4764882552'}]",935068192166342656,id: 935068192166342656,4764882552,en,0,0,0,0,"[{'type': 'replied_to', 'id': '935060150855131137'}]",everyone,Twitter for iPhone,"@DominicRaab Financial firms have been pushing Government for progress on Brexit talks before Christmas as concerns grow continued uncertainty could lead to triggering of further relocation plans.

Bank of England warned this month around 10,000 jobs in UK were at risk on “day one” of Brexit.",2009-02-10T21:49:13.000Z,"Ex Lab GE Candidate. @joecguinan ""With such cognitive firepower, rapier wit & winning personality difficult to believe that you didn't make it into Parliament""",20549706,Francis Eldergill,386,166,13,26244,eldergill,False
5,925853416676646912,author_id: 925853416676646912,coversation_id: 935060150855131137,935060150855131137,2017-11-27T08:31:25.000Z,"[{'start': 0, 'end': 12, 'username': 'DominicRaab', 'id': '4764882552'}]",935063498144534528,id: 935063498144534528,4764882552,en,0,0,0,0,"[{'type': 'replied_to', 'id': '935060150855131137'}]",everyone,Twitter for iPhone,"@DominicRaab Tax is a product of accounts that were prepared some time ago against year end dates well before those account preparation dates. Your point therefore is completely irrelevant, and either deliberate skewed spin, or a complete lack of understanding of the machinations of business",2017-11-01T22:33:50.000Z,"Passionate about fair play, decency and supporting the underdog. Calls out liars, cheats, kleptocrats and crazed power brokers. The polar opposite of Tory",925853416676646912,Lord Tonester,1130,1976,0,1290,Tonester30ccfc1,False
6,784118144751243264,author_id: 784118144751243264,coversation_id: 935060150855131137,935060150855131137,2017-11-27T08:25:27.000Z,"[{'start': 0, 'end': 12, 'username': 'DominicRaab', 'id': '4764882552'}, {'start': 13, 'end': 26, 'username': 'SteveBakerHW', 'id': '15157283'}]",935061995832799232,id: 935061995832799232,4764882552,en,1,0,0,0,"[{'type': 'replied_to', 'id': '935060150855131137'}]",everyone,Twitter for Android,"@DominicRaab @SteveBakerHW Last one for a while. They will pay record taxes to Dublin, Frankfurt and Paris from next year.",2016-10-06T19:48:28.000Z,Brexit grass is greener because it's fertilised with Brexshit.,784118144751243264,Liviu Portaru,890,1525,4,7721,romanian_london,False
