,author_id,author_id_new,conv_id_new,conversation_id,created_at,entities.mentions,id,id_new,in_reply_to_user_id,lang,public_metrics.like_count,public_metrics.quote_count,public_metrics.reply_count,public_metrics.retweet_count,referenced_tweets,reply_settings,source,text,users.created_at,users.description,users.id,users.name,users.public_metrics.followers_count,users.public_metrics.following_count,users.public_metrics.listed_count,users.public_metrics.tweet_count,users.username,users.verified
0,859823232639275008,author_id: 859823232639275008,coversation_id: 1019262671990992897,1019262671990992897,2018-07-17T16:57:03.000Z,"[{'start': 0, 'end': 13, 'username': 'hilarybennmp', 'id': '408454349'}, {'start': 14, 'end': 29, 'username': 'PaulWilliamsMP', 'id': '1191012337597210624'}]",1019264732593819649,id: 1019264732593819649,408454349,en,0,0,0,0,"[{'type': 'replied_to', 'id': '1019262671990992897'}]",everyone,Twitter Web Client,@hilarybennmp @PaulWilliamsMP And in the interests of thousands of jobs.,2017-05-03T17:33:28.000Z,"A Nordie in Occupied North Yorkshire.
Science, health, politics, music, art, sport, craic ... random stuff.",859823232639275008,The Random Coyle 💙,85,373,0,5365,RandomCoyle,False
1,21504766,author_id: 21504766,coversation_id: 1019262671990992897,1019262671990992897,2018-07-17T16:52:52.000Z,"[{'start': 0, 'end': 13, 'username': 'hilarybennmp', 'id': '408454349'}, {'start': 14, 'end': 29, 'username': 'PaulWilliamsMP', 'id': '1191012337597210624'}]",1019263679131471873,id: 1019263679131471873,21504766,en,0,0,0,0,"[{'type': 'replied_to', 'id': '1019263562403975168'}]",everyone,Twitter for iPhone,@hilarybennmp @PaulWilliamsMP Stop this madness. It’s insane,2009-02-21T18:18:21.000Z,"English. But 'Irish 52%, Welsh 22%, Scots 20%, English & NW European 6%'. |Ukrainian Roots on Wife's side | CPFC | Surrey CC | Dulwich CC | DHFC | Bad cricketer",21504766,Nick Rochford,1328,4818,19,69432,NickPRochford,False
2,21504766,author_id: 21504766,coversation_id: 1019262671990992897,1019262671990992897,2018-07-17T16:52:24.000Z,"[{'start': 0, 'end': 13, 'username': 'hilarybennmp', 'id': '408454349'}, {'start': 14, 'end': 29, 'username': 'PaulWilliamsMP', 'id': '1191012337597210624'}]",1019263562403975168,id: 1019263562403975168,408454349,en,1,0,1,0,"[{'type': 'replied_to', 'id': '1019262671990992897'}]",everyone,Twitter for iPhone,"@hilarybennmp @PaulWilliamsMP Yes a good thing I think to have a continuing supply of medicines. Hospital equipment and staff. Food. Supplies. Energy. You know, stuff to keep a country going.

Wtf!!! 

I thought Brexit meant a utopia of riches and delights! EU rolling over! We seem to be salvaging a state.",2009-02-21T18:18:21.000Z,"English. But 'Irish 52%, Welsh 22%, Scots 20%, English & NW European 6%'. |Ukrainian Roots on Wife's side | CPFC | Surrey CC | Dulwich CC | DHFC | Bad cricketer",21504766,Nick Rochford,1328,4818,19,69432,NickPRochford,False
