,author_id,author_id_new,conv_id_new,conversation_id,created_at,entities.mentions,id,id_new,in_reply_to_user_id,lang,public_metrics.like_count,public_metrics.quote_count,public_metrics.reply_count,public_metrics.retweet_count,referenced_tweets,reply_settings,source,text,users.created_at,users.description,users.id,users.name,users.public_metrics.followers_count,users.public_metrics.following_count,users.public_metrics.listed_count,users.public_metrics.tweet_count,users.username,users.verified
14,854659337695965185,author_id: 854659337695965185,coversation_id: 997112986098634752,997112986098634752,2018-05-17T15:05:31.000Z,"[{'start': 0, 'end': 10, 'username': 'JunckerEU', 'id': '169426475'}]",997131001997479936,id: 997131001997479936,169426475,en,0,0,0,0,"[{'type': 'replied_to', 'id': '997112986098634752'}]",everyone,Twitter Web App,"@JunckerEU first, to introduce EU advanced experience to them, who are in different stage od economy development and human development stage, at the same time selectively fund some countries on merit based investment",2017-04-19T11:33:59.000Z,messenger of God. visiting scholar at Duke University(2015-2016). PhD degree holder,854659337695965185,jane,57,170,1,30738,stonemessenger1,False
15,854659337695965185,author_id: 854659337695965185,coversation_id: 997112986098634752,997112986098634752,2018-05-17T15:04:55.000Z,"[{'start': 0, 'end': 10, 'username': 'JunckerEU', 'id': '169426475'}]",997130853422649344,id: 997130853422649344,169426475,en,0,0,0,0,"[{'type': 'replied_to', 'id': '997112986098634752'}]",everyone,Twitter Web App,"@JunckerEU through a single fund instead of being split into 19 different programmes.1

II. Some advice are as follows, 
Global EU to be built well should establish partnership with African Union, Asian Union etc.,",2017-04-19T11:33:59.000Z,messenger of God. visiting scholar at Duke University(2015-2016). PhD degree holder,854659337695965185,jane,57,170,1,30738,stonemessenger1,False
16,854659337695965185,author_id: 854659337695965185,coversation_id: 997112986098634752,997112986098634752,2018-05-17T15:04:36.000Z,"[{'start': 0, 'end': 10, 'username': 'JunckerEU', 'id': '169426475'}]",997130772590063617,id: 997130772590063617,169426475,en,0,0,0,0,"[{'type': 'replied_to', 'id': '997112986098634752'}]",everyone,Twitter Web App,"@JunckerEU According to euoberver, Under the proposal for the 2020-2027 EU budget to be unveiled on Wednesday, the part for foreign aid would rise from €95bn to €123bn, and it would be managed",2017-04-19T11:33:59.000Z,messenger of God. visiting scholar at Duke University(2015-2016). PhD degree holder,854659337695965185,jane,57,170,1,30738,stonemessenger1,False
17,854659337695965185,author_id: 854659337695965185,coversation_id: 997112986098634752,997112986098634752,2018-05-17T15:04:03.000Z,"[{'start': 0, 'end': 10, 'username': 'JunckerEU', 'id': '169426475'}]",997130632538009600,id: 997130632538009600,169426475,en,0,0,0,0,"[{'type': 'replied_to', 'id': '997112986098634752'}]",everyone,Twitter Web App,"@JunckerEU foreign policy instruments – notably aid, neighbourhood policies 
and other external actions. Climate finance from the EU budget will more than double by 2020, to 20% of the total budget.",2017-04-19T11:33:59.000Z,messenger of God. visiting scholar at Duke University(2015-2016). PhD degree holder,854659337695965185,jane,57,170,1,30738,stonemessenger1,False
18,854659337695965185,author_id: 854659337695965185,coversation_id: 997112986098634752,997112986098634752,2018-05-17T15:03:31.000Z,"[{'start': 0, 'end': 10, 'username': 'JunckerEU', 'id': '169426475'}]",997130499188457472,id: 997130499188457472,169426475,en,0,0,0,0,"[{'type': 'replied_to', 'id': '997112986098634752'}]",everyone,Twitter Web App,"@JunckerEU Another comment on EU budget and some advice 

I. From the perspective of ""Global Europe’, 
Military cooperation with NATO in combating terrorism and international aid, neighbourhood policies and other external actions.U",2017-04-19T11:33:59.000Z,messenger of God. visiting scholar at Duke University(2015-2016). PhD degree holder,854659337695965185,jane,57,170,1,30738,stonemessenger1,False
19,854659337695965185,author_id: 854659337695965185,coversation_id: 997112986098634752,997112986098634752,2018-05-17T15:02:25.000Z,"[{'start': 0, 'end': 10, 'username': 'JunckerEU', 'id': '169426475'}]",997130220749586432,id: 997130220749586432,169426475,en,0,0,0,0,"[{'type': 'replied_to', 'id': '997112986098634752'}]",everyone,Twitter Web App,"@JunckerEU Today's topic is as follows,",2017-04-19T11:33:59.000Z,messenger of God. visiting scholar at Duke University(2015-2016). PhD degree holder,854659337695965185,jane,57,170,1,30738,stonemessenger1,False
20,854659337695965185,author_id: 854659337695965185,coversation_id: 997112986098634752,997112986098634752,2018-05-17T15:02:02.000Z,"[{'start': 0, 'end': 10, 'username': 'JunckerEU', 'id': '169426475'}]",997130126029737989,id: 997130126029737989,169426475,en,0,0,0,0,"[{'type': 'replied_to', 'id': '997112986098634752'}]",everyone,Twitter Web App,"@JunckerEU No stronger than such expressions, behalf of host of holy family, say thanks to you, powerful, be blessed!",2017-04-19T11:33:59.000Z,messenger of God. visiting scholar at Duke University(2015-2016). PhD degree holder,854659337695965185,jane,57,170,1,30738,stonemessenger1,False
21,848129753487994880,author_id: 848129753487994880,coversation_id: 997112986098634752,997112986098634752,2018-05-17T15:10:58.000Z,"[{'start': 0, 'end': 10, 'username': 'JunckerEU', 'id': '169426475'}]",997132375430762496,id: 997132375430762496,169426475,en,6,0,1,2,"[{'type': 'replied_to', 'id': '997112986098634752'}]",everyone,Twitter Web Client,"@JunckerEU EU stands with murderer evil theocracy because of economic interest
NASTY!!!
#ShameOnEU",2017-04-01T11:07:45.000Z,"طرفدار استبداد شاه و شیخ 

مرید شهید لاجوردی #مکتب_لاجوردی و دکتر منوچهری

دشمن دولت ملی دکتر مصدق",848129753487994880,Bay ζοκαολμολκ,946,411,5,38241,zokaolmolk3,False
22,745637853087076352,author_id: 745637853087076352,coversation_id: 997112986098634752,997112986098634752,2018-05-17T15:05:14.000Z,"[{'start': 11, 'end': 21, 'username': 'JunckerEU', 'id': '169426475'}]",997130932959305729,id: 997130932959305729,993902107265851392,en,0,0,0,0,"[{'type': 'replied_to', 'id': '997120357680275456'}]",everyone,Twitter for Android,@pachegirr @JunckerEU So you are asking for western intervention in your own country?Haven't you seen what happened in Libya and Syria?,2016-06-22T15:21:32.000Z,The economic crisis had always been there but it got worse each time the masses became conscious of their rights against exploiters...Sankara,745637853087076352,Nqobi,132,142,0,9011,NqobizithaNdl12,False
23,745637853087076352,author_id: 745637853087076352,coversation_id: 997112986098634752,997112986098634752,2018-05-17T14:59:38.000Z,"[{'start': 0, 'end': 14, 'username': 'raskolnikov_m', 'id': '948268770677706752'}, {'start': 15, 'end': 25, 'username': 'JunckerEU', 'id': '169426475'}]",997129520560910336,id: 997129520560910336,948268770677706752,en,0,0,0,0,"[{'type': 'replied_to', 'id': '997127088065929216'}]",everyone,Twitter for Android,@raskolnikov_m @JunckerEU So you would rather have USA attack your country?,2016-06-22T15:21:32.000Z,The economic crisis had always been there but it got worse each time the masses became conscious of their rights against exploiters...Sankara,745637853087076352,Nqobi,132,142,0,9011,NqobizithaNdl12,False
24,948268770677706752,author_id: 948268770677706752,coversation_id: 997112986098634752,997112986098634752,2018-05-17T14:58:10.000Z,"[{'start': 0, 'end': 10, 'username': 'JunckerEU', 'id': '169426475'}]",997129153072812032,id: 997129153072812032,169426475,en,0,0,0,0,"[{'type': 'replied_to', 'id': '997112986098634752'}]",everyone,Twitter Web App,"@JunckerEU The Iranians wants you to stop supporting our authorities, you're so greedy, step out of it and respect the iranian's opinions about the nuclear deal, you earn money by our country and our authorities will spend all this money on terrorism and you know it!!!
Support USA sanctions",2018-01-02T19:04:27.000Z,"I'm an Anti-Fascist
I'm an Anarchist
I'm a Freedom Fighter 
I'm a MetalHead
I'm an Agnostic Existentialist",948268770677706752,Raskolnikov,103,90,0,2696,raskolnikov_m,False
25,948268770677706752,author_id: 948268770677706752,coversation_id: 997112986098634752,997112986098634752,2018-05-17T14:54:38.000Z,"[{'start': 0, 'end': 10, 'username': 'JunckerEU', 'id': '169426475'}]",997128264190742532,id: 997128264190742532,169426475,en,1,0,0,0,"[{'type': 'replied_to', 'id': '997112986098634752'}]",everyone,Twitter Web App,"@JunckerEU European have been cruel to the Iranians by supporting Islamic Republic of Iran authorities, you calme that you're anti imperialism,but it's not true, you're supporting the totaliter regime of Iran,we, the people have suffered enough, step out of this nuclear deal and support USA",2018-01-02T19:04:27.000Z,"I'm an Anti-Fascist
I'm an Anarchist
I'm a Freedom Fighter 
I'm a MetalHead
I'm an Agnostic Existentialist",948268770677706752,Raskolnikov,103,90,0,2696,raskolnikov_m,False
26,948268770677706752,author_id: 948268770677706752,coversation_id: 997112986098634752,997112986098634752,2018-05-17T14:49:58.000Z,"[{'start': 0, 'end': 10, 'username': 'JunckerEU', 'id': '169426475'}]",997127088065929216,id: 997127088065929216,169426475,en,2,0,1,0,"[{'type': 'replied_to', 'id': '997112986098634752'}]",everyone,Twitter Web App,"@JunckerEU European countries do not care about we, the Iranians you lie about how humanist you're, we want you to stop trading with Islamic Republic of Iran authorities, stop supporting the dictator!!!
Let us be free, step out of our issues, you won't help us you want to take advantage!!!",2018-01-02T19:04:27.000Z,"I'm an Anti-Fascist
I'm an Anarchist
I'm a Freedom Fighter 
I'm a MetalHead
I'm an Agnostic Existentialist",948268770677706752,Raskolnikov,103,90,0,2696,raskolnikov_m,False
27,15656814,author_id: 15656814,coversation_id: 997112986098634752,997112986098634752,2018-05-17T14:57:35.000Z,"[{'start': 0, 'end': 10, 'username': 'JunckerEU', 'id': '169426475'}]",997129007199145984,id: 997129007199145984,169426475,en,11,0,0,6,"[{'type': 'replied_to', 'id': '997112986098634752'}]",everyone,Twitter Web Client,"@JunckerEU ""fight against corruption and freedom of expression"" #SPAIN ?
Rapper goes to jail for his song lyrics. The most corrupt party governs in Madrid. No separation of powers. Not worth looking at, Jean-Claude?",2008-07-30T05:21:32.000Z,"Hacking, Freedom, Democracy, Europe 
No tolerance for intolerance.",15656814,Franz Brummer🎗️🇺🇦🇩🇪🇪🇺,388,609,2,4369,linuxfranz,False
28,803279336820371458,author_id: 803279336820371458,coversation_id: 997112986098634752,997112986098634752,2018-05-17T14:34:49.000Z,"[{'start': 0, 'end': 10, 'username': 'JunckerEU', 'id': '169426475'}]",997123277125451777,id: 997123277125451777,169426475,en,3,0,0,0,"[{'type': 'replied_to', 'id': '997112986098634752'}]",everyone,Twitter for iPhone,@JunckerEU Junker have you been drinking again? You talk about fighting corruption and freedom of speach? Take a good look close to home: Spain,2016-11-28T16:48:12.000Z,🎗🎗🎗🎗🎗🎗🎗,803279336820371458,Maricarmen,231,352,1,1999,mclloydhughes,False
29,925132961523040262,author_id: 925132961523040262,coversation_id: 997112986098634752,997112986098634752,2018-05-17T14:33:41.000Z,"[{'start': 0, 'end': 10, 'username': 'JunckerEU', 'id': '169426475'}]",997122990683885568,id: 997122990683885568,169426475,en,8,1,0,3,"[{'type': 'replied_to', 'id': '997112986098634752'}]",everyone,Twitter Web Client,"@JunckerEU ""#RuleOfLaw, fight against corruption and freedom of expression"" so i understood it right? the EU is fighting against the freedom of expression??",2017-10-30T22:51:00.000Z,"Apocalipsis 13:17 ^

Y que ninguno pudiese comprar ó vender, sino el que tuviera la señal, ó el nombre de la bestia, ó el número de su nombre.",925132961523040262,Andi Heinrich,23,151,0,1685,AndiBCN,False
30,3243328102,author_id: 3243328102,coversation_id: 997112986098634752,997112986098634752,2018-05-17T14:23:09.000Z,"[{'start': 0, 'end': 10, 'username': 'JunckerEU', 'id': '169426475'}]",997120341288812544,id: 997120341288812544,169426475,en,2,0,0,1,"[{'type': 'replied_to', 'id': '997112986098634752'}]",everyone,Twitter for iPhone,@JunckerEU Anchored to the EU means no freedom of expression. No flexibility. No nationality except EU,2015-05-09T11:07:10.000Z,,3243328102,It makes no sense,306,238,23,82282,sguitar50,False
31,58797106,author_id: 58797106,coversation_id: 997112986098634752,997112986098634752,2018-05-17T14:19:17.000Z,"[{'start': 0, 'end': 10, 'username': 'JunckerEU', 'id': '169426475'}, {'start': 27, 'end': 40, 'username': 'marianorajoy', 'id': '343447873'}]",997119365924442112,id: 997119365924442112,169426475,en,5,0,0,2,"[{'type': 'replied_to', 'id': '997112986098634752'}]",everyone,Twitter for iPhone,@JunckerEU Unity? Where is @marianorajoy ?,2009-07-21T13:40:12.000Z,"democracy defender, IAM leader, superwoman, mother of 2 great kids, catalana de per vida, lluitadora per la República catalana",58797106,Núria Barceló Peiró 독립!,267,796,0,24627,nuriabp,False
32,768185351764443136,author_id: 768185351764443136,coversation_id: 997112986098634752,997112986098634752,2018-05-17T14:14:18.000Z,"[{'start': 0, 'end': 10, 'username': 'JunckerEU', 'id': '169426475'}, {'start': 11, 'end': 25, 'username': 'EU_Commission', 'id': '157981564'}]",997118114562162689,id: 997118114562162689,169426475,und,0,0,0,0,"[{'type': 'replied_to', 'id': '997112986098634752'}]",everyone,Twitter Web Client,@JunckerEU @EU_Commission 👁️👁️👁️,2016-08-23T20:37:14.000Z,"Solomonar.  Ma numesc Roman Bizantin. Sunt prezent in conturul Romaniei  Vesnice, adica al Noului Bizant.",768185351764443136,Apă   Chioară,815,1440,6,427814,CianGaia,False
33,292869449,author_id: 292869449,coversation_id: 997112986098634752,997112986098634752,2018-05-17T14:11:18.000Z,"[{'start': 0, 'end': 10, 'username': 'JunckerEU', 'id': '169426475'}, {'start': 11, 'end': 25, 'username': 'EU_Commission', 'id': '157981564'}]",997117360355074049,id: 997117360355074049,169426475,en,0,0,0,0,"[{'type': 'replied_to', 'id': '997112986098634752'}]",everyone,Twitter for iPhone,@JunckerEU @EU_Commission I can't wait for Iran to release the names of the western politicians that got bribed when the deal was done. Trump is winning this so easily.,2011-05-04T11:17:44.000Z,What are men to rocks and mountains? #engineer #stopthewars #wikileaks #maga #lockherup #deplorable,292869449,Stefan🇺🇸🇬🇧🤟,91,322,0,2990,zerodeflection,False
34,340834801,author_id: 340834801,coversation_id: 997112986098634752,997112986098634752,2018-05-17T14:08:23.000Z,"[{'start': 0, 'end': 10, 'username': 'JunckerEU', 'id': '169426475'}, {'start': 20, 'end': 33, 'username': 'marianorajoy', 'id': '343447873'}]",997116626087694336,id: 997116626087694336,169426475,en,7,0,0,1,"[{'type': 'replied_to', 'id': '997112986098634752'}]",everyone,Twitter for Android,"@JunckerEU Where is @marianorajoy ??? I don't see him well... Why is he still angry with Kosovo??? He should recognise the state, because it has no sense to continue acting like that, too childish for his age #Marianomadura",2011-07-23T10:31:50.000Z,"Prof. EU Law 🇪🇺 Diplomatic & Consular Law, Historia de la Integración 🇪🇺 @urjc Dr. en Derecho, Historiador, Politólogo. Autor de https://t.co/vTVH9joNRE",340834801,Julio Guinea Bonillo 🌻🇪🇺🏳️‍🌈🇺🇳🌍,2508,2714,37,28680,JulioGuinea,False
35,890335016600915968,author_id: 890335016600915968,coversation_id: 997112986098634752,997112986098634752,2018-05-17T14:03:18.000Z,"[{'start': 0, 'end': 10, 'username': 'JunckerEU', 'id': '169426475'}]",997115345356935168,id: 997115345356935168,169426475,en,0,0,0,0,"[{'type': 'replied_to', 'id': '997112986098634752'}]",everyone,Twitter Web App,@JunckerEU The Truth Will Make Us Free.Deep State&amp;Shadow Goverment is going Down.NESARA ACT IS HAPPENING NOW.Thanks CommanderChiefPresident https://t.co/X71WYGYbSG https://t.co/50ZBJSJSKO more Secret Society1%CowardMultimillonariesCriminals PedophileTerrorist JAZARASASHKENAZI ZIONIST JEWS https://t.co/E6Uu4sr8eg,2017-07-26T22:16:24.000Z,,890335016600915968,EvaristoSilvaCintron,74,896,0,2333,EvaristoCintron,False
36,890335016600915968,author_id: 890335016600915968,coversation_id: 997112986098634752,997112986098634752,2018-05-17T14:01:35.000Z,"[{'start': 0, 'end': 10, 'username': 'JunckerEU', 'id': '169426475'}]",997114914496970752,id: 997114914496970752,169426475,en,0,0,0,0,"[{'type': 'replied_to', 'id': '997112986098634752'}]",everyone,Twitter Web App,@JunckerEU The Truth Will Make Us Free.Deep State&amp;Shadow Goverment is going Down.NESARA ACT IS HAPPENING NOW.Thanks CommanderChiefPresident https://t.co/X71WYGYbSG https://t.co/50ZBJSJSKO more Secret Society1%CowardMultimillonariesCriminals PedophileTerrorist JAZARASASHKENAZI ZIONIST JEWS https://t.co/yB3DREr4Cx,2017-07-26T22:16:24.000Z,,890335016600915968,EvaristoSilvaCintron,74,896,0,2333,EvaristoCintron,False
37,986684435532828672,author_id: 986684435532828672,coversation_id: 997112986098634752,997112986098634752,2018-05-17T14:00:21.000Z,"[{'start': 0, 'end': 10, 'username': 'JunckerEU', 'id': '169426475'}]",997114601664843776,id: 997114601664843776,169426475,de,0,0,0,0,"[{'type': 'replied_to', 'id': '997112986098634752'}]",everyone,Twitter Web App,@JunckerEU 🇪🇺🇦🇱🇪🇺 Western Ballkans 🇪🇺🇦🇱🇪🇺,2018-04-18T19:14:35.000Z,Supporting Albania🇪🇺🇦🇱/ Integration  European🇪🇺🇦🇱 #EU🇪🇺bloc!🇧🇪🇪🇺🇦🇱,986684435532828672,Nueli Liége Belgium🇧🇪🇪🇺🇦🇱#EU,562,4864,4,33999,NueliBelgique,False
38,4406597003,author_id: 4406597003,coversation_id: 997112986098634752,997112986098634752,2018-05-17T13:57:56.000Z,"[{'start': 0, 'end': 10, 'username': 'JunckerEU', 'id': '169426475'}]",997113995533406209,id: 997113995533406209,169426475,en,7,0,0,2,"[{'type': 'replied_to', 'id': '997112986098634752'}]",everyone,Twitter for Android,"@JunckerEU Fight against corruption  ??
And M. RAJOY ???",2015-12-07T16:33:48.000Z,,4406597003,mirtu 🏴󠁧󠁢󠁥󠁮󠁧󠁿,462,852,1,19660,xtudelam,False
39,219958731,author_id: 219958731,coversation_id: 997112986098634752,997112986098634752,2018-05-17T13:54:55.000Z,"[{'start': 0, 'end': 10, 'username': 'JunckerEU', 'id': '169426475'}]",997113237702197248,id: 997113237702197248,169426475,und,2,0,0,1,"[{'type': 'replied_to', 'id': '997112986098634752'}]",everyone,Twitter Web Client,@JunckerEU Hip!!,2010-11-26T11:16:51.000Z,,219958731,Miquel,422,532,7,53733,arch965,False
40,223382695,author_id: 223382695,coversation_id: 997112986098634752,997112986098634752,2018-05-17T13:54:54.000Z,"[{'start': 0, 'end': 10, 'username': 'JunckerEU', 'id': '169426475'}, {'start': 14, 'end': 30, 'username': 'realDonaldTrump', 'id': '25073877'}]",997113232673226753,id: 997113232673226753,169426475,und,0,0,0,0,"[{'type': 'replied_to', 'id': '997112986098634752'}]",everyone,Twitter Web Client,@JunckerEU cc @realDonaldTrump,2010-12-06T06:52:58.000Z,#StandWithUkraine  #NoImpactWoman #stopCapitalism,223382695,Beatrice S.,3973,3708,285,235948,calipette,False
