,author_id,author_id_new,conv_id_new,conversation_id,created_at,entities.mentions,id,id_new,in_reply_to_user_id,lang,public_metrics.like_count,public_metrics.quote_count,public_metrics.reply_count,public_metrics.retweet_count,referenced_tweets,reply_settings,source,text,users.created_at,users.description,users.id,users.name,users.public_metrics.followers_count,users.public_metrics.following_count,users.public_metrics.listed_count,users.public_metrics.tweet_count,users.username,users.verified
56,309874603,author_id: 309874603,coversation_id: 847113369622630402,847113369622630402,2017-04-04T14:13:04.000Z,"[{'start': 0, 'end': 13, 'username': 'mayhew_tanya', 'id': '3310604451'}, {'start': 14, 'end': 26, 'username': 'theresa_may', 'id': '747807250819981312'}]",849263552703713280,id: 849263552703713280,3310604451,en,0,0,0,0,"[{'type': 'replied_to', 'id': '847142197346680833'}]",everyone,Twitter for iPhone,@mayhew_tanya @theresa_may When ???,2011-06-02T20:30:36.000Z,"anti-tory, anti-establishment, politically homeless",309874603,Brian that is called Brian,2316,3016,4,11830,ALANMCALEES,False
57,309874603,author_id: 309874603,coversation_id: 847113369622630402,847113369622630402,2017-04-04T14:03:10.000Z,"[{'start': 0, 'end': 12, 'username': 'theresa_may', 'id': '747807250819981312'}]",849261060586655745,id: 849261060586655745,747807250819981312,en,0,0,0,0,"[{'type': 'replied_to', 'id': '847113369622630402'}]",everyone,Twitter for iPhone,@theresa_may Stop murdering the lower classes generally helps. You can thank me later 👍,2011-06-02T20:30:36.000Z,"anti-tory, anti-establishment, politically homeless",309874603,Brian that is called Brian,2316,3016,4,11830,ALANMCALEES,False
58,2251854811,author_id: 2251854811,coversation_id: 847113369622630402,847113369622630402,2017-04-04T13:41:05.000Z,"[{'start': 0, 'end': 12, 'username': 'theresa_may', 'id': '747807250819981312'}]",849255506300502016,id: 849255506300502016,747807250819981312,en,0,0,0,0,"[{'type': 'replied_to', 'id': '847113369622630402'}]",everyone,Twitter Web Client,@theresa_may From South Africa - absolutely believe you Brits can do it!,2013-12-18T11:30:33.000Z,,2251854811,Ria Wessels,50,82,2,548,RiaWessels4,False
59,40710713,author_id: 40710713,coversation_id: 847113369622630402,847113369622630402,2017-04-04T13:37:29.000Z,"[{'start': 0, 'end': 12, 'username': 'theresa_may', 'id': '747807250819981312'}]",849254600347590657,id: 849254600347590657,747807250819981312,en,0,0,0,0,"[{'type': 'replied_to', 'id': '847113369622630402'}]",everyone,Twitter Web App,@theresa_may Explain how the Pagan fertility tradition of an egg hunt has anything to do with Christianity?,2009-05-17T18:40:13.000Z,There is an objective Truth.,40710713,Chris,65,191,1,2195,FactsNotFoxed,False
60,1277933660,author_id: 1277933660,coversation_id: 847113369622630402,847113369622630402,2017-04-04T13:35:09.000Z,"[{'start': 0, 'end': 12, 'username': 'theresa_may', 'id': '747807250819981312'}]",849254011400331265,id: 849254011400331265,747807250819981312,en,0,0,0,0,"[{'type': 'replied_to', 'id': '847113369622630402'}]",everyone,Twitter for Android,@theresa_may 'And thats why we're spending half a billion on blue passports to appease a few idiots while cutting benefits for kids who've lost a parent',2013-03-18T14:44:52.000Z,"Engineer for work. Musician for fun. Fan of all things post-apocalyptic, extreme metal, hip-hop, animal welfare, zombies, not a fan of lying politicians...",1277933660,Steve,107,237,0,10100,MerkyBlud,False
61,845125591984566273,author_id: 845125591984566273,coversation_id: 847113369622630402,847113369622630402,2017-04-04T13:09:47.000Z,"[{'start': 0, 'end': 12, 'username': 'theresa_may', 'id': '747807250819981312'}]",849247626574934019,id: 849247626574934019,747807250819981312,en,0,0,0,0,"[{'type': 'replied_to', 'id': '847113369622630402'}]",everyone,Twitter Web Client,"@theresa_may Very Good Mrs May,you are really a responsible lady - whole the world is praising for your liberal thought.Britain is really in strong hand.",2017-03-24T04:10:17.000Z,"I am a teacher ,teaching in a reputed public school of Kanpur.I am a liberal minded person who have soft corners for poor and downtrodden.I believe in humanity.",845125591984566273,Durgesh Shukla536,9,77,1,173,durgeshnis,False
62,1384017114,author_id: 1384017114,coversation_id: 847113369622630402,847113369622630402,2017-04-04T12:43:27.000Z,"[{'start': 0, 'end': 9, 'username': 'danidotx', 'id': '27541202'}, {'start': 10, 'end': 25, 'username': 'anton_georgiou', 'id': '71296802'}, {'start': 26, 'end': 38, 'username': 'theresa_may', 'id': '747807250819981312'}]",849240999234764801,id: 849240999234764801,27541202,en,0,0,0,0,"[{'type': 'replied_to', 'id': '849240474414194688'}]",everyone,Twitter Web Client,"@danidotx @anton_georgiou @theresa_may well, it could have been someone supporting brexit, considering this is going to be their major job for 10-20 years, but they are gutless.",2013-04-27T09:42:45.000Z,Scemo chi non legge,1384017114,Daniele Sordi,52,196,1,3976,danielesordi27,False
63,1384017114,author_id: 1384017114,coversation_id: 847113369622630402,847113369622630402,2017-04-04T12:12:27.000Z,"[{'start': 0, 'end': 9, 'username': 'danidotx', 'id': '27541202'}, {'start': 10, 'end': 25, 'username': 'anton_georgiou', 'id': '71296802'}, {'start': 26, 'end': 38, 'username': 'theresa_may', 'id': '747807250819981312'}]",849233200996118530,id: 849233200996118530,27541202,en,0,0,0,0,"[{'type': 'replied_to', 'id': '847153729921056768'}]",everyone,Twitter Web Client,"@danidotx @anton_georgiou @theresa_may well, she could say no to the job, couldn't she?",2013-04-27T09:42:45.000Z,Scemo chi non legge,1384017114,Daniele Sordi,52,196,1,3976,danielesordi27,False
64,1384017114,author_id: 1384017114,coversation_id: 847113369622630402,847113369622630402,2017-04-04T12:11:29.000Z,"[{'start': 0, 'end': 12, 'username': 'theresa_may', 'id': '747807250819981312'}]",849232954761019393,id: 849232954761019393,747807250819981312,en,0,0,0,0,"[{'type': 'replied_to', 'id': '847113369622630402'}]",everyone,Twitter Web Client,@theresa_may fairer for whom? as a start not for bereaved families...,2013-04-27T09:42:45.000Z,Scemo chi non legge,1384017114,Daniele Sordi,52,196,1,3976,danielesordi27,False
65,1384017114,author_id: 1384017114,coversation_id: 847113369622630402,847113369622630402,2017-04-04T12:09:19.000Z,"[{'start': 0, 'end': 12, 'username': 'pamelakerr2', 'id': '322195940'}, {'start': 13, 'end': 25, 'username': 'theresa_may', 'id': '747807250819981312'}, {'start': 34, 'end': 46, 'username': 'theresa_may', 'id': '747807250819981312'}]",849232412190154752,id: 849232412190154752,322195940,en,0,0,0,0,"[{'type': 'replied_to', 'id': '847113603522215936'}]",everyone,Twitter Web Client,@pamelakerr2 @theresa_may you and @theresa_may are leaving? sounds like that would be a better UK.,2013-04-27T09:42:45.000Z,Scemo chi non legge,1384017114,Daniele Sordi,52,196,1,3976,danielesordi27,False
66,865392954,author_id: 865392954,coversation_id: 847113369622630402,847113369622630402,2017-04-04T12:12:47.000Z,"[{'start': 0, 'end': 12, 'username': 'theresa_may', 'id': '747807250819981312'}]",849233283619721217,id: 849233283619721217,747807250819981312,en,2,0,1,0,"[{'type': 'replied_to', 'id': '847113369622630402'}]",everyone,Twitter Web Client,@theresa_may killed many disabled people today ?? or is it too early ??,2012-10-06T22:24:51.000Z,a born Flâneur ............................,865392954,rodney harrison,777,1265,22,18213,1rodneyharrison,False
67,290883,author_id: 290883,coversation_id: 847113369622630402,847113369622630402,2017-04-04T12:01:11.000Z,"[{'start': 0, 'end': 9, 'username': 'etCarloM', 'id': '875476810208817153'}, {'start': 10, 'end': 22, 'username': 'pamelakerr2', 'id': '322195940'}, {'start': 23, 'end': 35, 'username': 'theresa_may', 'id': '747807250819981312'}]",849230364451250177,id: 849230364451250177,997343546,en,0,0,0,0,"[{'type': 'replied_to', 'id': '847122868370591745'}]",everyone,Twitter for Android,@etCarloM @pamelakerr2 @theresa_may Pm is only for the already rich !!,2006-12-27T17:29:10.000Z,"Love F1 and travelling, reading and collecting postcards,lots sent to me from bloggers, Instagram friends around the world.",290883,Anne 🌻💙💛,705,366,43,85182,annief1,False
68,290883,author_id: 290883,coversation_id: 847113369622630402,847113369622630402,2017-04-04T12:00:02.000Z,"[{'start': 0, 'end': 12, 'username': 'pamelakerr2', 'id': '322195940'}, {'start': 13, 'end': 22, 'username': 'etCarloM', 'id': '875476810208817153'}, {'start': 23, 'end': 35, 'username': 'theresa_may', 'id': '747807250819981312'}]",849230074469634052,id: 849230074469634052,322195940,en,1,0,0,0,"[{'type': 'replied_to', 'id': '847138751528812544'}]",everyone,Twitter for Android,@pamelakerr2 @etCarloM @theresa_may Not wrong at all.!!!,2006-12-27T17:29:10.000Z,"Love F1 and travelling, reading and collecting postcards,lots sent to me from bloggers, Instagram friends around the world.",290883,Anne 🌻💙💛,705,366,43,85182,annief1,False
69,290883,author_id: 290883,coversation_id: 847113369622630402,847113369622630402,2017-04-04T11:59:31.000Z,"[{'start': 0, 'end': 12, 'username': 'theresa_may', 'id': '747807250819981312'}]",849229943183724544,id: 849229943183724544,747807250819981312,en,0,0,0,0,"[{'type': 'replied_to', 'id': '847113369622630402'}]",everyone,Twitter for Android,@theresa_may We will choose to support if you SUPPORT US women and give US our pensions. We are not United.,2006-12-27T17:29:10.000Z,"Love F1 and travelling, reading and collecting postcards,lots sent to me from bloggers, Instagram friends around the world.",290883,Anne 🌻💙💛,705,366,43,85182,annief1,False
70,1957507147,author_id: 1957507147,coversation_id: 847113369622630402,847113369622630402,2017-04-04T11:59:37.000Z,"[{'start': 0, 'end': 12, 'username': 'theresa_may', 'id': '747807250819981312'}]",849229968798359552,id: 849229968798359552,747807250819981312,en,0,0,0,0,"[{'type': 'replied_to', 'id': '847113369622630402'}]",everyone,Twitter Web Client,@theresa_may Does that include the poor the disabled and the homeless.. or do you just hope that we will all commit suicide,2013-10-12T20:49:01.000Z,,1957507147,Alun Davies,560,1991,6,4260,AlunlDavies,False
71,4909404477,author_id: 4909404477,coversation_id: 847113369622630402,847113369622630402,2017-04-04T11:32:19.000Z,"[{'start': 0, 'end': 12, 'username': 'theresa_may', 'id': '747807250819981312'}]",849223099082055680,id: 849223099082055680,747807250819981312,en,0,0,0,1,"[{'type': 'replied_to', 'id': '847113369622630402'}]",everyone,Twitter Web App,@theresa_may Not much optimism or hope for 1950's born women humiliated at job centres and pensions paid for stolen #wepaidinyoupayout,2016-02-14T16:12:40.000Z,,4909404477,Maureen Bullock,75,58,3,8701,MaureenBullock9,False
72,21495535,author_id: 21495535,coversation_id: 847113369622630402,847113369622630402,2017-04-04T10:26:35.000Z,"[{'start': 0, 'end': 12, 'username': 'theresa_may', 'id': '747807250819981312'}]",849206555589451778,id: 849206555589451778,747807250819981312,en,1,0,0,0,"[{'type': 'replied_to', 'id': '847113369622630402'}]",everyone,Twitter for iPad,@theresa_may Fairer Britain? Fairer for whom? Your wealthy supporters I would venture,2009-02-21T16:13:27.000Z,"untalented pessimist with psychotic tendencies. Ex wrestler and night club bouncer. My tweets are my own bigoted opinion. If they offend, don't read them",21495535,Bananaman,48,142,2,3510,KeithKeffa,False
73,21582224,author_id: 21582224,coversation_id: 847113369622630402,847113369622630402,2017-04-04T10:22:26.000Z,"[{'start': 0, 'end': 12, 'username': 'theresa_may', 'id': '747807250819981312'}]",849205514919694336,id: 849205514919694336,747807250819981312,en,0,0,0,0,"[{'type': 'replied_to', 'id': '847113369622630402'}]",everyone,Twitter for Android,"@theresa_may Creating more poverty, have not criticised what M.Howard said but are outraged by National Trust Easter egg hunt! Sort your priorities​ out",2009-02-22T17:52:01.000Z,"Disabled activist for disabled rights, equality & against Nationalistic hate, islamaphobia, anti-Semitism & racism of all forms. I will challenge & expose!",21582224,Paloma De Paz ♿,399,1205,2,17108,Pazatodos2017,False
74,2245944139,author_id: 2245944139,coversation_id: 847113369622630402,847113369622630402,2017-04-04T10:13:39.000Z,"[{'start': 0, 'end': 12, 'username': 'theresa_may', 'id': '747807250819981312'}]",849203301556129792,id: 849203301556129792,747807250819981312,en,0,0,0,0,"[{'type': 'replied_to', 'id': '847113369622630402'}]",everyone,Twitter for Android,@theresa_may I think your country would love it if you started doing that too. Or at least stopped doing the opposite so savagely,2013-12-14T17:56:46.000Z,,2245944139,Jessica Adams,11,67,0,37,Jessica54848232,False
75,2184267902,author_id: 2184267902,coversation_id: 847113369622630402,847113369622630402,2017-04-04T09:58:45.000Z,"[{'start': 0, 'end': 12, 'username': 'theresa_may', 'id': '747807250819981312'}, {'start': 13, 'end': 28, 'username': 'Pauline_Latham', 'id': '19087569'}]",849199553668624384,id: 849199553668624384,747807250819981312,en,0,0,0,0,"[{'type': 'replied_to', 'id': '847113369622630402'}]",everyone,Twitter Web Client,@theresa_may @Pauline_Latham Some hopes. I do not think so,2013-11-09T12:49:01.000Z,,2184267902,john freeman,23,302,1,4395,ithastobefun,False
76,848855760209551361,author_id: 848855760209551361,coversation_id: 847113369622630402,847113369622630402,2017-04-04T09:48:46.000Z,"[{'start': 0, 'end': 15, 'username': 'Real1PoundFish', 'id': '579850472'}, {'start': 16, 'end': 28, 'username': 'theresa_may', 'id': '747807250819981312'}]",849197038965112833,id: 849197038965112833,579850472,en,0,0,0,0,"[{'type': 'replied_to', 'id': '847133482111295489'}]",everyone,Twitter Web Client,"@Real1PoundFish @theresa_may from a Chinese view, I think it is a tendency for European country to union rather than break. Union means strength,and strength means power",2017-04-03T11:12:39.000Z,The world is promising as it is changing,848855760209551361,Sun Yan,0,20,0,30,Geek_Sunyan,False
77,3286192064,author_id: 3286192064,coversation_id: 847113369622630402,847113369622630402,2017-04-04T09:29:24.000Z,"[{'start': 0, 'end': 12, 'username': 'theresa_may', 'id': '747807250819981312'}]",849192168313016320,id: 849192168313016320,747807250819981312,ar,0,0,0,0,"[{'type': 'replied_to', 'id': '847113369622630402'}]",everyone,Twitter for Android,@theresa_may يوميات أشهر طفل في العالم في بداية السبعينات هههههه هههههه https://t.co/0k9JygNrAX,2015-07-21T06:13:18.000Z,https://t.co/5D7L0E8KaW or  ?,3286192064,John Makonnen,26,0,1,25527,TalalAlnasi,False
78,3286192064,author_id: 3286192064,coversation_id: 847113369622630402,847113369622630402,2017-04-04T09:27:32.000Z,"[{'start': 0, 'end': 12, 'username': 'theresa_may', 'id': '747807250819981312'}]",849191696328007680,id: 849191696328007680,747807250819981312,ar,0,0,0,0,"[{'type': 'replied_to', 'id': '847113369622630402'}]",everyone,Twitter for Android,@theresa_may ملاحظة صغيرة  = طبعا مو شي جديد على ابن الخادمة حمدة بن زين https://t.co/OFIgORKDdd,2015-07-21T06:13:18.000Z,https://t.co/5D7L0E8KaW or  ?,3286192064,John Makonnen,26,0,1,25527,TalalAlnasi,False
79,3286192064,author_id: 3286192064,coversation_id: 847113369622630402,847113369622630402,2017-04-04T09:24:11.000Z,"[{'start': 0, 'end': 12, 'username': 'theresa_may', 'id': '747807250819981312'}]",849190856150188032,id: 849190856150188032,747807250819981312,ar,0,0,0,0,"[{'type': 'replied_to', 'id': '847113369622630402'}]",everyone,Twitter for Android,@theresa_may من شقة السلامة الي حكومة رقم عشرة  = شهرين و كم يوم و إليزابيث ويندسور كلبة عند ابن الخادمة حمدة بن زين للأبد https://t.co/rocvhzNk2f,2015-07-21T06:13:18.000Z,https://t.co/5D7L0E8KaW or  ?,3286192064,John Makonnen,26,0,1,25527,TalalAlnasi,False
80,2201786204,author_id: 2201786204,coversation_id: 847113369622630402,847113369622630402,2017-04-04T08:36:08.000Z,"[{'start': 0, 'end': 12, 'username': 'theresa_may', 'id': '747807250819981312'}]",849178762092703744,id: 849178762092703744,747807250819981312,en,0,0,0,0,"[{'type': 'replied_to', 'id': '847113369622630402'}]",everyone,Twitter for Android,@theresa_may True meaning of Easter https://t.co/vD7ZZVBWSc,2013-11-18T18:43:46.000Z,"Please stop gaslighting me to think that the UK Gov is anything but incompetent
anti-Vaxxers/anti-maskers will probably be blocked
Green isn't a creative colour",2201786204,Just Paul 📸 🗺️🎥🏞️,467,205,42,116838,S1R1USme,False
81,771448913022844928,author_id: 771448913022844928,coversation_id: 847113369622630402,847113369622630402,2017-04-04T07:33:41.000Z,"[{'start': 0, 'end': 12, 'username': 'theresa_may', 'id': '747807250819981312'}]",849163045725241348,id: 849163045725241348,747807250819981312,en,0,0,0,0,"[{'type': 'replied_to', 'id': '847113369622630402'}]",everyone,Twitter Web App,"@theresa_may You r trying to build your new Britain on foundations of lies, fear n prejudice. I can't support it . I have been robbed and EU scapegoated.",2016-09-01T20:45:28.000Z,British and European,771448913022844928,Louise 🔸#FBPE,779,1189,12,7115,lou4europe1,False
82,3165940361,author_id: 3165940361,coversation_id: 847113369622630402,847113369622630402,2017-04-04T05:14:27.000Z,"[{'start': 0, 'end': 9, 'username': 'etCarloM', 'id': '875476810208817153'}, {'start': 10, 'end': 22, 'username': 'pamelakerr2', 'id': '322195940'}, {'start': 23, 'end': 35, 'username': 'theresa_may', 'id': '747807250819981312'}]",849128006845169664,id: 849128006845169664,997343546,en,0,0,0,0,"[{'type': 'replied_to', 'id': '847122868370591745'}]",everyone,Twitter for iPhone,@etCarloM @pamelakerr2 @theresa_may in this government they've significantly improved my life can't fault them,2015-04-14T11:17:07.000Z,"@boro @DallasCowboys fan, Sport Scientist at @duranceperform, BSc/MSc, Investor of Stocks, Crypto and NFT",3165940361,Anthony Durance🏴󠁧󠁢󠁥󠁮󠁧󠁿,188,111,11,8593,AnthonyDurance,False
83,847531316233068545,author_id: 847531316233068545,coversation_id: 847113369622630402,847113369622630402,2017-04-03T21:12:22.000Z,"[{'start': 0, 'end': 10, 'username': 'johnmknox', 'id': '310643025'}, {'start': 11, 'end': 20, 'username': 'danidotx', 'id': '27541202'}, {'start': 21, 'end': 31, 'username': 'DJTone911', 'id': '2781127779'}, {'start': 32, 'end': 44, 'username': 'theresa_may', 'id': '747807250819981312'}]",849006684941037568,id: 849006684941037568,310643025,en,0,0,0,0,"[{'type': 'replied_to', 'id': '848996654594359296'}]",everyone,Twitter for Android,@johnmknox @danidotx @DJTone911 @theresa_may Jeremy Clarkson? That's stupid.,2017-03-30T19:29:47.000Z,Campaigning against class descrimination. Outlaw private schools in the UK. Expose posh corruption.,847531316233068545,Comp View,13,107,0,2684,CompView1,False
84,847531316233068545,author_id: 847531316233068545,coversation_id: 847113369622630402,847113369622630402,2017-04-03T19:40:52.000Z,"[{'start': 0, 'end': 12, 'username': 'theresa_may', 'id': '747807250819981312'}]",848983661521367040,id: 848983661521367040,747807250819981312,fr,0,0,0,0,"[{'type': 'replied_to', 'id': '847113369622630402'}]",everyone,Twitter for Android,@theresa_may Pompous,2017-03-30T19:29:47.000Z,Campaigning against class descrimination. Outlaw private schools in the UK. Expose posh corruption.,847531316233068545,Comp View,13,107,0,2684,CompView1,False
85,847531316233068545,author_id: 847531316233068545,coversation_id: 847113369622630402,847113369622630402,2017-04-03T19:40:28.000Z,"[{'start': 0, 'end': 12, 'username': 'theresa_may', 'id': '747807250819981312'}]",848983558240841728,id: 848983558240841728,747807250819981312,en,0,0,0,0,"[{'type': 'replied_to', 'id': '847113369622630402'}]",everyone,Twitter for Android,@theresa_may Give us a break. You sound like a vicar.,2017-03-30T19:29:47.000Z,Campaigning against class descrimination. Outlaw private schools in the UK. Expose posh corruption.,847531316233068545,Comp View,13,107,0,2684,CompView1,False
86,847531316233068545,author_id: 847531316233068545,coversation_id: 847113369622630402,847113369622630402,2017-04-03T19:38:58.000Z,"[{'start': 0, 'end': 10, 'username': 'DJTone911', 'id': '2781127779'}, {'start': 11, 'end': 23, 'username': 'theresa_may', 'id': '747807250819981312'}]",848983180011069440,id: 848983180011069440,2781127779,en,0,0,0,0,"[{'type': 'replied_to', 'id': '847113986667679746'}]",everyone,Twitter for Android,@DJTone911 @theresa_may There's a difference between dreaming and reality. You will find out. 20% unemployment and raging inflation,2017-03-30T19:29:47.000Z,Campaigning against class descrimination. Outlaw private schools in the UK. Expose posh corruption.,847531316233068545,Comp View,13,107,0,2684,CompView1,False
87,847531316233068545,author_id: 847531316233068545,coversation_id: 847113369622630402,847113369622630402,2017-04-03T19:37:33.000Z,"[{'start': 0, 'end': 12, 'username': 'theresa_may', 'id': '747807250819981312'}]",848982824153743360,id: 848982824153743360,747807250819981312,en,0,0,0,0,"[{'type': 'replied_to', 'id': '847113369622630402'}]",everyone,Twitter for Android,@theresa_may Will you start by banning recruitment from public school backgrounds? And freezing promotion similarly? Don't talk about fairness   .,2017-03-30T19:29:47.000Z,Campaigning against class descrimination. Outlaw private schools in the UK. Expose posh corruption.,847531316233068545,Comp View,13,107,0,2684,CompView1,False
88,847531316233068545,author_id: 847531316233068545,coversation_id: 847113369622630402,847113369622630402,2017-04-03T19:35:16.000Z,"[{'start': 0, 'end': 9, 'username': 'danidotx', 'id': '27541202'}, {'start': 10, 'end': 20, 'username': 'DJTone911', 'id': '2781127779'}, {'start': 21, 'end': 33, 'username': 'theresa_may', 'id': '747807250819981312'}]",848982251316662272,id: 848982251316662272,847531316233068545,en,0,0,1,0,"[{'type': 'replied_to', 'id': '848981877218312193'}]",everyone,Twitter for Android,@danidotx @DJTone911 @theresa_may The upper classes will just pay more for their cars. Not sure what we offer that Europe will want that much.,2017-03-30T19:29:47.000Z,Campaigning against class descrimination. Outlaw private schools in the UK. Expose posh corruption.,847531316233068545,Comp View,13,107,0,2684,CompView1,False
89,847531316233068545,author_id: 847531316233068545,coversation_id: 847113369622630402,847113369622630402,2017-04-03T19:33:47.000Z,"[{'start': 0, 'end': 9, 'username': 'danidotx', 'id': '27541202'}, {'start': 10, 'end': 20, 'username': 'DJTone911', 'id': '2781127779'}, {'start': 21, 'end': 33, 'username': 'theresa_may', 'id': '747807250819981312'}]",848981877218312193,id: 848981877218312193,27541202,en,0,0,2,0,"[{'type': 'replied_to', 'id': '847153335744577539'}]",everyone,Twitter for Android,@danidotx @DJTone911 @theresa_may Imagine uk was enthusiastic about eu and France left. We would want go see them go down the drain. Better get ready for hard times everyone,2017-03-30T19:29:47.000Z,Campaigning against class descrimination. Outlaw private schools in the UK. Expose posh corruption.,847531316233068545,Comp View,13,107,0,2684,CompView1,False
90,847531316233068545,author_id: 847531316233068545,coversation_id: 847113369622630402,847113369622630402,2017-04-03T19:20:39.000Z,"[{'start': 0, 'end': 12, 'username': 'theresa_may', 'id': '747807250819981312'}, {'start': 13, 'end': 27, 'username': 'Conservatives', 'id': '14281853'}]",848978572882661378,id: 848978572882661378,747807250819981312,en,0,0,0,0,"[{'type': 'replied_to', 'id': '847113369622630402'}]",everyone,Twitter for Android,@theresa_may @Conservatives I took the trouble to read your mirror article. It says nothing. Don't waste my time again. Liar.,2017-03-30T19:29:47.000Z,Campaigning against class descrimination. Outlaw private schools in the UK. Expose posh corruption.,847531316233068545,Comp View,13,107,0,2684,CompView1,False
91,740844699238404096,author_id: 740844699238404096,coversation_id: 847113369622630402,847113369622630402,2017-04-03T20:28:07.000Z,"[{'start': 0, 'end': 12, 'username': 'theresa_may', 'id': '747807250819981312'}]",848995550523535360,id: 848995550523535360,747807250819981312,en,0,0,0,0,"[{'type': 'replied_to', 'id': '847113369622630402'}]",everyone,Twitter for iPhone,@theresa_may Be stronger👊🏻👊🏻,2016-06-09T09:55:15.000Z,,740844699238404096,Xuanbing Wu,0,34,0,3,XuanbingWu,False
92,4353855034,author_id: 4353855034,coversation_id: 847113369622630402,847113369622630402,2017-04-03T20:01:57.000Z,"[{'start': 0, 'end': 12, 'username': 'theresa_may', 'id': '747807250819981312'}, {'start': 13, 'end': 28, 'username': 'JoRichardsKent', 'id': '419927046'}]",848988965248139264,id: 848988965248139264,747807250819981312,tl,0,0,0,0,"[{'type': 'replied_to', 'id': '847113369622630402'}]",everyone,Twitter Web Client,@theresa_may @JoRichardsKent Ha ha ha!,2015-12-02T19:51:40.000Z,"NB Hodmadod is home - now cruising full time. Love of photography, walking - with dogs. Hate of Brexit #FBPE #OldiesAgainstBrexit",4353855034,Hoddy_tog #FBPE,2370,2551,9,47610,hoddydod70,False
