,author_id,author_id_new,conv_id_new,conversation_id,created_at,entities.mentions,id,id_new,in_reply_to_user_id,lang,public_metrics.like_count,public_metrics.quote_count,public_metrics.reply_count,public_metrics.retweet_count,referenced_tweets,reply_settings,source,text,users.created_at,users.description,users.id,users.name,users.public_metrics.followers_count,users.public_metrics.following_count,users.public_metrics.listed_count,users.public_metrics.tweet_count,users.username,users.verified
0,2666095500,author_id: 2666095500,coversation_id: 587941282191925248,587941282191925248,2015-04-14T21:55:07.000Z,"[{'start': 0, 'end': 13, 'username': 'BorisJohnson', 'id': '3131144855'}, {'start': 34, 'end': 48, 'username': 'Conservatives', 'id': '14281853'}]",588098179587006465,id: 588098179587006465,3131144855,en,0,0,0,0,"[{'type': 'replied_to', 'id': '587941282191925248'}]",everyone,Twitter Web Client,"@BorisJohnson Define 'leadership"" @Conservatives
It is a little more than a boy scout badge.",2014-07-21T15:06:19.000Z,"This account set-up specifically to aid a 38-Degrees related campaign at, https://t.co/4feb8ftgNQ Savers_are_Losers,_Stop_it!  PLEASE_ADD_SIGNATURE",2666095500,Madger,123,53,13,25977,MervynRandall,False
1,602615258,author_id: 602615258,coversation_id: 587941282191925248,587941282191925248,2015-04-14T19:47:21.000Z,"[{'start': 0, 'end': 13, 'username': 'BorisJohnson', 'id': '3131144855'}]",588066027407310848,id: 588066027407310848,3131144855,en,0,0,0,0,"[{'type': 'replied_to', 'id': '587941282191925248'}]",everyone,Twitter for iPhone,@BorisJohnson what a comedian!,2012-06-08T09:33:42.000Z,OWN or BE OWNED #Taxiapp #net #contributor https://t.co/eVHl0MSZ3O @taxiappLDN,602615258,#LondonTaxi,2636,5004,141,73205,charlesthecab,False
2,3022362551,author_id: 3022362551,coversation_id: 587941282191925248,587941282191925248,2015-04-14T12:53:22.000Z,"[{'start': 0, 'end': 13, 'username': 'BorisJohnson', 'id': '3131144855'}]",587961845690011648,id: 587961845690011648,3131144855,en,0,0,0,0,"[{'type': 'replied_to', 'id': '587941282191925248'}]",everyone,Twitter for iPhone,@BorisJohnson  look at the stats. No 1 wants rite 2 buy Shouldnt have sold coun. houses #NationalHousingFederation #keepsocialhousingsocial,2015-02-06T23:10:10.000Z,"Wife, mum, history student, lover of crochet and chocolate, musicals and real football. A Daughter of The King.",3022362551,julie inan,25,598,0,352,joolsinan,False
3,625055347,author_id: 625055347,coversation_id: 587941282191925248,587941282191925248,2015-04-14T12:32:01.000Z,"[{'start': 0, 'end': 13, 'username': 'BorisJohnson', 'id': '3131144855'}, {'start': 14, 'end': 28, 'username': 'Conservatives', 'id': '14281853'}]",587956472488706048,id: 587956472488706048,3131144855,en,0,0,0,0,"[{'type': 'replied_to', 'id': '587941282191925248'}]",everyone,Twitter Web Client,@BorisJohnson @Conservatives Has he been investigated yet for allegations he was involved in black market nuclear weapon sales in 80's?,2012-07-02T22:27:34.000Z,Dignity Alliance member. Advocate for MYOB and individual freedoms. Bullshit filter stockist and wholesaler. Ashton Meet host.,625055347,robofclanLennox,114,296,1,2983,ilovemondays1,False
4,264184535,author_id: 264184535,coversation_id: 587941282191925248,587941282191925248,2015-04-14T11:41:02.000Z,"[{'start': 0, 'end': 13, 'username': 'BorisJohnson', 'id': '3131144855'}, {'start': 14, 'end': 28, 'username': 'Conservatives', 'id': '14281853'}]",587943642729488386,id: 587943642729488386,3131144855,en,0,0,0,0,"[{'type': 'replied_to', 'id': '587941282191925248'}]",everyone,Twitter for Windows Phone,"@BorisJohnson @Conservatives the only way to a better future for all, #vote Conservative",2011-03-11T13:46:29.000Z,I don't have everything I want but I've have everything I need. Thanks for an amazing family. living in the most beautiful part of the UK 🏴󠁧󠁢󠁷󠁬󠁳󠁿,264184535,Gary S 🇬🇧 🏴󠁧󠁢󠁥󠁮󠁧󠁿,469,817,3,4852,BADWOLF765,False
5,2755907946,author_id: 2755907946,coversation_id: 587941282191925248,587941282191925248,2015-04-14T11:40:13.000Z,"[{'start': 0, 'end': 13, 'username': 'BorisJohnson', 'id': '3131144855'}, {'start': 14, 'end': 29, 'username': 'claire4devizes', 'id': '937993555481636864'}, {'start': 30, 'end': 44, 'username': 'Conservatives', 'id': '14281853'}]",587943438978523136,id: 587943438978523136,3131144855,en,0,0,0,0,"[{'type': 'replied_to', 'id': '587941282191925248'}]",everyone,Twitter for Android,@BorisJohnson @claire4devizes @Conservatives No mention of Europe really..,2014-08-22T18:11:34.000Z,2 kids + 2 dogs + 1 wife,2755907946,Paul Trowell,76,94,0,3288,ptrowell56,False
6,168839417,author_id: 168839417,coversation_id: 587941282191925248,587941282191925248,2015-04-14T11:38:59.000Z,"[{'start': 0, 'end': 13, 'username': 'BorisJohnson', 'id': '3131144855'}, {'start': 14, 'end': 28, 'username': 'Conservatives', 'id': '14281853'}]",587943124699324417,id: 587943124699324417,3131144855,en,0,0,0,0,"[{'type': 'replied_to', 'id': '587941282191925248'}]",everyone,Twitter Web Client,@BorisJohnson @Conservatives N'aww. Did he ruffle your hair for you so you look nice and silly and buffoonish?,2010-07-20T22:45:40.000Z,"Former journalist/sports reporter, currently have no idea but its fun so who cares. Winner of the 2005 Year Six St Peters Primary 100m sprint (he/him)",168839417,Aidan Williams,407,1039,9,21958,aidanwilliams44,False
7,3080208430,author_id: 3080208430,coversation_id: 587941282191925248,587941282191925248,2015-04-14T11:37:06.000Z,"[{'start': 0, 'end': 13, 'username': 'BorisJohnson', 'id': '3131144855'}, {'start': 14, 'end': 28, 'username': 'Conservatives', 'id': '14281853'}]",587942653821636608,id: 587942653821636608,3131144855,en,1,0,0,0,"[{'type': 'replied_to', 'id': '587941282191925248'}]",everyone,Twitter for Android,@BorisJohnson @Conservatives you will be known as the mayor who sold the London Taxi trade!! Shame on you,2015-03-08T20:00:34.000Z,,3080208430,John Garrad ,105,188,3,955,JgThereverened,False
8,2991735843,author_id: 2991735843,coversation_id: 587941282191925248,587941282191925248,2015-04-14T11:33:19.000Z,"[{'start': 0, 'end': 13, 'username': 'BorisJohnson', 'id': '3131144855'}, {'start': 14, 'end': 28, 'username': 'Conservatives', 'id': '14281853'}]",587941700661817344,id: 587941700661817344,3131144855,en,0,0,0,0,"[{'type': 'replied_to', 'id': '587941282191925248'}]",everyone,Twitter for iPhone,@BorisJohnson @Conservatives spot on.,2015-01-22T10:03:43.000Z,Former Conservative parliamentary candidate for Brent Central. News & views on national and local politics. All tweets are my personal opinions. RT≠endorsement.,2991735843,Alan Mendoza,263,291,25,594,AlanMPolitics,False
