,author_id,author_id_new,conv_id_new,conversation_id,created_at,entities.mentions,id,id_new,in_reply_to_user_id,lang,public_metrics.like_count,public_metrics.quote_count,public_metrics.reply_count,public_metrics.retweet_count,referenced_tweets,reply_settings,source,text,users.created_at,users.description,users.id,users.name,users.public_metrics.followers_count,users.public_metrics.following_count,users.public_metrics.listed_count,users.public_metrics.tweet_count,users.username,users.verified
0,2504076325,author_id: 2504076325,coversation_id: 1043145363128033281,1043145363128033281,2018-09-21T16:29:49.000Z,"[{'start': 0, 'end': 11, 'username': 'cbicarolyn', 'id': '4178442737'}]",1043175474443288576,id: 1043175474443288576,4178442737,en,0,0,0,0,"[{'type': 'replied_to', 'id': '1043145363128033281'}]",everyone,Twitter for iPad,@cbicarolyn Then let's cancel Brexit indefinitely?!,2014-05-18T10:17:07.000Z,"The track stretches out in front of you, opportunity knocks, but will you take it?  

Life long Blades fan.",2504076325,Phil Hindley,170,477,4,57975,blademanphil,False
1,540113771,author_id: 540113771,coversation_id: 1043145363128033281,1043145363128033281,2018-09-21T15:46:53.000Z,"[{'start': 0, 'end': 11, 'username': 'cbicarolyn', 'id': '4178442737'}]",1043164671749054464,id: 1043164671749054464,4178442737,en,0,0,0,0,"[{'type': 'replied_to', 'id': '1043145363128033281'}]",everyone,Mobile Web (M2),"@cbicarolyn Chequers was doomed from the start and now it is dead. Why don't you support the ""Peoples vote""?",2012-03-29T16:44:07.000Z,,540113771,AIDAN TURNER,462,227,2,144731,AIDANTURNER4,False
2,1036024992767651840,author_id: 1036024992767651840,coversation_id: 1043145363128033281,1043145363128033281,2018-09-21T14:41:43.000Z,"[{'start': 0, 'end': 11, 'username': 'cbicarolyn', 'id': '4178442737'}, {'start': 274, 'end': 285, 'username': 'cbicarolyn', 'id': '4178442737'}]",1043148271777181697,id: 1043148271777181697,4178442737,en,1,0,0,0,"[{'type': 'replied_to', 'id': '1043145363128033281'}]",everyone,Twitter Web Client,"@cbicarolyn I disagree. I think we need to endure this short to medium term pain so that we can set ourselves up for good long term prospects. We need to fight for a #PeoplesVote and match every Brexiteer lie with a progressive truth. This is a once in a generation change, @cbicarolyn.",2018-09-01T22:56:21.000Z,,1036024992767651840,Alexander Coleman,46,1407,0,2967,colemalex,False
3,19939011,author_id: 19939011,coversation_id: 1043145363128033281,1043145363128033281,2018-09-21T14:32:11.000Z,"[{'start': 0, 'end': 11, 'username': 'cbicarolyn', 'id': '4178442737'}]",1043145872282931200,id: 1043145872282931200,4178442737,en,1,0,0,1,"[{'type': 'replied_to', 'id': '1043145363128033281'}]",everyone,Twitter for iPhone,"@cbicarolyn May's fantasy propolsals should have been produced, and dismissed by MPs, before we triggered A50. She's just wasting time we do not have.",2009-02-02T22:44:38.000Z,"Me, it's all about me. Oh, and mountain biking, design, music, food (this is not a CV).",19939011,Kelvin Owers,2268,3911,121,119250,spittingcat,False
