,author_id,author_id_new,conv_id_new,conversation_id,created_at,entities.mentions,id,id_new,in_reply_to_user_id,lang,public_metrics.like_count,public_metrics.quote_count,public_metrics.reply_count,public_metrics.retweet_count,referenced_tweets,reply_settings,source,text,users.created_at,users.description,users.id,users.name,users.public_metrics.followers_count,users.public_metrics.following_count,users.public_metrics.listed_count,users.public_metrics.tweet_count,users.username,users.verified
0,976827638,author_id: 976827638,coversation_id: 969564843903717376,969564843903717376,2018-03-03T11:41:50.000Z,"[{'start': 0, 'end': 16, 'username': 'ElenaHildenbra1', 'id': '881986048766730240'}, {'start': 17, 'end': 25, 'username': 'MinPres', 'id': '155507136'}, {'start': 75, 'end': 85, 'username': 'markrutte', 'id': '16708728'}]",969900653094023169,id: 969900653094023169,881986048766730240,nl,0,0,0,0,"[{'type': 'replied_to', 'id': '969579464278659075'}]",everyone,Twitter for Android,@ElenaHildenbra1 @MinPres Is dit bedoeld als uitnodiging aan het adres van @markrutte ??,2012-11-28T19:41:50.000Z,Gevaccineerden zijn net als de kinderen die willen blijven geloven dat Sinterklaas bestaat.,976827638,Als 't mij politiek zo uitkomt schuif ik wet opzij,847,977,7,61559,Zakkenrollen,False
1,4613327727,author_id: 4613327727,coversation_id: 969564843903717376,969564843903717376,2018-03-02T13:58:12.000Z,"[{'start': 0, 'end': 8, 'username': 'MinPres', 'id': '155507136'}]",969572583149654017,id: 969572583149654017,155507136,nl,0,0,0,0,"[{'type': 'replied_to', 'id': '969564843903717376'}]",everyone,Twitter for Android,"@MinPres A deal is a deal, Rutte wil uw stem en belooft.....
Oh én, de moordenaar van Pim komt NÓÓIT meer op vrije voeten, echt waar!

Rot toch op vieze leugenaar https://t.co/dm7Muraj3U",2015-12-26T18:30:06.000Z,"List=block.
Extreem linksche deugmenschen eet ik als ontbijt. Blank (niet wit); Ik (ont-)volg terug. (Telegram: Patriotov, Parler: Patriotov @Borealist)",4613327727,"Patriotov Альфред, Borealist+#TeamThierry",3113,3347,1,135428,NLDPatriot,False
2,30619156,author_id: 30619156,coversation_id: 969564843903717376,969564843903717376,2018-03-02T13:33:44.000Z,"[{'start': 0, 'end': 8, 'username': 'MinPres', 'id': '155507136'}]",969566428868284417,id: 969566428868284417,155507136,en,0,0,0,0,"[{'type': 'replied_to', 'id': '969564843903717376'}]",everyone,Twitter Web Client,"@MinPres Complex, some errors, e.g. pronunciation of 'analysis', repetition, not up to usual high standard (fatigue?). Sometimes less is more. Better than Mrs May's effort, which was postponed due to snow.",2009-04-12T07:21:46.000Z,"Scientist with disability who spent over 30 years studying menstrual cycle, ME, MCS, psychologisation and cyberbullying. Now focused on writing.",30619156,Ellen Goudsmit,281,77,8,7670,EllenGoudsmit,False
