,author_id,author_id_new,conv_id_new,conversation_id,created_at,entities.mentions,id,id_new,in_reply_to_user_id,lang,public_metrics.like_count,public_metrics.quote_count,public_metrics.reply_count,public_metrics.retweet_count,referenced_tweets,reply_settings,source,text,users.created_at,users.description,users.id,users.name,users.public_metrics.followers_count,users.public_metrics.following_count,users.public_metrics.listed_count,users.public_metrics.tweet_count,users.username,users.verified
0,2356127598,author_id: 2356127598,coversation_id: 663889439828103168,663889439828103168,2015-11-10T18:45:17.000Z,"[{'start': 17, 'end': 29, 'username': 'wolfblitzer', 'id': '71294756'}, {'start': 30, 'end': 41, 'username': 'CNNSitRoom', 'id': '34310801'}]",664151860778016773,id: 664151860778016773,2653613168,en,0,0,0,0,"[{'type': 'replied_to', 'id': '663889439828103168'}]",everyone,Twitter for iPhone,“@PHammondMP: w/ @wolfblitzer @CNNSitRoom on how #UK is opposing #ISIL/#ISIS &amp; why we had to suspend #Sharm flights https://t.co/GdcA92atjm,2014-02-22T10:09:33.000Z,"Reshaping the World: Ethics, Global Governance, Policy & Strategy in the New Millennium, Editor Pedro Meléndez-Ortiz #DigitalDiplomacy",2356127598,Diplomacy140,4023,1768,238,123309,Diplomacy140,False
1,276409278,author_id: 276409278,coversation_id: 663889439828103168,663889439828103168,2015-11-10T13:48:10.000Z,"[{'start': 12, 'end': 24, 'username': 'wolfblitzer', 'id': '71294756'}, {'start': 25, 'end': 36, 'username': 'CNNSitRoom', 'id': '34310801'}]",664077088425644032,id: 664077088425644032,2653613168,en,0,0,0,0,"[{'type': 'replied_to', 'id': '663889439828103168'}]",everyone,Twitter for Android,@PHammondMP @wolfblitzer @CNNSitRoom why is it u refuse to discuss the root -  persia until then there will be no peace. Selah,2011-04-03T09:03:02.000Z,"An inspirational writer,concerned four events  at the centre of the earthe..Thee New...Jerusalem,  Thee.. City wherein Thee Divine Order of G-D Resideth. Selah",276409278,Keith Niven,32,34,1,3538,HorisonCon,False
2,895570464,author_id: 895570464,coversation_id: 663889439828103168,663889439828103168,2015-11-10T11:22:52.000Z,"[{'start': 12, 'end': 24, 'username': 'wolfblitzer', 'id': '71294756'}, {'start': 25, 'end': 36, 'username': 'CNNSitRoom', 'id': '34310801'}]",664040520491077633,id: 664040520491077633,2653613168,en,1,0,0,0,"[{'type': 'replied_to', 'id': '663889439828103168'}]",everyone,Twitter for Android,@PHammondMP @wolfblitzer @CNNSitRoom Why does the main driver of this chaos; #SaudiArabia never come up as  a malevolent force?,2012-10-21T15:29:28.000Z,"Secularism, Anglo-European, Everton, Blade Runner, Dogma, Joy Division, Camden Hells, Bill Hicks, Christopher Hitchens, Iain M Banks.",895570464,Neil Shima. 😷 💙🇺🇦,879,820,45,45279,StickMan_v7,False
3,53619757,author_id: 53619757,coversation_id: 663889439828103168,663889439828103168,2015-11-10T09:39:08.000Z,"[{'start': 22, 'end': 34, 'username': 'wolfblitzer', 'id': '71294756'}, {'start': 35, 'end': 46, 'username': 'CNNSitRoom', 'id': '34310801'}]",664014416510226434,id: 664014416510226434,2653613168,en,1,0,0,0,"[{'type': 'replied_to', 'id': '663889439828103168'}]",everyone,Twitter Web Client,@PHammondMP @FarahFCO @wolfblitzer @CNNSitRoom Can you ask him what does it mean #UK could not inform #Egypt for obvious reasons?,2009-07-04T07:09:19.000Z,,53619757,Ashraf ElShahat,468,301,7,20574,ashrafelshahat,False
4,3293858735,author_id: 3293858735,coversation_id: 663889439828103168,663889439828103168,2015-11-10T08:53:23.000Z,"[{'start': 12, 'end': 24, 'username': 'wolfblitzer', 'id': '71294756'}, {'start': 25, 'end': 36, 'username': 'CNNSitRoom', 'id': '34310801'}]",664002905150763008,id: 664002905150763008,2653613168,en,0,0,0,0,"[{'type': 'replied_to', 'id': '663889439828103168'}]",everyone,Twitter Web Client,@PHammondMP @wolfblitzer @CNNSitRoom Why do you avoid talking to British people? Is it because you lie to us? Or are we just plebs?,2015-05-22T10:14:52.000Z,"Cyclist, campaigner, gardener, dog walker, sports fan. To old to be told what to do. Save our NHS from Tory tax dodgers.",3293858735,Mark,2281,2034,4,17336,markedwards001,False
5,1346434040,author_id: 1346434040,coversation_id: 663889439828103168,663889439828103168,2015-11-10T05:12:12.000Z,"[{'start': 12, 'end': 24, 'username': 'wolfblitzer', 'id': '71294756'}, {'start': 25, 'end': 36, 'username': 'CNNSitRoom', 'id': '34310801'}]",663947242622033920,id: 663947242622033920,2653613168,en,1,0,0,0,"[{'type': 'replied_to', 'id': '663889439828103168'}]",everyone,Twitter for Android,@PHammondMP @wolfblitzer @CNNSitRoom Philip I just don't understand why you won't talk to UK tv like this,2013-04-12T09:42:35.000Z,"Hanging on to life by my finger tips, but trying to enjoy the odd moment.",1346434040,Matthew Gordon-Banks,3667,3262,62,82999,mwgbanks,False
